날짜,리뷰,별점,month,리뷰1,리뷰2
2021년 10월 19일,이전버전이 훨 낫네요 미니금고는 왜 숨겨놨으며 앱 킬때 나는 띠링 소리는 최악이에요,1,2021년,이전버전이 훨 낫네요 미니금고는 왜 숨겨놨으며 앱 킬때 나는 띠링 소리는 최악이에요,"['이전', '버전', '미니', '금고', '킬때', '띠링', '소리', '최악']"
2020년 12월 22일,송금도 편하고 미니금고도 주사위던지기 재미있어요,5,2020년,송금도 편하고 미니금고도 주사위던지기 재미있어요,"['송금', '미니', '금고', '주사위', '던지기', '재미']"
2022년 4월 27일,증권쪽 ui개선이 시급함. 난잡해서 보기 어려움.,1,2022년,증권쪽 UI개선이 시급함 난잡해서 보기 어려움,"['증권', '개선', '시급', '난잡', '어려움']"
2020년 5월 11일,로그인 할려보 하니깐 세션이 만료되어 로그인이 안됨,1,2020년,로그인 할려보 하니깐 세션이 만료되어 로그인이 안됨,"['로그인', '세션', '만료', '로그인']"
2021년 7월 1일,좀전에 갑자기 지방세입 전자고지서가 해지되었다는 톡이왔어요 저는 해지하지않았는데 왜그런가요? 그후에 다시 재신청했습니다만 이유를 알려주세요,2,2021년,좀전에 갑자기 지방세입 전자고지서가 해지되었다는 톡이왔어요 저는 해지하지않았는데 왜그런가요 그후에 다시 재신청했습니다만 이유를 알려주세요,"['지방세', '전자', '고지서', '해지', '지하', '왜그', '런가', '신청', '다만']"
2021년 7월 9일,휴면계정처리 되서 재등록 하려해도 재등 록이 안되요,3,2021년,휴면계정처리 되서 재등록 하려해도 재등 록이 안되요,"['휴면', '계정', '처리', '등록', '재등']"
2021년 3월 26일,계속 오류떠요 체크카드만들어야되는데 제대로 다했는디,1,2021년,계속 오류떠요 체크카드만들어야되는데 제대로 다했는디,"['오류', '체크카드', '제대로']"
2021년 2월 10일,결제 송금 다 점검 시간에 다 막아놓으면 결제를 어떻게 합니까?? 축구볼려고 일찍 일어나서 결제해서 볼려고 했는데 너무 아쉽네여 딱 축구 끝날 시간에 점검 끝나고 ㅜㅜ 잠도 안오는데 ..,3,2021년,결제 송금 다 점검 시간에 다 막아놓으면 결제를 어떻게 합니까 축구볼려고 일찍 일어나서 결제해서 볼려고 했는데 너무 아쉽네여 딱 축구 끝날 시간에 점검 끝나고 잠도 안오는데,"['결제', '송금', '점검', '시간', '결제', '축구', '일찍', '일어나서', '결제', '축구', '시간', '점검', '잠도']"
2021년 11월 15일,모바일교통카드 메뉴를 도저히 못 찾겠어요,3,2021년,모바일교통카드 메뉴를 도저히 못 찾겠어요,"['모바일', '교통카드', '메뉴', '도저히']"
2022년 5월 29일,아니 뭔 주민등록 번호를 다 꽉 채워 적어도 확인버튼이 활성화가 처 안됌?,1,2022년,아니 뭔 주민등록 번호를 다 꽉 채워 적어도 확인버튼이 활성화가 처 안됌,"['주민등록', '번호', '어도', '버튼', '활성화']"
2022년 7월 14일,지금 결제하려는데 자꾸 에러떠서 네이버 페이로 결제했네요 네트워크오류 라고 나오는데 네이버는 잘되는데 왜그럴까요,2,2022년,지금 결제하려는데 자꾸 에러떠서 네이버 페이로 결제했네요 네트워크오류 라고 나오는데 네이버는 잘되는데 왜그럴까요,"['결제', '에러', '결제', '네트워크', '오류']"
2022년 3월 17일,오늘은 접속도 안되네...진짜 짜증난다 소액도 아깝~,1,2022년,오늘은 접속도 안되네 진짜 짜증난다 소액도 아깝,"['오늘', '접속', '짜증', '소액']"
2019년 10월 7일,위젯사용하려고 꺼내면 한국통신사 가입자에한해서 사용이가능하다고뜨고 위젯설치가안됩니다. 분명 skt장기가입자인데 한국통신사가아니라니..오류인가요?찜찜하네요,2,2019년,위젯사용하려고 꺼내면 한국통신사 가입자에한해서 사용이가능하다고뜨고 위젯설치가안됩니다 분명 SKT장기가입자인데 한국통신사가아니라니 오류인가요 찜찜하네요,"['위젯', '내면', '한국', '통신사', '가입자', '한해', '용이', '위젯', '설치', '분명', '장기', '가입자', '한국', '통신사', '오류']"
2020년 1월 28일,카카오계정에 로그인된 본인인증과 일치 하지 않다고 계속 뜨네요;; 맞는 정보를 10번 넘게 써도 안되네;;,1,2020년,카카오계정에 로그인된 본인인증과 일치 하지 않다고 계속 뜨네요 맞는 정보를 번 넘게 써도 안되네,"['계정', '로그인', '본인인증', '일치', '정보']"
2021년 2월 19일,다 좋은데 페이카드를 신청 후 취소했는데 교통카드 충전금 2만원이 계좌로 다시 들어오지않습니다,4,2021년,다 좋은데 페이카드를 신청 후 취소했는데 교통카드 충전금 만원이 계좌로 다시 들어오지않습니다,"['카드', '신청', '취소', '교통카드', '충전', '만원', '계좌', '오지']"
2020년 9월 4일,연결 은행계좌 업데이트가 한 달 넘게 밀리는 걸 결제용 앱이라고 내놓는 건 좀 아니지 않냐요,1,2020년,연결 은행계좌 업데이트가 한 달 넘게 밀리는 걸 결제용 앱이라고 내놓는 건 좀 아니지 않냐요,"['연결', '계좌', '업데이트', '밀리', '결제', '니지']"
2021년 2월 25일,원래 쓰지도 않던거 카카오페이로 병무청 문서 날아와서 카카오톡으로 카카오페이 공인인증서도 다 만들었더니 정작 문서는 다운로드 안되고 인터넷 페이지만 넘어가면서 감사합니다. 이러는데 속터지네요. 카카오페이 어플을 설치해서 하면 앱으로보기 이런거 뜨면서 해결될 줄 알고 어플 깔아서 했더니 아무것도 해결 안되고 용량만 먹고 쓸떼없는 절차만 했네요. 제 기억에는 악성코드를 제외하면 최악의 어플로 남을 것 같습니다. 별 하나도 아깝네요.,1,2021년,원래 쓰지도 않던거 카카오페이로 병무청 문서 날아와서 카카오톡으로 카카오페이 공인인증서도 다 만들었더니 정작 문서는 다운로드 안되고 인터넷 페이지만 넘어가면서 감사합니다 이러는데 속터지네요 카카오페이 어플을 설치해서 하면 앱으로보기 이런거 뜨면서 해결될 줄 알고 어플 깔아서 했더니 아무것도 해결 안되고 용량만 먹고 쓸떼없는 절차만 했네요 제 기억에는 악성코드를 제외하면 최악의 어플로 남을 것 같습니다 별 하나도 아깝네요,"['원래', '병무청', '문서', '공인', '인증서', '정작', '문서', '다운로드', '인터넷', '페이지', '감사', '지네', '어플', '설치', '해결', '어플', '해결', '용량', '절차', '기억', '악성코드', '제외', '최악', '어플']"
2022년 4월 27일,그냥 다른폰으로 내 계좌좀 보겠다는데 너무 어렵게 만들어놨어 개발자님 좀 아 욕나오게 만드네,1,2022년,그냥 다른폰으로 내 계좌좀 보겠다는데 너무 어렵게 만들어놨어 개발자님 좀 아 욕나오게 만드네,"['계좌', '개발자', '만드']"
2022년 3월 6일,카카오페이 설치하고 주식 가끔 보는데 그 이후로 왜 주식스팸문자가 왜이리 많이 올까요? 우연의 일치라고 하기엔 너무 주식문자만 오는데?? 어플 삭제합니다.,1,2022년,카카오페이 설치하고 주식 가끔 보는데 그 이후로 왜 주식스팸문자가 왜이리 많이 올까요 우연의 일치라고 하기엔 너무 주식문자만 오는데 어플 삭제합니다,"['설치', '주식', '가끔', '이후', '주식', '스팸문자', '우연', '일치', '주식', '문자', '어플']"
2022년 4월 11일,학생이라서 근뎅 너어어무 불 편함 결제는 잘됬지만 문제가 있음. 취소어떻게 하는징 모르겠음,1,2022년,학생이라서 근뎅 너어어무 불 편함 결제는 잘됬지만 문제가 있음 취소어떻게 하는징 모르겠음,"['학생', '어어', '결제', '문제', '취소']"
2022년 9월 8일,빠르고 사용하기 간단하고 편하고 쉽다,4,2022년,빠르고 사용하기 간단하고 편하고 쉽다,['간단']
2022년 1월 4일,아 불편해서 못하겠네 업데이트 되고 뭐가뭔지 하나도 모르겟다,1,2022년,아 불편해서 못하겠네 업데이트 되고 뭐가뭔지 하나도 모르겟다,"['불편', '업데이트']"
2021년 1월 25일,기가막히게 편하고 효율성좋아요~,5,2021년,기가막히게 편하고 효율성좋아요,"['가막', '효율']"
2022년 9월 2일,심카드 없이도 서비스 이용 가능해져서 별점 올려드립니다.,4,2022년,심카드 없이도 서비스 이용 가능해져서 별점 올려드립니다,"['심카드', '이도', '서비스', '드립']"
2019년 5월 30일,앱 출시전 톡에서도 자주 애용했는데 편리하네요~,5,2019년,앱 출시전 톡에서도 자주 애용했는데 편리하네요,"['출시', '서도', '자주', '애용', '리하']"
2021년 2월 4일,다 좋은데 카카오페이 모바일 교통카드 왜이러나요 지하철 탈 때 찍고 들어갔는데 나올 때마다 승차처리가 안됐다고 뜨네요;,2,2021년,다 좋은데 카카오페이 모바일 교통카드 왜이러나요 지하철 탈 때 찍고 들어갔는데 나올 때마다 승차처리가 안됐다고 뜨네요,"['모바일', '교통카드', '지하철', '마다', '승차', '처리']"
2020년 12월 3일,카카오뱅크 미니랑도 연동하게 해주시면 안될까요...페이랑 뱅크를 둘 다 쓰는데 카카오뱅크 미니로는 페이 충전이 안돼서 불편해요..,4,2020년,카카오뱅크 미니랑도 연동하게 해주시면 안될까요 페이랑 뱅크를 둘 다 쓰는데 카카오뱅크 미니로는 페이 충전이 안돼서 불편해요,"['미니', '동하', '해주시', '미니', '충전', '불편']"
2021년 11월 13일,카카오페이 증권 점검 공지를 띄우고 해야 사용을 문제가 없지 너무 하네. 돈 많이 번다고 배부른 돼지가 된기가. 최소한 일주일 전엔 공지 해야 되는 거 아니가.,1,2021년,카카오페이 증권 점검 공지를 띄우고 해야 사용을 문제가 없지 너무 하네 돈 많이 번다고 배부른 돼지가 된기가 최소한 일주일 전엔 공지 해야 되는 거 아니가,"['증권', '점검', '공지', '문제', '번다', '배부', '돼지', '최소한', '일주일', '공지']"
2021년 8월 12일,"카톡에서 이모티콘 페이머니로 결제하고 ""결제내역 상세"" 보기를 하니 한시간이 넘게 일시적인 오류라고 ... 신용카드 결제 내역은 잘 보이네요",2,2021년,카톡에서 이모티콘 페이머니로 결제하고 결제내역 상세 보기를 하니 한시간이 넘게 일시적인 오류라고 신용카드 결제 내역은 잘 보이네요,"['이모티콘', '결제', '결제', '상세', '한시', '간이', '시적', '오류', '신용카드', '결제', '보이']"
2020년 12월 10일,아주편리하게 사용중입니다. 결제.이체가 넘편해요~^^,5,2020년,아주편리하게 사용중입니다 결제 이체가 넘편해요,"['아주', '편리', '결제', '이체']"
2021년 3월 14일,"안녕하세요 카카오페이 사용중에 비밀번호를 잊어버려서 계정으로 인증 받고 문자메세지를 받아야하는데 문자가 계속 안오네요.. 오늘이 쉬는날인가? 해서 매일 계속 시도해봤는데 3분이 지나서 재전송을 눌러도 계속 안오더라구요 비번을 기억하지 못한 제 잘못이 더 크지만, 가능하면 이 문제 빨리 해주시면 좋겠습니다.",3,2021년,안녕하세요 카카오페이 사용중에 비밀번호를 잊어버려서 계정으로 인증 받고 문자메세지를 받아야하는데 문자가 계속 안오네요 오늘이 쉬는날인가 해서 매일 계속 시도해봤는데 분이 지나서 재전송을 눌러도 계속 안오더라구요 비번을 기억하지 못한 제 잘못이 더 크지만 가능하면 이 문제 빨리 해주시면 좋겠습니다,"['안녕', '비밀번호', '계정', '인증', '문자', '메세지', '아야', '문자', '오늘이', '날인', '매일', '지나', '전송', '비번', '기억', '잘못', '문제', '해주시']"
2021년 10월 8일,알림 왔는데 21.10.25일이후[갤럭시 노트4 ]는 영원히 카카오페이 사용못함 참고하세요. 안드로이드6.0.1이하 보안문제로 사용못하게 한다는데 폰 최신버전업데이트 해도 6.0.1이네요.[즉 사용불가임] 즉 구형폰 보안때메 최신폰으로 바꿔오라는 말로밖에 안들림 이런사유로 많은 사람들이 대체인증수단 카카오페이를 떠날듣함. 업비트도 출금 인증 카카오페이 쓰는데 거래소도 바꿔야할판. 10.25일이후 구형폰도 보안 지원안해주신다면 카카오페이를 떠납니다. 제안합니다. 많은사람들이 아직도 쓰는 갤럭시노트나S시리즈 만이라도 지원될수 있게끔 해주세요. 안그러면 앱삭제할수밖에 없네요. 폰 바꿀일은 당분간없으니,1,2021년,알림 왔는데 일이후 갤럭시 노트 는 영원히 카카오페이 사용못함 참고하세요 안드로이드 이하 보안문제로 사용못하게 한다는데 폰 최신버전업데이트 해도 이네요 즉 사용불가임 즉 구형폰 보안때메 최신폰으로 바꿔오라는 말로밖에 안들림 이런사유로 많은 사람들이 대체인증수단 카카오페이를 떠날듣함 업비트도 출금 인증 카카오페이 쓰는데 거래소도 바꿔야할판 일이후 구형폰도 보안 지원안해주신다면 카카오페이를 떠납니다 제안합니다 많은사람들이 아직도 쓰는 갤럭시노트나S시리즈 만이라도 지원될수 있게끔 해주세요 안그러면 앱삭제할수밖에 없네요 폰 바꿀일은 당분간없으니,"['알림', '이후', '갤럭시', '노트', '영원', '참고', '안드로이드', '이하', '보안', '문제', '최신', '버전', '업데이트', '불가', '구형', '보안', '때메', '최신', '오라', '말로', '사유', '사람', '대체', '인증', '수단', '비트', '출금', '인증', '거래소', '이후', '구형', '보안', '지원', '안해', '주신', '제안', '은사', '아직', '갤럭시', '노트', '시리즈', '지원', '당분간']"
2021년 1월 19일,카카오페이 투자나 사용혜택이 많으면서 구성도 알차고 재미도 주네요,5,2021년,카카오페이 투자나 사용혜택이 많으면서 구성도 알차고 재미도 주네요,"['투자', '혜택', '구성', '차고', '재미', '주네']"
2021년 2월 23일,쓸수록 이득이 많이 생기니 돈모으는 재미가 솔솔하네요,5,2021년,쓸수록 이득이 많이 생기니 돈모으는 재미가 솔솔하네요,"['수록', '이득', '생기', '재미', '솔솔']"
2019년 9월 29일,내계좌로출금하는게 수수료가 드는것이 너무불편합니다,1,2019년,내계좌로출금하는게 수수료가 드는것이 너무불편합니다,"['계좌', '출금', '수수료', '불편']"
2021년 12월 31일,신분증 인증이 안됐다가 지금은 잘되서 잘쓰고있습니다^^ 추천합니다,5,2021년,신분증 인증이 안됐다가 지금은 잘되서 잘쓰고있습니다 추천합니다,"['신분증', '인증', '추천']"
2021년 11월 20일,카카오페이를 결제하기전까진 괜찮은데 다른웹 카카페쪽에서 결제할려치면 결제완료페이지에서 넘어가질 않네요 계속 웹도 지워보고 업뎃해봐도 되다 안되다 반복하네요 왜 그런지 이유를 알수있을지....???,2,2021년,카카오페이를 결제하기전까진 괜찮은데 다른웹 카카페쪽에서 결제할려치면 결제완료페이지에서 넘어가질 않네요 계속 웹도 지워보고 업뎃해봐도 되다 안되다 반복하네요 왜 그런지 이유를 알수있을지,"['제하', '기전', '카카', '페쪽', '결제', '치면', '결제', '완료', '페이지', '보고', '업뎃', '반복', '을지']"
2021년 10월 4일,들어갈때마다 소리나는거 없에주세요 설정에도 없고 왜 이렇게 엡데이트한건가요...,1,2021년,들어갈때마다 소리나는거 없에주세요 설정에도 없고 왜 이렇게 엡데이트한건가요,"['마다', '소리', '설정', '데이트']"
2021년 1월 14일,편하고 무엇보다 다른 재산도 한 눈에 볼 수 있어서 좋아요,5,2021년,편하고 무엇보다 다른 재산도 한 눈에 볼 수 있어서 좋아요,"['무엇', '재산']"
2020년 5월 26일,정말 편하고 소액투자경험도 해볼수있고 좋습니다^^,5,2020년,정말 편하고 소액투자경험도 해볼수있고 좋습니다,"['소액', '투자', '경험']"
2021년 5월 16일,이자 10원 준다는 원치않는 모닝콜 기능까지 있네요.,1,2021년,이자 원 준다는 원치않는 모닝콜 기능까지 있네요,"['이자', '모닝콜']"
2022년 8월 28일,펀드 해지할려고 하니 못 해지하게 숨겨뒀네요^^ 꼭 찾아서 무조건 해지할게요 ㅎㅎ 더러워서 안쓴다,1,2022년,펀드 해지할려고 하니 못 해지하게 숨겨뒀네요 꼭 찾아서 무조건 해지할게요 더러워서 안쓴다,"['펀드', '해지', '지하', '무조건', '해지', '더러']"
2021년 7월 22일,투자 현황 확인하려는데 계속 하얀 대기창만 뜨고 펀드 확인도 못하고 있어요 어제부터,1,2021년,투자 현황 확인하려는데 계속 하얀 대기창만 뜨고 펀드 확인도 못하고 있어요 어제부터,"['투자', '현황', '대기', '펀드', '어제', '부터']"
2019년 10월 22일,오프라인에서 쉽게 결제할수 있어서 좋네요~,5,2019년,오프라인에서 쉽게 결제할수 있어서 좋네요,"['오프라인', '결제']"
2019년 5월 30일,"카카오톡에는 페이 사용처가 나와서 어디에 쓸 수 있는지 알 수 있는데, 페이앱에도 사용처가 보이도록 해주세요.",5,2019년,카카오톡에는 페이 사용처가 나와서 어디에 쓸 수 있는지 알 수 있는데 페이앱에도 사용처가 보이도록 해주세요,"['처가', '처가', '보이', '도록']"
2022년 1월 27일,쓰기도편리하고 다양한혜택이 많이 좋아요~,5,2022년,쓰기도편리하고 다양한혜택이 많이 좋아요,"['기도', '편리', '다양', '혜택']"
2020년 11월 24일,휴먼계정복구가 안되고요 어플깔아서 로그인하면 일시적인오류라고하고 잠시후 이용하라는데 계속 안되네요??,1,2020년,휴먼계정복구가 안되고요 어플깔아서 로그인하면 일시적인오류라고하고 잠시후 이용하라는데 계속 안되네요,"['휴먼', '계정', '복구', '고요', '어플', '로그인', '시적', '오류', '잠시']"
2020년 8월 27일,미성년자도 사용할수 있도록 개선 부탑드립니다,1,2020년,미성년자도 사용할수 있도록 개선 부탑드립니다,"['미성년', '자도', '도록', '개선', '부탑', '드립']"
2021년 8월 30일,지원금 되지도 않는데 별거지같은거 블로그에 홍보만 싸지르고 역겹군,1,2021년,지원금 되지도 않는데 별거지같은거 블로그에 홍보만 싸지르고 역겹군,"['지원', '별거', '블로그', '홍보']"
2022년 8월 3일,워치용 앱도 지원해주시면 좋을 것 같습니다.,5,2022년,워치용 앱도 지원해주시면 좋을 것 같습니다,"['지원', '해주시']"
2021년 1월 19일,투자도 소소하게 할 수 있고 매주 럭키볼 기대돼서 좋아요 ㅎㅎ,5,2021년,투자도 소소하게 할 수 있고 매주 럭키볼 기대돼서 좋아요,"['투자', '소하', '럭키', '기대']"
2021년 3월 23일,럭키볼결과보러들어갔는데 계속튕기네요 빠른해결요청합니다,5,2021년,럭키볼결과보러들어갔는데 계속튕기네요 빠른해결요청합니다,"['럭키', '결과', '기네', '해결', '요청']"
2020년 11월 16일,불편하네 업데이트하느데 화면 꺼질때까지 안되넹,2,2020년,불편하네 업데이트하느데 화면 꺼질때까지 안되넹,"['불편', '업데이트', '화면', '안되넹']"
2020년 12월 10일,광고알림 꺼도 다시 살아나는 좀비,1,2020년,광고알림 꺼도 다시 살아나는 좀비,"['광고알림', '좀비']"
2020년 8월 2일,페이증권 인출은 어떻게 하는건가요?? 왜이렇게 번거롭죠??? 다른 증권이랑 너무 차이나는데요??? 제가.몰랐을수도 있겠지만 제가 못찾을 정도면 진짜 불편한거에요,1,2020년,페이증권 인출은 어떻게 하는건가요 왜이렇게 번거롭죠 다른 증권이랑 너무 차이나는데요 제가 몰랐을수도 있겠지만 제가 못찾을 정도면 진짜 불편한거에요,"['증권', '증권', '차이나', '수도', '정도', '불편']"
2020년 10월 26일,페이 교통카드는 왜 카톡에는 넣어놓고 정작 페이앱에는 넣어놓지않는지. 있는줄알고 한참찾았네,1,2020년,페이 교통카드는 왜 카톡에는 넣어놓고 정작 페이앱에는 넣어놓지않는지 있는줄알고 한참찾았네,"['교통카드', '정작', '한참']"
2019년 8월 8일,배라 카드결제 된다고 하길래 바로 가서 해봤는데 카드 otp 오류인가 계속 뜨면서 안된다고하네요 ㅡㅡ,1,2019년,배라 카드결제 된다고 하길래 바로 가서 해봤는데 카드 OTP 오류인가 계속 뜨면서 안된다고하네요,"['카드결제', '바로', '카드', '오류', '고하']"
2020년 10월 31일,카카오페이로 송금받았는데 기존계정이 아니라고 계속 나와서 못받고 있습니다 어떻게하면 좋을지요,4,2020년,카카오페이로 송금받았는데 기존계정이 아니라고 계속 나와서 못받고 있습니다 어떻게하면 좋을지요,"['송금', '기존', '계정', '을지']"
2021년 2월 9일,결제도 되고 펀드 투자도 되고 이벤트도 있고 할 수 있는 게 많은데 일반은행 앱처럼 무겁지 않고 가벼워서 좋다,5,2021년,결제도 되고 펀드 투자도 되고 이벤트도 있고 할 수 있는 게 많은데 일반은행 앱처럼 무겁지 않고 가벼워서 좋다,"['결제', '펀드', '투자', '이벤트', '일반', '처럼']"
2022년 2월 16일,인증불가로 쓸수가 없습니다.. 아무리 인증해봐도 본인인증이 안된다네요...ㅎㅎㅎㅎ 몇년째 문의중인데 누가 해결해주시나요?,1,2022년,인증불가로 쓸수가 없습니다 아무리 인증해봐도 본인인증이 안된다네요 몇년째 문의중인데 누가 해결해주시나요,"['인증', '불가', '수가', '인증', '본인인증', '문의', '중인', '누가', '해결', '해주시']"
2020년 4월 8일,요새 통합계좌 금액하고 카드사용금액이 업데이트가 안됩니다.,3,2020년,요새 통합계좌 금액하고 카드사용금액이 업데이트가 안됩니다,"['요새', '통합', '계좌', '금액', '카드', '금액', '업데이트']"
2022년 2월 8일,그냥 스레기 같은앱. 앱 수준이 경쟁사 보다 너무 떨어짐,1,2022년,그냥 스레기 같은앱 앱 수준이 경쟁사 보다 너무 떨어짐,"['스레기', '수준', '경쟁']"
2020년 5월 11일,로그인하려는데 인증하면 왜 자꾸 세션만료됬다면서 꺼지는거여.... 로그인 어떻게 하라구,1,2020년,로그인하려는데 인증하면 왜 자꾸 세션만료됬다면서 꺼지는거여 로그인 어떻게 하라구,"['로그인', '인증', '세션', '만료', '거여', '로그인']"
2022년 11월 14일,카카오페이 계정 인증 절차 복잡 하게 하네 계속 같은 인증 절차 무한반복 카카오페이 제대로 못써 보겠네 휴대폰 인증 계속 하고 계정비번 바꿔야 되고 페이 인증호 도 안되고 바꾸려니까 권한인증 실패 뜨고 페이지 오류 터치 오류 결국 포기하게 만들고 카카오페이 대체 왜 이럼니까 정말 하다가 화가 나내요 정말!!!,1,2022년,카카오페이 계정 인증 절차 복잡 하게 하네 계속 같은 인증 절차 무한반복 카카오페이 제대로 못써 보겠네 휴대폰 인증 계속 하고 계정비번 바꿔야 되고 페이 인증호 도 안되고 바꾸려니까 권한인증 실패 뜨고 페이지 오류 터치 오류 결국 포기하게 만들고 카카오페이 대체 왜 이럼니까 정말 하다가 화가 나내요 정말,"['계정', '인증', '절차', '복잡', '인증', '절차', '무한', '반복', '제대로', '휴대폰', '인증', '계정', '비번', '인증', '권한', '인증', '실패', '페이지', '오류', '터치', '오류', '기하', '대체', '화가']"
2021년 9월 4일,"아니 신분증인식안된대서 씩씩대며 재발급까지 받았더만 , 재발급받은 신분증도 인식이안된다하면 뭐 어쩌자는거야 ;;; 내돈은어쩌라고??",1,2021년,아니 신분증인식안된대서 씩씩대며 재발급까지 받았더만 재발급받은 신분증도 인식이안된다하면 뭐 어쩌자는거야 내돈은어쩌라고,"['신분증', '인식', '대서', '발급', '재발', '신분증', '인식', '이안', '은어']"
