날짜,리뷰,별점,month,리뷰1,리뷰2
2021년 10월 5일,알리워드를 할인쿠폰으로 주는건 또 뭔가요? 최근에 리워드 금액이 처음보다 확 줄었다고 느끼긴 했는데.. 이제는 쓰지도 않는 쿠폰을 주면서 떼워버리네요. 이제 카카오페이로 결제하는 일은 두번다시 없을겁니다. 답변확인후 추가 : 말을 참 그럴듯하게 써놓으셨네요. 쿠폰 추가지급이요? 다시 확인해봐도 알 리워드는 쿠폰밖에 없는데요?캐시백이나 포인트는 들어온게 없습니다. 추가지급이 아니라 지급수단이 추가 된 것이겠죠.,1,2021년,알리워드를 할인쿠폰으로 주는건 또 뭔가요 최근에 리워드 금액이 처음보다 확 줄었다고 느끼긴 했는데 이제는 쓰지도 않는 쿠폰을 주면서 떼워버리네요 이제 카카오페이로 결제하는 일은 두번다시 없을겁니다 답변확인후 추가 말을 참 그럴듯하게 써놓으셨네요 쿠폰 추가지급이요 다시 확인해봐도 알 리워드는 쿠폰밖에 없는데요 캐시백이나 포인트는 들어온게 없습니다 추가지급이 아니라 지급수단이 추가 된 것이겠죠,"['알리', '워드', '할인', '쿠폰', '뭔가', '최근', '워드', '금액', '처음', '쿠폰', '제하', '답변', '쿠폰', '지급', '워드', '쿠폰', '캐시', '이나', '포인트', '지급', '지급', '수단']"
2020년 3월 11일,"카카오페이 앱 보다, 카카오톡 열어서 사용하는게 더 편하네요 메뉴구성 및 사용편의성이 많이 보완되어야 할것 같습니다",2,2020년,카카오페이 앱 보다 카카오톡 열어서 사용하는게 더 편하네요 메뉴구성 및 사용편의성이 많이 보완되어야 할것 같습니다,"['메뉴', '구성', '편의', '보완']"
2021년 2월 10일,"지금까지 잘 쓰고있었습니다 근데 갑자기 로그인도 풀려있고, 로그인하려하면 네트워크가 불안정하다 뜨고 로그인을 해도 결제가 안뜨네요",3,2021년,지금까지 잘 쓰고있었습니다 근데 갑자기 로그인도 풀려있고 로그인하려하면 네트워크가 불안정하다 뜨고 로그인을 해도 결제가 안뜨네요,"['로그인', '로그인', '네트워크', '불안', '로그인', '결제']"
2022년 1월 8일,아니 갑자기 페이증권 계좌(버킷리스트) 입금도 출금도 못하게 조회만 가능하게 하면 어쩌라는 말인가요.. 일주일마다 자동 저축하던거 멈춰있고 계좌해지도 안되고 버킷리스트 어디서 보는지 해지 어떻게 하는지 알려주세요,1,2022년,아니 갑자기 페이증권 계좌 버킷리스트 입금도 출금도 못하게 조회만 가능하게 하면 어쩌라는 말인가요 일주일마다 자동 저축하던거 멈춰있고 계좌해지도 안되고 버킷리스트 어디서 보는지 해지 어떻게 하는지 알려주세요,"['증권', '계좌', '버킷리스트', '입금', '출금', '조회', '일주일', '마다', '자동', '저축', '계좌', '해지', '버킷리스트', '해지']"
2020년 3월 17일,최악 인터넷유투브다되는데 이것만 네트워크안된다고 사용안됨 그리고 오류떠서 통장에돈만 빠져나가고 이체도 제대로 안된것같은데 확인도 못하고있음,1,2020년,최악 인터넷유투브다되는데 이것만 네트워크안된다고 사용안됨 그리고 오류떠서 통장에돈만 빠져나가고 이체도 제대로 안된것같은데 확인도 못하고있음,"['최악', '인터넷', '유투브', '네트워크', '오류', '통장', '이체', '제대로']"
2021년 3월 2일,결제할 때 편리해서 좋긴 하지만 와이파이나 데이터가 있어야지 킬 수 있어서 그 점은 조금 불편한거 같아요,4,2021년,결제할 때 편리해서 좋긴 하지만 와이파이나 데이터가 있어야지 킬 수 있어서 그 점은 조금 불편한거 같아요,"['결제', '편리', '와이파이', '데이터', '조금', '불편']"
2021년 11월 19일,"처음으로 카카오로 택시이용을 했는데,편안함과 기사마다 이용경로가 틀려서 카카오에서 보내는요금과 요금차이가 많음~ 그 이유인즉 경로를 돌아서가는 양심없는 기사가있음!~^^",4,2021년,처음으로 카카오로 택시이용을 했는데 편안함과 기사마다 이용경로가 틀려서 카카오에서 보내는요금과 요금차이가 많음 그 이유인즉 경로를 돌아서가는 양심없는 기사가있음,"['음으로', '택시', '편안함', '기사', '마다', '이용경', '요금', '요금', '차이', '경로', '양심', '기사']"
2022년 12월 10일,앱을 깔아서 썼는데 별안간 화면이 넘어가지 않아 다시 깔았는데 인증이 되지않아 못쓰고 있어요. 문제가 뭔지 알려주세요. 핸드폰이나 계좌인증에서 멈춰 있어요.,1,2022년,앱을 깔아서 썼는데 별안간 화면이 넘어가지 않아 다시 깔았는데 인증이 되지않아 못쓰고 있어요 문제가 뭔지 알려주세요 핸드폰이나 계좌인증에서 멈춰 있어요,"['별안간', '화면', '인증', '문제', '핸드폰', '이나', '계좌', '인증']"
2021년 2월 4일,"카카오페이카드 수령할때 항상 기분이 안좋네요. 저번에는 길을 잘못찾아서 뭐라고 하고, 이번에는 문자답도 하고 밖에서 기다리고 있었는데, 부재중전화하지말라고 하고. 서비스가 별로에요.",1,2021년,카카오페이카드 수령할때 항상 기분이 안좋네요 저번에는 길을 잘못찾아서 뭐라고 하고 이번에는 문자답도 하고 밖에서 기다리고 있었는데 부재중전화하지말라고 하고 서비스가 별로에요,"['카드', '수령', '항상', '기분', '저번', '잘못', '이번', '문자', '다리', '부재', '중전', '서비스', '별로']"
2020년 4월 27일,분명히 3번이나 정보입력을 했는데 통신사 정보와 일치하지 않는다며 5분 후에 다시하라고 하네.. 카카오 잘 쓰고 있었는데 네이버로 갈아타어 되나? 서비스 개판입니다. 5분 지나 하나 접속은 되네요. 겉은 정보를 하나하나 타이핑 확인했는데 왜 처음에는 안됐을까요?,3,2020년,분명히 번이나 정보입력을 했는데 통신사 정보와 일치하지 않는다며 분 후에 다시하라고 하네 카카오 잘 쓰고 있었는데 네이버로 갈아타어 되나 서비스 개판입니다 분 지나 하나 접속은 되네요 겉은 정보를 하나하나 타이핑 확인했는데 왜 처음에는 안됐을까요,"['분명', '이나', '정보', '입력', '통신사', '정보', '치하', '아타', '서비스', '개판', '지나', '접속', '정보', '타이핑', '처음']"
2020년 7월 1일,페이에서 개설한 계좌 정보를 더 편리하고 직관적으로 볼 수 있으면 좋겠습니다 지금은 예치한 금액이 어디있는지 조차 찾기 힘드네요. 그리고 더보기 탭의 하단에 고정되어있는 광고배너?를 좀 정적으로 바꿔주세요 튀어나와있는 일러스트레이터도 박스 안으로 집어넣어주시구요 정작 페이의 중요한 기능들을 봐야하는 시야에 너무 방해됩니다,4,2020년,페이에서 개설한 계좌 정보를 더 편리하고 직관적으로 볼 수 있으면 좋겠습니다 지금은 예치한 금액이 어디있는지 조차 찾기 힘드네요 그리고 더보기 탭의 하단에 고정되어있는 광고배너 를 좀 정적으로 바꿔주세요 튀어나와있는 일러스트레이터도 박스 안으로 집어넣어주시구요 정작 페이의 중요한 기능들을 봐야하는 시야에 너무 방해됩니다,"['개설', '계좌', '정보', '편리', '직관', '예치', '금액', '조차', '찾기', '더보', '하단', '고정', '광고', '배너', '정적', '튀어', '일러스트레이터', '박스', '시구', '정작', '중요', '시야', '방해']"
2020년 12월 22일,계좌연결하려는데 확인단계에서 확인버튼이 안눌려요 앱을 깔았다가 지워도 그러는데 무슨 문제가있는건가요? 결제 약관동의도 확인버튼이 안눌려요,2,2020년,계좌연결하려는데 확인단계에서 확인버튼이 안눌려요 앱을 깔았다가 지워도 그러는데 무슨 문제가있는건가요 결제 약관동의도 확인버튼이 안눌려요,"['계좌연결', '단계', '버튼', '안눌려', '문제', '결제', '약관', '동의', '버튼', '안눌려']"
2022년 6월 12일,건의:출석채크기능을 넣어서 카카오 포인트가 들어오개끔 해주세요. 추가: 컬처락처럼 첫화면 활성화기능도 추가해 주세요. (예를들면 한번 출석할때마다 1000p적립 이렇게요.) 재업로드합니다.,5,2022년,건의 출석채크기능을 넣어서 카카오 포인트가 들어오개끔 해주세요 추가 컬처락처럼 첫화면 활성화기능도 추가해 주세요 예를들면 한번 출석할때마다 P적립 이렇게요 재업로드합니다,"['건의', '출석', '포인트', '오개', '컬처', '처럼', '화면', '활성화', '출석', '마다', '적립', '업로드']"
2022년 11월 27일,군인이라 카메라 사용이 제한되는데 카드 등록이 카메라로만 스캔해서 가능하네요? 직접 입력은 어디갔습니까? 군인뿐만 아니라 카메라 사용이 제한될 수도 있는건데 카드등록 직접 입력은 다시 살려놓으세요.,1,2022년,군인이라 카메라 사용이 제한되는데 카드 등록이 카메라로만 스캔해서 가능하네요 직접 입력은 어디갔습니까 군인뿐만 아니라 카메라 사용이 제한될 수도 있는건데 카드등록 직접 입력은 다시 살려놓으세요,"['군인', '카메라', '제한', '카드', '등록', '카메라', '로만', '스캔', '직접', '입력', '군인', '카메라', '제한', '수도', '카드', '등록', '직접', '입력']"
2020년 2월 14일,사용해보면 참편해요 ㅎㅎ 구글도 결제되고 요즘은 서울보증보험같이 인증할 수 있는 곳도 점점 늘어나는것같아서 좋아요 공인인증서가 점점 필요없어지고 있거든요 결제할수 있는곳도 점점 늘어나서 전 추천이요!,5,2020년,사용해보면 참편해요 구글도 결제되고 요즘은 서울보증보험같이 인증할 수 있는 곳도 점점 늘어나는것같아서 좋아요 공인인증서가 점점 필요없어지고 있거든요 결제할수 있는곳도 점점 늘어나서 전 추천이요,"['구글', '결제', '요즘', '서울', '보증', '보험', '인증', '곳도', '점점', '공인', '인증서', '점점', '필요', '지고', '결제', '곳도', '점점', '추천', '이요']"
2020년 6월 16일,왜 전세보증서류제출화면을 누르면 네트워크에러가 뜨나요? 이틀째 지속되네요 ㅋㅋㅋㅋ 피드백이 고객센터로 연락해라 이거네요? 운영 참 쉽게 하십니다 복붙하지마세요,1,2020년,왜 전세보증서류제출화면을 누르면 네트워크에러가 뜨나요 이틀째 지속되네요 피드백이 고객센터로 연락해라 이거네요 운영 참 쉽게 하십니다 복붙하지마세요,"['전세', '보증', '제출', '화면', '네트워크', '에러', '이틀', '지속', '피드백', '고객', '센터', '연락', '운영']"
2020년 7월 27일,아무 기능도 사용이 안되네요. 뭐든 하려고 하면 네트워크 사정이 좋지않다고 다음에 시도하라며 어플이 꺼지는데 지우고 다시깔아봐도 똑같네요. 분명 증권투자 하기전엔 다 잘되다가 증권투자 이후에 정작 증권잔액도 확인못하고 아무것도 못합니다. 이젠 결제기능도 마비,1,2020년,아무 기능도 사용이 안되네요 뭐든 하려고 하면 네트워크 사정이 좋지않다고 다음에 시도하라며 어플이 꺼지는데 지우고 다시깔아봐도 똑같네요 분명 증권투자 하기전엔 다 잘되다가 증권투자 이후에 정작 증권잔액도 확인못하고 아무것도 못합니다 이젠 결제기능도 마비,"['네트워크', '사정', '다음', '어플', '지우', '분명', '증권', '투자', '기전', '증권', '투자', '이후', '정작', '증권', '결제', '마비']"
2022년 4월 4일,"미성년잔데. 본인인증 신분증 확인이 안돼서 사용 못함. 오늘 들어와서 돈 충전하려고 했는데, 인증하래 미잔데 신분증이 어디있냐고 . 사용 못하게 만들어버리네 진짜 짜증나게",1,2022년,미성년잔데 본인인증 신분증 확인이 안돼서 사용 못함 오늘 들어와서 돈 충전하려고 했는데 인증하래 미잔데 신분증이 어디있냐고 사용 못하게 만들어버리네 진짜 짜증나게,"['미성년', '본인인증', '신분증', '오늘', '전하', '인증', '하래', '신분증', '짜증']"
2021년 10월 1일,"휴대폰 명의변경시 예전의 자료가남아서, 개명하셨나요? 만있고 명의변경에 관한 내용이없어서 본인인증이 되지않아 카카오페이 최초 가입이되지않습니다.",5,2021년,휴대폰 명의변경시 예전의 자료가남아서 개명하셨나요 만있고 명의변경에 관한 내용이없어서 본인인증이 되지않아 카카오페이 최초 가입이되지않습니다,"['휴대폰', '명의', '변경', '자료', '남아', '개명', '명의', '변경', '내용', '본인인증', '최초', '가입']"
2022년 2월 8일,기본보안설정이 왜 얼굴인식으로 되어있나요 예전폰 기종이여서 지문인식만 되는데 송금이 왜 안되지 엄청 찾았는데 결국은 얼굴인식 인증으로 되어있어서 안되더군요. 덕분에 시간 많이 날렸네요,1,2022년,기본보안설정이 왜 얼굴인식으로 되어있나요 예전폰 기종이여서 지문인식만 되는데 송금이 왜 안되지 엄청 찾았는데 결국은 얼굴인식 인증으로 되어있어서 안되더군요 덕분에 시간 많이 날렸네요,"['기본', '보안', '설정', '얼굴인식', '종이', '여서', '지문', '인식', '송금', '얼굴인식', '인증', '덕분', '시간']"
2020년 11월 20일,안녕하세요. 카카오페이를 유용하게 잘 쓰고 있는 유저입니다. 정기 결제로 인해 작게 작게 계산할 일이 있는데 충전이 만 원부터 가능해 필요 금액 이상으로 충전을 해야 합니다. 오천 원 단위도 충전이 가능하도록 업데이트 고려해주시면 감사하겠습니다.,5,2020년,안녕하세요 카카오페이를 유용하게 잘 쓰고 있는 유저입니다 정기 결제로 인해 작게 작게 계산할 일이 있는데 충전이 만 원부터 가능해 필요 금액 이상으로 충전을 해야 합니다 오천 원 단위도 충전이 가능하도록 업데이트 고려해주시면 감사하겠습니다,"['안녕', '유용', '유저', '정기', '결제', '계산', '충전', '원부', '필요', '금액', '이상', '충전', '오천', '단위', '충전', '도록', '업데이트', '고려', '해주시', '감사']"
2022년 5월 17일,기본금 책정되면 기사들 절때 콜안잡아요 금액 3번올리니 그제서야 콜잡는데 ㅋ 기사가 1분거리에 대기중입니다. 개어이없죠 그냥 트리콜이나 다른대리 불러서 기사 바로오는게 금액도 정확하고 사기안당합니다 꼭 참고하십시요,1,2022년,기본금 책정되면 기사들 절때 콜안잡아요 금액 번올리니 그제서야 콜잡는데 기사가 분거리에 대기중입니다 개어이없죠 그냥 트리콜이나 다른대리 불러서 기사 바로오는게 금액도 정확하고 사기안당합니다 꼭 참고하십시요,"['기본', '책정', '기사', '절때', '금액', '기사', '거리', '대기', '어이', '리콜', '이나', '대리', '기사', '바로', '금액', '정확', '사기', '안당', '참고']"
2021년 4월 8일,위젯 설정하다가 복창 터져서 삭제. 카드사 연결만 3회 반복했지만 완료라고 하고는 다시 카드사 연결 글자만 보임. 쓰레기 앱,1,2021년,위젯 설정하다가 복창 터져서 삭제 카드사 연결만 회 반복했지만 완료라고 하고는 다시 카드사 연결 글자만 보임 쓰레기 앱,"['위젯', '설정', '복창', '카드', '연결', '반복', '완료', '카드', '연결', '글자', '보임', '쓰레기']"
2022년 1월 10일,모든 계좌 연결되어 보는 것이 수월해 좋습니다. 단지 새마을이나 신협과 같은 협동 조합 내역 조회가 안되단 점이 아쉽고 카드 취소 내역도 결제 내역과 같이 합산되는 것은 수정되었으면 합니다.,4,2022년,모든 계좌 연결되어 보는 것이 수월해 좋습니다 단지 새마을이나 신협과 같은 협동 조합 내역 조회가 안되단 점이 아쉽고 카드 취소 내역도 결제 내역과 같이 합산되는 것은 수정되었으면 합니다,"['모든', '계좌', '연결', '단지', '새마을', '이나', '신협', '협동', '조합', '조회', '카드', '취소', '역도', '결제', '합산', '수정']"
2020년 2월 24일,다 좋은데 자꾸 구글플레이 결제수단 추가하려고 해도 [or-ieh-03]이라고 오류가 뜨네요.. 설정도 제데로 했는데도 불구하고 이러네요..,4,2020년,다 좋은데 자꾸 구글플레이 결제수단 추가하려고 해도 OR IEH 이라고 오류가 뜨네요 설정도 제데로 했는데도 불구하고 이러네요,"['구글플레이', '결제', '수단', '오류', '설정', '불구']"
2022년 5월 18일,좋으나 아쉬운 점이 페이를 충전하려면 최소금액이 만 원이상인 것이 좀 불편하다. 천 원에서 오천원 정도가 최소 충전금액이었음 좋겠다,3,2022년,좋으나 아쉬운 점이 페이를 충전하려면 최소금액이 만 원이상인 것이 좀 불편하다 천 원에서 오천원 정도가 최소 충전금액이었음 좋겠다,"['전하', '려면', '최소', '금액', '이상인', '불편', '오천', '정도', '최소', '충전', '금액']"
2021년 8월 30일,이걸 쓰라고 만든건지 어쩌라는건지 만들어놓고 로그인 한번하려면 인증받고 또받고 다시 또 새로운계정 설정하고 또 인증받고 하다가 하다가 지쳐서 포기하기를 수차레~~~~~~~~~~~~!! 살다살다 이런앱 처음,1,2021년,이걸 쓰라고 만든건지 어쩌라는건지 만들어놓고 로그인 한번하려면 인증받고 또받고 다시 또 새로운계정 설정하고 또 인증받고 하다가 하다가 지쳐서 포기하기를 수차레 살다살다 이런앱 처음,"['로그인', '려면', '인증', '새로운계정', '설정', '인증', '포기', '수차', '처음']"
2022년 4월 28일,본인인증할때 주민등록증을 사용해야하는데 시간이 없어 미발급 받은 상황이라 이 상황에 발급을 받아야 사용이 가능하다니..참 안타깝네요 바쁜 시기에 고생이 좀 있겠지만 다른 방법이 없을지 조심히 여쭤봅니다,3,2022년,본인인증할때 주민등록증을 사용해야하는데 시간이 없어 미발급 받은 상황이라 이 상황에 발급을 받아야 사용이 가능하다니 참 안타깝네요 바쁜 시기에 고생이 좀 있겠지만 다른 방법이 없을지 조심히 여쭤봅니다,"['본인인증', '주민등록증', '시간', '발급', '상황', '상황', '발급', '아야', '안타', '시기', '고생', '방법', '을지', '조심']"
2020년 5월 21일,정말 잘 쓰고 있는데요.. 페이머니 잔액이 결제화면에 뜨지 않게 바뀐 부분이 매우 아쉽네요 ㅠ 잔액 봐가며 수동충전을 하고 있었기에 이부분이 아쉽네요..,5,2020년,정말 잘 쓰고 있는데요 페이머니 잔액이 결제화면에 뜨지 않게 바뀐 부분이 매우 아쉽네요 잔액 봐가며 수동충전을 하고 있었기에 이부분이 아쉽네요,"['결제', '화면', '부분', '매우', '수동', '충전', '부분']"
2021년 5월 3일,네들은 어떻게 앱을 관리하길래 업데이트 할때마다 앱 환경을 밑바닥으로 꼴아박는지 모르겠다 야 에휴...걍 손절한다,1,2021년,네들은 어떻게 앱을 관리하길래 업데이트 할때마다 앱 환경을 밑바닥으로 꼴아박는지 모르겠다 야 에휴 걍 손절한다,"['관리', '업데이트', '마다', '환경', '밑바닥', '손절']"
2022년 2월 13일,아니 계좌 만들라길래 카카오뱅크 연결하는거 기다렸는데 무슨 30분동안 가만히 있냐...? 혹시 와이파이 문제인가 했는데 다른건 다 멀쩡하게 되고.. 기다리다 못해서 카카오뱅크로 따로 들어갔는데 대포통장 때문에 안된데.... 아니 그건 이해하겠는데 앱 상태가 왜이런거야..? 이렇게 느리고 이해안되게 만든 앱 처음봤다.... 좀더 이해하기 쉽게 만들면 좋을 것 같음......,1,2022년,아니 계좌 만들라길래 카카오뱅크 연결하는거 기다렸는데 무슨 분동안 가만히 있냐 혹시 와이파이 문제인가 했는데 다른건 다 멀쩡하게 되고 기다리다 못해서 카카오뱅크로 따로 들어갔는데 대포통장 때문에 안된데 아니 그건 이해하겠는데 앱 상태가 왜이런거야 이렇게 느리고 이해안되게 만든 앱 처음봤다 좀더 이해하기 쉽게 만들면 좋을 것 같음,"['계좌', '결하', '분동', '와이파이', '문제', '다리', '대포통장', '상태', '처음', '좀더']"
2021년 2월 20일,로그인하려면 휴대폰 인증하라해서 휴대폰 인증하니 이미 있는 계정이라고 로그인하라고함. 무한반복하다 포기하고 안 쓰는중.,1,2021년,로그인하려면 휴대폰 인증하라해서 휴대폰 인증하니 이미 있는 계정이라고 로그인하라고함 무한반복하다 포기하고 안 쓰는중,"['로그인', '려면', '휴대폰', '인증', '휴대폰', '인증', '계정', '로그인', '무한', '반복', '포기']"
2020년 7월 17일,리뷰가 사라졌네요 지갑분리기능이랑 자동충전(부족할때 말고 정기적으로 충전)기능 추가됐으면 좋겠어요,4,2020년,리뷰가 사라졌네요 지갑분리기능이랑 자동충전 부족할때 말고 정기적으로 충전 기능 추가됐으면 좋겠어요,"['리뷰', '사라', '지갑', '분리', '자동', '충전', '부족', '기적', '충전']"
2021년 4월 29일,"카카오페이 믿고 지갑 놓고 쇼핑하러 갔더니, 접속 에러, 점검중, 최근 너무 빈번한거 아닙니까? 한동안 잘사용하고 있었는데 실망스럽네요.",1,2021년,카카오페이 믿고 지갑 놓고 쇼핑하러 갔더니 접속 에러 점검중 최근 너무 빈번한거 아닙니까 한동안 잘사용하고 있었는데 실망스럽네요,"['지갑', '쇼핑', '접속', '에러', '점검', '최근', '빈번', '한동', '실망']"
2022년 8월 18일,아니 무슨 주민등록증 인증을 하는데 찍어도 계속 안되고 어두운 배경에 놓아도 안된다하고 빛반사된다해서 계속 옮겨서 해도 안된다하고 뭐하는 건지; 최소한 주민등록증 날짜 수기입력을 하게라도 하던가 뭐하는 겁니까 아침부터 사람 열뻗치게,1,2022년,아니 무슨 주민등록증 인증을 하는데 찍어도 계속 안되고 어두운 배경에 놓아도 안된다하고 빛반사된다해서 계속 옮겨서 해도 안된다하고 뭐하는 건지 최소한 주민등록증 날짜 수기입력을 하게라도 하던가 뭐하는 겁니까 아침부터 사람 열뻗치게,"['주민등록증', '인증', '어도', '두운', '배경', '반사', '최소한', '주민등록증', '날짜', '수기', '입력', '게라', '아침', '부터', '사람']"
2023년 3월 27일,해외주식에서 어제까지 잘 되던 배당금 분석이 안되네요.. 몇번 다시하고 앱삭제 후 다시 실행 해도 안됩니다,2,2023년,해외주식에서 어제까지 잘 되던 배당금 분석이 안되네요 몇번 다시하고 앱삭제 후 다시 실행 해도 안됩니다,"['해외', '주식', '어제', '배당금', '분석', '실행']"
2022년 1월 2일,그동안 소소하지만 결제할 때마다 알 모으기 펀드 자동투자 재미있는데 종료하면 무엇으로 재미 보나요? 다른 이벤트 나오는지 아니면 계획을 미정인가요? 진짜 볼 때마다 혜택들이 사라지고 점점하기 싫어지네요 이제 볼 만큼 다 봤다는 건가요?,4,2022년,그동안 소소하지만 결제할 때마다 알 모으기 펀드 자동투자 재미있는데 종료하면 무엇으로 재미 보나요 다른 이벤트 나오는지 아니면 계획을 미정인가요 진짜 볼 때마다 혜택들이 사라지고 점점하기 싫어지네요 이제 볼 만큼 다 봤다는 건가요,"['그동안', '소하', '결제', '마다', '펀드', '자동', '투자', '재미', '종료', '무엇', '재미', '보나', '이벤트', '계획', '미정', '마다', '혜택', '사라', '지고', '점점', '지네', '만큼']"
2023년 4월 22일,내 핸드폰이 이상한건가.. 자꾸 원격제어어플이 있다면서 카카오페이 결제를 막고있어요. 실행중인 어플 확인하기 누르니까 설치되지도않은 어플이고요;;,1,2023년,내 핸드폰이 이상한건가 자꾸 원격제어어플이 있다면서 카카오페이 결제를 막고있어요 실행중인 어플 확인하기 누르니까 설치되지도않은 어플이고요,"['핸드폰', '상한', '원격', '제어', '어플', '결제', '실행', '중인', '어플', '설치', '어플']"
