날짜,리뷰,별점,month,리뷰1,리뷰2
2023년 10월 18일,업뎃이후 잘쓰던 위젯이 먹통이 됐다 지우고 위젯 등록을 다시해도 잠깐 되다 시간 지나서 눌러보면 위젯이 먹통이다 네이버 페이 위젯은 잘된다 각성해라 카카오 ▶▶ 추가 - 여전히 문제가 그대로다 다른 문제도 발견했다 다크모드 사용시 위젯의 바코드가 보이지를 않아 사용이 불가능하다 카카오 각성해라 사용자의 입장에서 앱을 만들어라 좀 그게 안되나?,1,2023년,업뎃이후 잘쓰던 위젯이 먹통이 됐다 지우고 위젯 등록을 다시해도 잠깐 되다 시간 지나서 눌러보면 위젯이 먹통이다 네이버 페이 위젯은 잘된다 각성해라 카카오 추가 여전히 문제가 그대로다 다른 문제도 발견했다 다크모드 사용시 위젯의 바코드가 보이지를 않아 사용이 불가능하다 카카오 각성해라 사용자의 입장에서 앱을 만들어라 좀 그게 안되나,"['업뎃', '이후', '위젯', '먹통', '지우', '위젯', '등록', '잠깐', '시간', '지나', '위젯', '먹통', '위젯', '각성', '여전', '문제', '그대로', '문제', '발견', '다크', '모드', '위젯', '바코드', '보이지', '불가능', '각성', '사용자', '입장', '그게']"
2023년 10월 17일,송금하기 누르면 화면이 떨려서 숫자를 못 누르겠어요 지우고 다시 깔았는데도 똑 같은 현상이 있어요 일시적인 현상이 아니라면 삭제할 수 밖에,1,2023년,송금하기 누르면 화면이 떨려서 숫자를 못 누르겠어요 지우고 다시 깔았는데도 똑 같은 현상이 있어요 일시적인 현상이 아니라면 삭제할 수 밖에,"['송금', '화면', '숫자', '지우', '현상', '시적', '현상']"
2023년 8월 9일,늘 잘사용하고있어요 z플립5 외부화면에서 사용시 네이버페이는 문제없이 편하게 결제동작을 수행할수있는데 카카오페이는 화면이 겹쳐서 바코드클릭이 안되어 사용이 어렵네요ㅜ 혹시 이부분은 어떻게 개선이 될수있을까요..,5,2023년,늘 잘사용하고있어요 Z플립 외부화면에서 사용시 네이버페이는 문제없이 편하게 결제동작을 수행할수있는데 카카오페이는 화면이 겹쳐서 바코드클릭이 안되어 사용이 어렵네요 혹시 이부분은 어떻게 개선이 될수있을까요,"['플립', '외부', '화면', '문제', '결제', '동작', '수행', '화면', '바코드', '클릭', '부분', '개선']"
2023년 7월 3일,"렉,버퍼링 겁나 느리고 화면 안뜸현상 짜증나요ㅠㅠ 주식은 타이밍이 전부인데... 특히 미국주식창은...요번에 메뉴얼 화면보기 방식이 바뀌어서 더 그런건지 핸드폰 갤22플러스 . 집에 기가와이파이 소프트업그레이드 전부 완료되어있는데도... 화면 개 느려터져서 나오질않아요!!! 모바일네트워크도 마찬가지...저번에도 이런일이 좀 심각하게 터져서 공식사과하고 피해보상 접수받고 했던걸로 기억하는데... 이런 현상이 너무 빈번하니까...개인 네트워크 문제다~라고만 치부할수 없는거 아닌가 싶네요. 속터져서 다른쪽으로 옮겨야하나 싶고 진짜... 삭제후 새로 깔고 인증하고 다해도 똑같고 이럴때마다 왜 이걸 깔고 거래해서 스스로 스트레스 받고있나 싶을때가 많네요 접속자수 많이 몰리는 앱은 수시로 점검해야 하는게 마치않나요??",1,2023년,렉 버퍼링 겁나 느리고 화면 안뜸현상 짜증나요 주식은 타이밍이 전부인데 특히 미국주식창은 요번에 메뉴얼 화면보기 방식이 바뀌어서 더 그런건지 핸드폰 갤 플러스 집에 기가와이파이 소프트업그레이드 전부 완료되어있는데도 화면 개 느려터져서 나오질않아요 모바일네트워크도 마찬가지 저번에도 이런일이 좀 심각하게 터져서 공식사과하고 피해보상 접수받고 했던걸로 기억하는데 이런 현상이 너무 빈번하니까 개인 네트워크 문제다 라고만 치부할수 없는거 아닌가 싶네요 속터져서 다른쪽으로 옮겨야하나 싶고 진짜 삭제후 새로 깔고 인증하고 다해도 똑같고 이럴때마다 왜 이걸 깔고 거래해서 스스로 스트레스 받고있나 싶을때가 많네요 접속자수 많이 몰리는 앱은 수시로 점검해야 하는게 마치않나요,"['렉', '버퍼링', '화면', '현상', '짜증', '주식', '타이밍', '전부', '미국', '주식창', '메뉴얼', '화면', '방식', '핸드폰', '플러스', '와이파이', '소프트', '업그레이드', '전부', '완료', '화면', '모바일', '네트워크', '마찬가지', '저번', '일이', '각하', '공식', '사과', '피해', '보상', '접수', '기억', '현상', '빈번', '개인', '네트워크', '문제', '치부', '인증', '마다', '거래', '스스로', '스트레스', '접속', '자수', '몰리', '수시', '점검', '마치']"
2023년 6월 9일,"자주 쓰는 서비스는 앞으로 꺼내고 --> 나에게 맞게 설정해 놓고 잘 쓰고 있는데, 불편한 홈 화면으로 바껴 버렸네! 설정해 놓은 카드로 결제 하기 힘들도록 결제 누르고 카드를 한번 더 찾아야 하네. 누가 계산할때 번거롭게 이것 저것 누르고 있겠니 그냥 사용하지 말라는거지. 위젯 사이즈도 1X1은 없고, 쓸데없이 커서 사용 안하는데",1,2023년,자주 쓰는 서비스는 앞으로 꺼내고 나에게 맞게 설정해 놓고 잘 쓰고 있는데 불편한 홈 화면으로 바껴 버렸네 설정해 놓은 카드로 결제 하기 힘들도록 결제 누르고 카드를 한번 더 찾아야 하네 누가 계산할때 번거롭게 이것 저것 누르고 있겠니 그냥 사용하지 말라는거지 위젯 사이즈도 X 은 없고 쓸데없이 커서 사용 안하는데,"['자주', '서비스', '설정', '불편', '화면', '설정', '카드', '결제', '도록', '결제', '카드', '아야', '누가', '계산', '거지', '위젯', '사이즈', '커서']"
2023년 6월 6일,"페이증권 처음사용인데,보조지표 기능도 부족하고.다른 증권사들처럼 가격이동평균 숫자.색상변경이 가능했으면 좋겠어요. 보조지표에 William'R 기능없네요 도구사용이 없어서 직접 선긋기가 되지않구요.추세선.지지저항선을 직접긋고 싶어요. 그리고 영웅문,KB증권 처럼 챠트를 열었을때 가로.세로 모두 상단에 도구와 설정 기능이 되어있어서 편하거든요.카카오페이도 그런기능들이 잘 되어있으면 좋겠습니다.부탁드려요~^^",2,2023년,페이증권 처음사용인데 보조지표 기능도 부족하고 다른 증권사들처럼 가격이동평균 숫자 색상변경이 가능했으면 좋겠어요 보조지표에 WILLIAM R 기능없네요 도구사용이 없어서 직접 선긋기가 되지않구요 추세선 지지저항선을 직접긋고 싶어요 그리고 영웅문 KB증권 처럼 챠트를 열었을때 가로 세로 모두 상단에 도구와 설정 기능이 되어있어서 편하거든요 카카오페이도 그런기능들이 잘 되어있으면 좋겠습니다 부탁드려요,"['증권', '처음', '보조', '지표', '부족', '증권사', '처럼', '가격', '이동', '평균', '숫자', '색상', '변경', '보조', '지표', '도구', '직접', '추세', '지지', '저항', '직접', '영웅문', '증권', '처럼', '챠트', '가로', '세로', '모두', '상단', '도구', '설정', '페이도', '부탁']"
2023년 7월 21일,업데이트 되고나서 훨씬 사용하기 좋아졌어요 그전에는 다른서비스찾아서 가려면 단계가 많아서 불편했는데 개편 되고나서는 카톡보다는 앱으로 많이들어가게되네요 금융일정 알려주는 알림도 그렇고 유용하게 잘 보게되요~혜택도 예전에는 찾기가 어려웠는데 잘보여서 결제하기전에 꼭 한번씩 보게되네요,5,2023년,업데이트 되고나서 훨씬 사용하기 좋아졌어요 그전에는 다른서비스찾아서 가려면 단계가 많아서 불편했는데 개편 되고나서는 카톡보다는 앱으로 많이들어가게되네요 금융일정 알려주는 알림도 그렇고 유용하게 잘 보게되요 혜택도 예전에는 찾기가 어려웠는데 잘보여서 결제하기전에 꼭 한번씩 보게되네요,"['업데이트', '서비스', '려면', '단계', '불편', '개편', '금융', '일정', '알림', '유용', '혜택', '찾기', '여서', '제하', '기전']"
2023년 8월 12일,카카오페이 증권을 잘 사용하고 있습니다. 지난번에 주식매매시에 UX가 불편하다는 글을 올렸는데 개선되면서 너무 좋아졌네용!! ^^ 이제 해외주식 데이마켓 서비스만 시작하면 완벽할듯~~,4,2023년,카카오페이 증권을 잘 사용하고 있습니다 지난번에 주식매매시에 UX가 불편하다는 글을 올렸는데 개선되면서 너무 좋아졌네용 이제 해외주식 데이마켓 서비스만 시작하면 완벽할듯,"['증권', '지난번', '주식', '매매', '불편', '개선', '해외', '주식', '데이', '마켓', '서비스', '시작', '완벽']"
2023년 8월 10일,만14세는 못 쓰게 하셨네요~ 그리고 카뱅 추가 하려고 했는데 카드 비번이 맞는데 아니라고 쳐 하시네요^^ 그래서 바꾸고 다시 했는데 방금 바꾼거를 쳤는데 아니라네요^^ 뭐 제가 이상하게 바꾼거일수도 잇지 하면서 다시 비번을 바꿔서 다시 입력 햤는데 또 아니라네요 이거 뭐하자는 거죠? 제가 치매가 아닌 이상 10초전에 했던 짓은 다 기억하는데 이건 그냥 앱이 장애네요 아니면 개발자가 그거든지 진짜 화가나네요 똑바로 일 합시다 제발 카카오페이 절대 안 씁니다,1,2023년,만 세는 못 쓰게 하셨네요 그리고 카뱅 추가 하려고 했는데 카드 비번이 맞는데 아니라고 쳐 하시네요 그래서 바꾸고 다시 했는데 방금 바꾼거를 쳤는데 아니라네요 뭐 제가 이상하게 바꾼거일수도 잇지 하면서 다시 비번을 바꿔서 다시 입력 햤는데 또 아니라네요 이거 뭐하자는 거죠 제가 치매가 아닌 이상 초전에 했던 짓은 다 기억하는데 이건 그냥 앱이 장애네요 아니면 개발자가 그거든지 진짜 화가나네요 똑바로 일 합시다 제발 카카오페이 절대 안 씁니다,"['카뱅', '카드', '비번', '래서', '방금', '이상하', '일수', '비번', '입력', '햤는데', '하자', '치매', '이상', '초전', '기억', '이건', '장애', '개발자', '그거', '화가', '똑바로', '제발', '절대']"
2023년 10월 13일,송금시 얼마를 보낼까요 에서 금액 등 숫자버튼이 떨리면서 화면 흔들림현상으로 보낼 수가 없어요. 조속히 개선 해주세요.,2,2023년,송금시 얼마를 보낼까요 에서 금액 등 숫자버튼이 떨리면서 화면 흔들림현상으로 보낼 수가 없어요 조속히 개선 해주세요,"['송금', '얼마', '금액', '숫자', '버튼', '화면', '현상', '수가', '조속', '개선']"
2023년 9월 19일,잘 사용하고 있습니다. 카카오페이가 정밀하고 빈틈없이 완벽한 페이로 성장 하시고 고객님께서 무엇을 요구하는지에 대한 끝없는 노력을 해주시면 좋겠습니다. 없는 것도 만들고 있는것은 더욱더 발전되는 혁신 중의 혁신을 꿈꾸며 무궁한 발전이 있기를 바랍니다.,5,2023년,잘 사용하고 있습니다 카카오페이가 정밀하고 빈틈없이 완벽한 페이로 성장 하시고 고객님께서 무엇을 요구하는지에 대한 끝없는 노력을 해주시면 좋겠습니다 없는 것도 만들고 있는것은 더욱더 발전되는 혁신 중의 혁신을 꿈꾸며 무궁한 발전이 있기를 바랍니다,"['정밀', '빈틈', '완벽', '성장', '고객', '무엇', '요구', '대한', '노력', '해주시', '더욱더', '발전', '혁신', '혁신', '무궁', '발전']"
2023년 7월 6일,근래 업데이트때마다 진심으로 묻고 싶네요 주식거래는 하고 있는 사람들이 만들고 최종 컨펌하는거 맞나요? 왜 몇번씩 클릭하도록 다 따로따로 떼어놓은거죠? 다른건 몰라도 정보탭과 보유탭 내용은 묶여있어야죠 주식거래하는 사람이 종목정보나 보자고 종목 클릭해서 들어가는거 아니잖아요 보유주식 각각의 현황확인과 매수매도를 위해 클릭하는건데 종목클릭하면 정보탭이 디폴트라 헌황 확인하려면 보유탭 한번더 클릭하게 되잖아요 5개 탭으로 나눠놓은거 정말 불편하고 무의미하다고 생각합니다 자꾸 뭔가 더할려고 안했으면 좋겠어요 다른 회사 흉내내려고 하지말고 카카오 색을 지켰으면 좋겠네요 바꾸려면 정말 잘 만들어서 내놓던가요 미완성 버전 급하게 올려놓은것 같잖아요,3,2023년,근래 업데이트때마다 진심으로 묻고 싶네요 주식거래는 하고 있는 사람들이 만들고 최종 컨펌하는거 맞나요 왜 몇번씩 클릭하도록 다 따로따로 떼어놓은거죠 다른건 몰라도 정보탭과 보유탭 내용은 묶여있어야죠 주식거래하는 사람이 종목정보나 보자고 종목 클릭해서 들어가는거 아니잖아요 보유주식 각각의 현황확인과 매수매도를 위해 클릭하는건데 종목클릭하면 정보탭이 디폴트라 헌황 확인하려면 보유탭 한번더 클릭하게 되잖아요 개 탭으로 나눠놓은거 정말 불편하고 무의미하다고 생각합니다 자꾸 뭔가 더할려고 안했으면 좋겠어요 다른 회사 흉내내려고 하지말고 카카오 색을 지켰으면 좋겠네요 바꾸려면 정말 잘 만들어서 내놓던가요 미완성 버전 급하게 올려놓은것 같잖아요,"['근래', '업데이트', '마다', '진심', '주식', '거래', '사람', '최종', '컨펌', '클릭', '도록', '따로따로', '정보', '보유', '내용', '주식', '거래', '사람', '종목', '정보', '자고', '종목', '클릭', '보유', '주식', '각각', '현황', '매수', '매도', '위해', '클릭', '종목', '클릭', '정보', '디폴트', '인하', '려면', '보유', '클릭', '불편', '무의미', '생각', '뭔가', '회사', '흉내내', '려면', '미완성', '버전']"
2023년 9월 7일,간편결제의 선두주자 역할에 충실한거 같아요 다른 페이도 광고가 많은 편이니 단점은 비슷하지만... 계속 믿고 쓸수 있도록 보안에 신경 잘 써주기를 바랍니다~~,5,2023년,간편결제의 선두주자 역할에 충실한거 같아요 다른 페이도 광고가 많은 편이니 단점은 비슷하지만 계속 믿고 쓸수 있도록 보안에 신경 잘 써주기를 바랍니다,"['간편', '결제', '선두', '주자', '역할', '충실', '페이도', '광고', '편이', '단점', '도록', '보안', '신경', '주기']"
2023년 9월 14일,금융관련 정보가 집대성 되어 있어 아주 유용한 앱으로 계속적으로 진화 중이네요 ^^ 아주 잘쓰고 있습니다 ~,5,2023년,금융관련 정보가 집대성 되어 있어 아주 유용한 앱으로 계속적으로 진화 중이네요 아주 잘쓰고 있습니다,"['금융', '관련', '정보', '집대성', '아주', '유용', '진화', '중이', '아주']"
2023년 5월 27일,최근에 굉장히 자주 은행에 오류가 납니다. 뭔가를 구매하려 하거나 송금하려하면 은행에 오류가 발생했다 하면서 송금이 안되고 본인 재인증 횟수를 넘었다며 한시간 뒤에 시도하라는데 재인증 횟수가 5번인데 다섯번을 누른적이 없습니다. 왜 이런 오류가 발생하는지 굉장히 불편하군요.,1,2023년,최근에 굉장히 자주 은행에 오류가 납니다 뭔가를 구매하려 하거나 송금하려하면 은행에 오류가 발생했다 하면서 송금이 안되고 본인 재인증 횟수를 넘었다며 한시간 뒤에 시도하라는데 재인증 횟수가 번인데 다섯번을 누른적이 없습니다 왜 이런 오류가 발생하는지 굉장히 불편하군요,"['최근', '자주', '오류', '뭔가', '구매', '거나', '송금', '오류', '발생', '송금', '본인', '재인', '횟수', '한시', '재인', '횟수', '번인', '다섯', '오류', '발생', '불편']"
2023년 6월 27일,어렵고 입문하기 힘들어 보이는 주식을 쉽게 시작해 볼 수 있어서 좋았습니다! 근데 혹시 주식 가리기 기능 만들어 주시면 안될까요? 몇몇 주식은 당분간 보고싶지 않을 때가 있는데 눈에 보이니 참 아이러니 해서요😂 혹시 가능하다면 해당 기능 꼭 좀 부탁드립니다!! 감사합니다🙂,5,2023년,어렵고 입문하기 힘들어 보이는 주식을 쉽게 시작해 볼 수 있어서 좋았습니다 근데 혹시 주식 가리기 기능 만들어 주시면 안될까요 몇몇 주식은 당분간 보고싶지 않을 때가 있는데 눈에 보이니 참 아이러니 해서요 혹시 가능하다면 해당 기능 꼭 좀 부탁드립니다 감사합니다,"['입문', '보이', '주식', '시작', '주식', '리기', '몇몇', '주식', '당분간', '보고', '보이', '아이러니', '서요', '해당', '부탁', '드립', '감사']"
2023년 7월 17일,"화면스크롤 감도가 이상합니다. 아래로 스크롤 하는데, 왜 자꾸 화면이 옆으로 넘어가는지 모르겠습니다. 그리고 혜택창에서 모든 이미지가 깨져서 출력되고 있습니다. 빠른 패치 해주셨으면 좋겠습니다.",2,2023년,화면스크롤 감도가 이상합니다 아래로 스크롤 하는데 왜 자꾸 화면이 옆으로 넘어가는지 모르겠습니다 그리고 혜택창에서 모든 이미지가 깨져서 출력되고 있습니다 빠른 패치 해주셨으면 좋겠습니다,"['화면', '크롤', '이상', '아래', '크롤', '화면', '혜택', '모든', '이미지', '출력', '패치', '셨으']"
2023년 7월 21일,"이전 앱은 이용하기 불편하고 카톡에서 쓸 때랑 너무 달라서 헛갈렸는데, 이번에 바뀌고ㅜ나니 훨씬 좋아졌네요. 메뉴도 직관적이고, 카톡이랑도 비슷하고. 속도만 조금 더 빨랐으면 완벽할텐데요",5,2023년,이전 앱은 이용하기 불편하고 카톡에서 쓸 때랑 너무 달라서 헛갈렸는데 이번에 바뀌고 나니 훨씬 좋아졌네요 메뉴도 직관적이고 카톡이랑도 비슷하고 속도만 조금 더 빨랐으면 완벽할텐데요,"['이전', '불편', '달라', '이번', '나니', '메뉴', '직관', '비슷', '속도', '조금', '완벽']"
2023년 9월 19일,도대체 보조지표 초기화되는건 언제 고칠겁니까??? 매번 귀찮아죽겠네요. 설정하면 초기화되고 매일몇번씩 반복하는데 이래도 되나요??? 대기업맞나싶네,1,2023년,도대체 보조지표 초기화되는건 언제 고칠겁니까 매번 귀찮아죽겠네요 설정하면 초기화되고 매일몇번씩 반복하는데 이래도 되나요 대기업맞나싶네,"['보조', '지표', '초기', '언제', '매번', '죽겠네', '설정', '초기', '매일', '반복', '대기업']"
2023년 9월 30일,1x1 결제 위젯은 없나요 요즘은 2×2 사이즈는 안쓰던데 위젯이 자리 많이 차지하고 너무 커서 불편해요,1,2023년,X 결제 위젯은 없나요 요즘은 사이즈는 안쓰던데 위젯이 자리 많이 차지하고 너무 커서 불편해요,"['결제', '위젯', '요즘', '사이즈', '던데', '위젯', '자리', '차지', '커서', '불편']"
2023년 5월 21일,"생각할수록 이해가 불가능합니다 한달 실적을 채워서 쓰면서 현금 편의점 ATM 출금 할때 카드 무료 가능하지만 인증번호 출금 신청 할때 수수료 받는 의미하는 이유가 무엇인지, 카드 인증 번호 둘다 무료로 하든가 하나는 무료 하나는 유료 그럴때마다 실적을 달성 할이유가 없다고 판단합니다",2,2023년,생각할수록 이해가 불가능합니다 한달 실적을 채워서 쓰면서 현금 편의점 ATM 출금 할때 카드 무료 가능하지만 인증번호 출금 신청 할때 수수료 받는 의미하는 이유가 무엇인지 카드 인증 번호 둘다 무료로 하든가 하나는 무료 하나는 유료 그럴때마다 실적을 달성 할이유가 없다고 판단합니다,"['생각', '수록', '불가능', '실적', '현금', '편의점', '출금', '카드', '무료', '인증번호', '출금', '신청', '수수료', '미하', '무엇', '인지', '카드', '인증', '번호', '무료', '하든', '무료', '유료', '마다', '실적', '달성', '단합']"
2023년 10월 10일,"주식차트에 일봉차트 렉좀 없애주세요(걸리는게 있고 안걸리는게 있음,기준은 모름) 몇개월째 그렇습니다. 주봉 월봉은 렉안걸림니다.",1,2023년,주식차트에 일봉차트 렉좀 없애주세요 걸리는게 있고 안걸리는게 있음 기준은 모름 몇개월째 그렇습니다 주봉 월봉은 렉안걸림니다,"['주식', '차트', '일봉', '차트', '렉좀', '기준', '모름', '몇개', '월봉', '렉']"
2023년 10월 10일,버그로 강제종료 됩니다 개발자에게 문의하라고 뜨고 페이창을 제대로 볼수도 없이 강제종료되니 어떻게 할 방법이 없습니다 빠른 수정부탁드립니다,1,2023년,버그로 강제종료 됩니다 개발자에게 문의하라고 뜨고 페이창을 제대로 볼수도 없이 강제종료되니 어떻게 할 방법이 없습니다 빠른 수정부탁드립니다,"['버그', '강제', '종료', '개발자', '문의', '이창', '제대로', '수도', '강제', '종료', '방법', '수정', '부탁', '드립']"
2023년 7월 4일,좀 전에 카카오페이로 결제해서 SK 브로드밴드 TV에서 예능 프로랑 드라마를 보려고 했는데 결제가 안돼. 결제가 결제가 안돼. 결제 완료 확인 버튼까지 눌렀는데도 결제가 안돼요. 세 번인가 했는데안돼. 이런 게 지금 엄청 잦아요. 카카오페이가 돈 버는 데만 열심히 하지 마시고 이런 오류 같은 거 제대로 좀 제대로 좀 처리하세요. 3611이라계속뜸,1,2023년,좀 전에 카카오페이로 결제해서 SK 브로드밴드 TV에서 예능 프로랑 드라마를 보려고 했는데 결제가 안돼 결제가 결제가 안돼 결제 완료 확인 버튼까지 눌렀는데도 결제가 안돼요 세 번인가 했는데안돼 이런 게 지금 엄청 잦아요 카카오페이가 돈 버는 데만 열심히 하지 마시고 이런 오류 같은 거 제대로 좀 제대로 좀 처리하세요 이라계속뜸,"['결제', '브로드밴드', '예능', '프로', '드라마', '결제', '결제', '결제', '결제', '완료', '버튼', '결제', '번인', '열심', '오류', '제대로', '제대로', '처리']"
2023년 9월 22일,혜택 > 메일모으기 > 카톡 플친 맺기 or Instagram 팔로우 이벤트를 진행 할때 이벤트 참여 페이지에서 버튼이 안 눌립니다. 클릭을 해도 안 넘어가요.,1,2023년,혜택 메일모으기 카톡 플친 맺기 OR INSTAGRAM 팔로우 이벤트를 진행 할때 이벤트 참여 페이지에서 버튼이 안 눌립니다 클릭을 해도 안 넘어가요,"['혜택', '메일', '팔로우', '이벤트', '진행', '이벤트', '참여', '페이지', '버튼', '눌립니', '클릭']"
2023년 8월 27일,워치에서 사용하려고 다운받고 계좌텃다가 지웠습니다 네**페이좀 보고 배웠으면 좋겠네요 참..;; 워치 엘티이쓰면서 폰들고 다니지 않으려고 하는건데,1,2023년,워치에서 사용하려고 다운받고 계좌텃다가 지웠습니다 네 페이좀 보고 배웠으면 좋겠네요 참 워치 엘티이쓰면서 폰들고 다니지 않으려고 하는건데,"['다운', '계좌', '보고', '엘티이', '니지']"
2023년 9월 6일,일단 현재까지는 혜자앱인건 맞아요. 스탬프 적립조건이 최소 1천원부터던데 그건 하향 조정을 해주시면 좋겠네여,5,2023년,일단 현재까지는 혜자앱인건 맞아요 스탬프 적립조건이 최소 천원부터던데 그건 하향 조정을 해주시면 좋겠네여,"['일단', '현재', '혜자', '스탬프', '적립', '조건', '최소', '천원', '부터', '던데', '하향', '조정', '해주시']"
2023년 8월 26일,여러 이벤트가 쏠쏠하고 재밌어요. 알면 알 수록 혜자가 많아 매력이 있네요. 부자되시고 주가도 오르세요.,5,2023년,여러 이벤트가 쏠쏠하고 재밌어요 알면 알 수록 혜자가 많아 매력이 있네요 부자되시고 주가도 오르세요,"['여러', '이벤트', '쏠쏠', '수록', '혜자', '매력', '부자', '주가']"
2023년 9월 7일,필요한 모든것들이 간단하고 쉬워서 아주 유용하게 사용하고있어요 다른분들께 강추삽니다,5,2023년,필요한 모든것들이 간단하고 쉬워서 아주 유용하게 사용하고있어요 다른분들께 강추삽니다,"['필요', '모든', '간단', '아주', '유용', '강추']"
2023년 8월 16일,업데이트 후 부터 분명히 구독 취소한 상품을 지멋대로 결제하는 오류가 발생했습니다. 빠르게 조치해 주십시오.,3,2023년,업데이트 후 부터 분명히 구독 취소한 상품을 지멋대로 결제하는 오류가 발생했습니다 빠르게 조치해 주십시오,"['업데이트', '부터', '분명', '구독', '취소', '상품', '멋대로', '제하', '오류', '발생', '조치', '시오']"
