날짜,리뷰,별점,month,리뷰1,리뷰2
2021년 2월 6일,좋긴한데 미성년자는 카카오뱅크에서 카카오미니카드를 사용하는데 그게 연결이 안되니까 할수있는게 없네요 카카오페이충전을 하려고 해도 연동을 하려고 하면 입출금계좌를 만들라도 하고 만들려고 하면 미성년자여서 안된다고 하고 어떻게 안되나요,1,2021년,좋긴한데 미성년자는 카카오뱅크에서 카카오미니카드를 사용하는데 그게 연결이 안되니까 할수있는게 없네요 카카오페이충전을 하려고 해도 연동을 하려고 하면 입출금계좌를 만들라도 하고 만들려고 하면 미성년자여서 안된다고 하고 어떻게 안되나요,"['미성년', '미니카', '그게', '연결', '충전', '연동', '입출금', '계좌', '미성년', '여서']"
2019년 6월 5일,"카카오톡에 있는 통합조회 기능도 추가해주세요. 카카오페이 기능인데도, 카카오페이 앱 미적용 사유가 궁금합니다",5,2019년,카카오톡에 있는 통합조회 기능도 추가해주세요 카카오페이 기능인데도 카카오페이 앱 미적용 사유가 궁금합니다,"['통합', '조회', '미적', '사유']"
2022년 8월 22일,온라인을이용하기좋아요.잘못하겠어요업데이트를요,5,2022년,온라인을이용하기좋아요 잘못하겠어요업데이트를요,"['온라인', '잘못', '업데이트']"
2022년 9월 7일,유용한 정보와 혜택을 잘 이용하고 있습니다,5,2022년,유용한 정보와 혜택을 잘 이용하고 있습니다,"['유용', '정보', '혜택']"
2023년 4월 18일,본인인증 왜 자꾸 안되는건가요? 시간만 계속 날리고 짜증나네..,1,2023년,본인인증 왜 자꾸 안되는건가요 시간만 계속 날리고 짜증나네,"['본인인증', '시간', '짜증']"
2020년 10월 11일,엘지 v40폰 쓰는대요 카카오페이 예약송금할려구하는대 월 날짜 클릭하면 등록이라는 문구가 나오질 안내요 어떡해 해결방법좀 알려주세요 그래서 예약송금도 못하구 있어요 급급,3,2020년,엘지 V 폰 쓰는대요 카카오페이 예약송금할려구하는대 월 날짜 클릭하면 등록이라는 문구가 나오질 안내요 어떡해 해결방법좀 알려주세요 그래서 예약송금도 못하구 있어요 급급,"['엘지', '대요', '예약', '송금', '날짜', '클릭', '등록', '문구', '안내', '해결', '방법', '래서', '예약', '송금']"
2023년 3월 27일,증권 할거면 쓰지마라 애프터마켓도 안되고 데이마켓도 안되는 쓰레기,1,2023년,증권 할거면 쓰지마라 애프터마켓도 안되고 데이마켓도 안되는 쓰레기,"['증권', '애프터', '마켓', '데이', '마켓', '쓰레기']"
2021년 5월 14일,업데이트 후 겁나게 느립니다,1,2021년,업데이트 후 겁나게 느립니다,['업데이트']
2021년 10월 5일,아니 미니금고를 나도 모르는 금고로 만들려고 하는건가요? 돈넣어놓게 만들고 점점 찾기 불편하게 만들면 어떡합니까??,1,2021년,아니 미니금고를 나도 모르는 금고로 만들려고 하는건가요 돈넣어놓게 만들고 점점 찾기 불편하게 만들면 어떡합니까,"['미니', '금고', '금고', '점점', '찾기', '불편']"
2021년 4월 20일,너무너무 좋아요 혜택도 많고,5,2021년,너무너무 좋아요 혜택도 많고,['혜택']
2021년 11월 5일,이거 처음 버스카드 써봤을때 그 날은 됐는데 오늘은 지하철만 가능했고 버스가 안됐어요.... 왜죠? 왜이러는건지 답변 좀 해주세요.....,1,2021년,이거 처음 버스카드 써봤을때 그 날은 됐는데 오늘은 지하철만 가능했고 버스가 안됐어요 왜죠 왜이러는건지 답변 좀 해주세요,"['처음', '버스', '카드', '오늘', '지하철', '버스', '답변']"
2020년 8월 26일,어떻게 신분증을 가까이 비춰도 촬영이 안 되나요?? 대체 어떻게 쓰라고 만드셨는지 알고 싶습니다 빛 때문에 안 되는 건 아닌 듯하고,1,2020년,어떻게 신분증을 가까이 비춰도 촬영이 안 되나요 대체 어떻게 쓰라고 만드셨는지 알고 싶습니다 빛 때문에 안 되는 건 아닌 듯하고,"['신분증', '가까이', '촬영', '대체']"
2021년 12월 31일,아니 업뎃이후 머니 충전하는게 사라져서 하루종일찾아도 안보이네 하 짜증,1,2021년,아니 업뎃이후 머니 충전하는게 사라져서 하루종일찾아도 안보이네 하 짜증,"['업뎃', '이후', '전하', '사라', '하루', '종일', '안보', '짜증']"
2020년 7월 22일,사용하기 간편하고 너무좋아요~~^^,5,2020년,사용하기 간편하고 너무좋아요,['간편']
2023년 4월 27일,충전이 만원단위부터여서 많이불편합니다,1,2023년,충전이 만원단위부터여서 많이불편합니다,"['충전', '만원', '단위', '여서', '이불']"
2022년 1월 8일,미니금고 입출금 어떻게 하나요.. 페이봇에서 물어물어 가는거 말고는 방법이 없는데,1,2022년,미니금고 입출금 어떻게 하나요 페이봇에서 물어물어 가는거 말고는 방법이 없는데,"['미니', '금고', '입출금', '물어', '물어', '방법']"
2022년 4월 12일,개웃기네... 이벤트로 다 줄 것처럼 광고하고는 친구 초대 ^^ 사용자에게 스팸 보내라는 마케팅이 카겜이랑 똑같네요 ㅋㅋㅋㅋ,1,2022년,개웃기네 이벤트로 다 줄 것처럼 광고하고는 친구 초대 사용자에게 스팸 보내라는 마케팅이 카겜이랑 똑같네요,"['웃기', '이벤트', '처럼', '광고', '친구', '초대', '사용자', '스팸', '마케팅', '카겜']"
2021년 2월 9일,페이로 각종 재산 관리및 투자가 훨씬 쉬워졌습니다!,5,2021년,페이로 각종 재산 관리및 투자가 훨씬 쉬워졌습니다,"['각종', '재산', '관리', '투자가']"
2021년 12월 31일,버킷리스트 어디갔어요? 7월부터 꾸준히 모았는데 없어졌는데요? 내역도 사라졌어요 이게 뭐하는 거에요?,1,2021년,버킷리스트 어디갔어요 월부터 꾸준히 모았는데 없어졌는데요 내역도 사라졌어요 이게 뭐하는 거에요,"['버킷리스트', '월부', '역도', '사라']"
2021년 6월 1일,"참쓰기좋은프로그램이네요,",5,2021년,참쓰기좋은프로그램이네요,"['쓰기', '프로그램']"
2021년 7월 23일,카카오페이에서 하단 투자버튼 누르면 아무정보도 안나옵니다. 한 2일전부터 그러네요,4,2021년,카카오페이에서 하단 투자버튼 누르면 아무정보도 안나옵니다 한 일전부터 그러네요,"['하단', '투자', '버튼', '정보', '일전', '부터']"
2021년 10월 21일,별로 쓸일 없고 앞으로 쓰고 싶지 않음.,1,2021년,별로 쓸일 없고 앞으로 쓰고 싶지 않음,['별로']
2022년 1월 27일,알수없는 오류가 너무뜹니다,1,2022년,알수없는 오류가 너무뜹니다,['오류']
2021년 1월 19일,카카오페이 편해서 정말좋아요.근데 카카오페이에 연결된계정을 삭제했는데 카카오페이가 그계정에 로그인이 되었다고 하면서 계정을 사용이 안되는 부분이 있는데 어떻게 해야되나요?...,3,2021년,카카오페이 편해서 정말좋아요 근데 카카오페이에 연결된계정을 삭제했는데 카카오페이가 그계정에 로그인이 되었다고 하면서 계정을 사용이 안되는 부분이 있는데 어떻게 해야되나요,"['연결', '계정', '계정', '로그인', '계정', '부분']"
2023년 2월 15일,분명 카카오계정에 입력된 정보와 틀림없이 맞았는데도 불구하고 ars 인증 후 카카오계정에 입력된 정보와 다르다고 뜨네요.,2,2023년,분명 카카오계정에 입력된 정보와 틀림없이 맞았는데도 불구하고 ARS 인증 후 카카오계정에 입력된 정보와 다르다고 뜨네요,"['분명', '계정', '입력', '정보', '틀림', '불구', '인증', '계정', '입력', '정보']"
2021년 1월 19일,편리하고 좋아요,5,2021년,편리하고 좋아요,['편리']
2021년 9월 24일,택배배송 예약하려는데 주소 저장이 안되요,4,2021년,택배배송 예약하려는데 주소 저장이 안되요,"['택배', '배송', '예약', '주소', '저장']"
2021년 3월 30일,사용하기쉽고 정말정말 좋아요,5,2021년,사용하기쉽고 정말정말 좋아요,[]
2021년 3월 9일,너무 좋은 앱입니다.다들 사용해보세요,5,2021년,너무 좋은 앱입니다 다들 사용해보세요,[]
2022년 5월 25일,이미 카카오뱅크에서 미니를 만든 후에 카카오페이를 깔아서 계좌연결을 하려고 했는데 연결을 하려면 미니를 만들어야 한다고 하더니 미니는 하나만 만들 수 있다고 하면서 계좌연결이 안되네요. 이미 미니카드까지 수령했는데 어떻게 해결해야 할까요?,3,2022년,이미 카카오뱅크에서 미니를 만든 후에 카카오페이를 깔아서 계좌연결을 하려고 했는데 연결을 하려면 미니를 만들어야 한다고 하더니 미니는 하나만 만들 수 있다고 하면서 계좌연결이 안되네요 이미 미니카드까지 수령했는데 어떻게 해결해야 할까요,"['미니', '계좌연결', '연결', '려면', '미니', '미니', '계좌연결', '미니카', '수령', '해결']"
2021년 7월 23일,카카오페이에서 '투자' 화면이 갑자기 먹통이네요. 어제도 그래서 일시적인 현상인가 했는데 오늘도 그러네요,1,2021년,카카오페이에서 투자 화면이 갑자기 먹통이네요 어제도 그래서 일시적인 현상인가 했는데 오늘도 그러네요,"['투자', '화면', '먹통', '어제', '래서', '시적', '현상', '오늘']"
2020년 10월 9일,좋다 굿 햐 자주 사용 정 알 좋다,5,2020년,좋다 굿 햐 자주 사용 정 알 좋다,['자주']
2022년 12월 26일,계속 휴먼계정 풀려고 하는데 안되네요.,2,2022년,계속 휴먼계정 풀려고 하는데 안되네요,"['휴먼', '계정']"
2021년 8월 9일,갑자기 8월은 왠 마켓컬리 그럼 다른 때처럼 마켓컬리 결제할때 알을 더 주던가 왜 쓸데없이 쿠폰을 주는건가요 마켓컬리 안하는 사람들은 어쩌라고요 전 마켓컬리 안하는데 알 모으려고 페이 쓰던건데 이럴거면 할인혜택있는 다른 앱을 쓰고 말지 3만원 정도 결제 했는데 쿠폰 안쓰니 돌아오는건 0R이네요?,1,2021년,갑자기 월은 왠 마켓컬리 그럼 다른 때처럼 마켓컬리 결제할때 알을 더 주던가 왜 쓸데없이 쿠폰을 주는건가요 마켓컬리 안하는 사람들은 어쩌라고요 전 마켓컬리 안하는데 알 모으려고 페이 쓰던건데 이럴거면 할인혜택있는 다른 앱을 쓰고 말지 만원 정도 결제 했는데 쿠폰 안쓰니 돌아오는건 R이네요,"['마켓', '컬리', '처럼', '마켓', '컬리', '결제', '쿠폰', '마켓', '컬리', '사람', '고요', '마켓', '컬리', '할인', '혜택', '만원', '정도', '결제', '쿠폰']"
2021년 2월 21일,인증서 시스템오류로 계속안되네요 관리좀..,1,2021년,인증서 시스템오류로 계속안되네요 관리좀,"['인증서', '시스템', '오류로', '관리']"
2022년 3월 15일,편리하고 좋아요,5,2022년,편리하고 좋아요,['편리']
2020년 3월 30일,가입이 안됩니다 주민번호 입력란이 계속 오류가 나네요.,1,2020년,가입이 안됩니다 주민번호 입력란이 계속 오류가 나네요,"['가입', '주민', '번호', '입력', '오류']"
2019년 10월 22일,편리하게 잘쓰고 있어요~,5,2019년,편리하게 잘쓰고 있어요,['리하']
2020년 12월 19일,61세저에게도사용하기가편하여참좋은업감사♡,5,2020년,세저에게도사용하기가편하여참좋은업감사,"['도사', '가편', '감사']"
2020년 12월 3일,와진짜답답하네 친구한테 받은돈이 왜 조회가 안되지 그냥 입출금만 집중하면안되나 짜투리 손대지말고,1,2020년,와진짜답답하네 친구한테 받은돈이 왜 조회가 안되지 그냥 입출금만 집중하면안되나 짜투리 손대지말고,"['친구', '조회', '입출금', '중하', '면안', '투리', '대지']"
2021년 2월 23일,편리하고 좋아요,5,2021년,편리하고 좋아요,['편리']
2020년 11월 12일,"별점이 아까움,,, 페이 잔액이 표시가 않되서 더럽게 불편함. 카카오페이 해지가 정답",1,2020년,별점이 아까움 페이 잔액이 표시가 않되서 더럽게 불편함 카카오페이 해지가 정답,"['표시', '불편', '해지', '정답']"
2019년 8월 5일,QR코드 찍으려고 하면 커메라 화면이 블랙으로 뜨면서 먹통이네요.. 그리고 카드번호가 앞자리만 보여주니 카카오뱅크 카드들은 여덟자리가 똑같아서 구분이 안 됩니다.. 뒤 4자리를 볼 수 있게 해주시던가 카드 이름을 정할 수 있게 해주세요,1,2019년,QR코드 찍으려고 하면 커메라 화면이 블랙으로 뜨면서 먹통이네요 그리고 카드번호가 앞자리만 보여주니 카카오뱅크 카드들은 여덟자리가 똑같아서 구분이 안 됩니다 뒤 자리를 볼 수 있게 해주시던가 카드 이름을 정할 수 있게 해주세요,"['코드', '메라', '화면', '블랙', '먹통', '카드', '번호', '자리', '여주', '카드', '여덟', '자리', '구분', '자리', '해주시', '카드', '이름']"
2022년 1월 15일,갈수록 불편해지고 뜬금없이 내자산을 바꾸는건 먼짓인가요,1,2022년,갈수록 불편해지고 뜬금없이 내자산을 바꾸는건 먼짓인가요,"['갈수록', '불편', '해지', '뜬금']"
2021년 10월 6일,이상한이벤트로 설치하게하려는거 같음,1,2021년,이상한이벤트로 설치하게하려는거 같음,"['상한', '이벤트', '치하']"
2021년 10월 10일,편리하고 이벤트가 많아서 좋아요^^,5,2021년,편리하고 이벤트가 많아서 좋아요,"['편리', '이벤트']"
2020년 11월 22일,카카오뱅크 돈으로충전하는데 유효하지않는 계좌라고뜨면서 충전안됨 ㅋ 몇일전엔됐는데 불안하게,1,2020년,카카오뱅크 돈으로충전하는데 유효하지않는 계좌라고뜨면서 충전안됨 몇일전엔됐는데 불안하게,"['전하', '유효', '계좌', '충전', '일전', '불안']"
2022년 5월 17일,너무 불친절하고 갑질최고인페이입니다,1,2022년,너무 불친절하고 갑질최고인페이입니다,"['불친절', '고인']"
2021년 11월 12일,너무 편하고 혁신적이네요!,5,2021년,너무 편하고 혁신적이네요,['혁신']
2021년 8월 15일,바코드 안보이는건 모죠? 나만 그런가 사용하고 싶어도 바코드 안보이네요,1,2021년,바코드 안보이는건 모죠 나만 그런가 사용하고 싶어도 바코드 안보이네요,"['바코드', '안보', '런가', '어도', '바코드', '안보']"
2021년 6월 16일,자산관리 서비스는 몆달째안되고 쓸이유가 자꾸없어지네요..안될거같으면 아예 없에버리던지 새로 공지를하던지 뭐하는겁니까..안쓰던 토스를 깔았더니 자산관리 서비스 겁나잘되네요..펀드 다 팔아버리고 삭제할까 고민중...,1,2021년,자산관리 서비스는 몆달째안되고 쓸이유가 자꾸없어지네요 안될거같으면 아예 없에버리던지 새로 공지를하던지 뭐하는겁니까 안쓰던 토스를 깔았더니 자산관리 서비스 겁나잘되네요 펀드 다 팔아버리고 삭제할까 고민중,"['관리', '서비스', '몆달', '지네', '에버', '공지', '관리', '서비스', '펀드', '아버', '고민']"
2021년 11월 5일,Ui 개편을 누가 하였는지 궁금하네. 잘 쓰던걸 일부러 헷갈리게 해놓았나요 ? 거래내역 조회는 다들 뭐 장님인지 아나 ? 한달 조회하고 담달 보려면 위로 팅기다가 다시 옆으로 땡겨야 됨. 이거 개편한 사람 정신과 찾아가 보삼,2,2021년,UI 개편을 누가 하였는지 궁금하네 잘 쓰던걸 일부러 헷갈리게 해놓았나요 거래내역 조회는 다들 뭐 장님인지 아나 한달 조회하고 담달 보려면 위로 팅기다가 다시 옆으로 땡겨야 됨 이거 개편한 사람 정신과 찾아가 보삼,"['개편', '누가', '일부러', '갈리', '거래', '조회', '장님', '인지', '조회', '담달', '려면', '위로', '개편', '사람', '정신과', '아가', '보삼']"
2020년 9월 6일,"자산관리 동기화 하는데 걸리는 시간이 토스 보다 10,000 배 더 느립니다 ㅡㅡ",1,2020년,자산관리 동기화 하는데 걸리는 시간이 토스 보다 배 더 느립니다,"['관리', '동기화', '시간']"
2022년 4월 12일,편리하고 좋아요,5,2022년,편리하고 좋아요,['편리']
2020년 3월 2일,꼭 충전해야서 써야하나요? 카카오뱅크에서 자동으로 인출해도 될텐데 타은행처럼 그런 기능도 있으면 좋겠네요,4,2020년,꼭 충전해야서 써야하나요 카카오뱅크에서 자동으로 인출해도 될텐데 타은행처럼 그런 기능도 있으면 좋겠네요,"['충전', '자동', '처럼']"
2021년 5월 4일,왜 1월이후로 거래내역 업데이트가 안될까요?,3,2021년,왜 월이후로 거래내역 업데이트가 안될까요,"['이후', '거래', '업데이트']"
2019년 12월 25일,왜 만 3세라고 써놓고 만14세 이상만 되는거에요? 깔고보면 항상안되더라 이런앱들,1,2019년,왜 만 세라고 써놓고 만 세 이상만 되는거에요 깔고보면 항상안되더라 이런앱들,"['세라', '이상만', '항상']"
2019년 5월 28일,굿굿 간편하게 결제 할 수 있네요!!!,5,2019년,굿굿 간편하게 결제 할 수 있네요,"['굿굿', '간편', '결제']"
2021년 8월 20일,로그인하고 로그아웃했는데 그게탈퇴된건가요?,1,2021년,로그인하고 로그아웃했는데 그게탈퇴된건가요,"['로그인', '로그아웃', '그게', '탈퇴']"
2019년 9월 15일,잘쓰고있는데 입금확인은안되나요? 연결된계좌에 돈들어온건왜 안보이죠?,4,2019년,잘쓰고있는데 입금확인은안되나요 연결된계좌에 돈들어온건왜 안보이죠,"['입금', '연결', '계좌', '온건', '안보']"
2022년 4월 28일,좋아요 잘 부탁합니다요 거래 잘 할게요 저는 정공열입니다 전남 순천살고요 반가워요,5,2022년,좋아요 잘 부탁합니다요 거래 잘 할게요 저는 정공열입니다 전남 순천살고요 반가워요,"['부탁', '거래', '정공', '전남', '순천', '고요']"
2021년 10월 12일,시작시 딸랑 거리는 거 없애요!!!!,1,2021년,시작시 딸랑 거리는 거 없애요,"['시작', '거리']"
2021년 1월 5일,럭키볼 재밌고 좋네요 ㅋㅋㅋ,5,2021년,럭키볼 재밌고 좋네요,['럭키']
2020년 6월 10일,이시국에 방역 출입명부용 QR코드를 카카오톡이 아닌 카카오 페이로만 제공할 수 있다는 이유가 궁금합니다.,1,2020년,이시국에 방역 출입명부용 QR코드를 카카오톡이 아닌 카카오 페이로만 제공할 수 있다는 이유가 궁금합니다,"['시국', '방역', '출입', '명부', '코드', '로만', '제공']"
2020년 12월 22일,편리하고 좋아요,5,2020년,편리하고 좋아요,['편리']
2021년 4월 5일,카카오 능력없는 개발자들 싹쓸이해서 만든 앱이 이건가... 완성도 수준이 엄청나다,1,2021년,카카오 능력없는 개발자들 싹쓸이해서 만든 앱이 이건가 완성도 수준이 엄청나다,"['능력', '개발자', '이건', '완성', '수준']"
2022년 2월 9일,페이백 혜택도 없고. 이벤트 혜택도 적고. 돈을 집어 넣어둬야 하는 이유를 못찾겠음,2,2022년,페이백 혜택도 없고 이벤트 혜택도 적고 돈을 집어 넣어둬야 하는 이유를 못찾겠음,"['혜택', '이벤트', '혜택']"
2022년 1월 30일,에러가 너무 심해요~ 앱개발 제대로 해주세요 ㅜㅜ,1,2022년,에러가 너무 심해요 앱개발 제대로 해주세요,"['에러', '심해', '개발', '제대로']"
2021년 2월 5일,너무좋고 나무증권처럼 카카오 mts 출시하고 otp혼합형 페이체카드까지있으면 완벽할것같아요 자산관리좋은데 주식과 가상화폐투자가없어 아쉽네요,5,2021년,너무좋고 나무증권처럼 카카오 MTS 출시하고 OTP혼합형 페이체카드까지있으면 완벽할것같아요 자산관리좋은데 주식과 가상화폐투자가없어 아쉽네요,"['나무', '증권', '출시', '혼합형', '이체', '카드', '완벽', '관리', '주식', '가상', '화폐', '투자가']"
2021년 12월 30일,업데이트 됬는데 새마을금고랑 연동이 안되네요ㅜㅜ 이제 새마을 금고는 연동이 안되는 건가요? (주로 새마을을 쓰고 있는데ㅠㅠ),3,2021년,업데이트 됬는데 새마을금고랑 연동이 안되네요 이제 새마을 금고는 연동이 안되는 건가요 주로 새마을을 쓰고 있는데,"['업데이트', '새마을금고', '연동', '새마을', '금고', '연동', '주로', '새마을']"
2023년 4월 7일,엡이 갑자기 자꾸 강제 종료되는데 제거후 다시 깔아야하나요?,3,2023년,엡이 갑자기 자꾸 강제 종료되는데 제거후 다시 깔아야하나요,"['강제', '종료', '제거', '아야']"
2021년 6월 2일,카드에서 페이로 은근슬쩍 바꾸는 것 좀 그만해요. 의도가 다분히 보입니다.,2,2021년,카드에서 페이로 은근슬쩍 바꾸는 것 좀 그만해요 의도가 다분히 보입니다,"['카드', '은근', '만해', '의도', '다분']"
2021년 3월 5일,은행도 연동도 안되고 카드도 안되고 다른 제휴사나 국세청 이라든가 안됨.. 카카오페이를 지워다가 다시 깔아도 모든게 연동이 안됨..,1,2021년,은행도 연동도 안되고 카드도 안되고 다른 제휴사나 국세청 이라든가 안됨 카카오페이를 지워다가 다시 깔아도 모든게 연동이 안됨,"['연동', '카드', '제휴', '사나', '국세청', '모든', '연동']"
2020년 1월 29일,편리하고 좋아요,5,2020년,편리하고 좋아요,['편리']
2021년 5월 9일,아니 이거 왜자꾸 동생계정으로 등록되서 쓰지를못해요 수정도 안되고 머 어떻게 하라는건지 로그아웃해바도 아이디는 내껀데 등록은 동생껄로 되있고 허,1,2021년,아니 이거 왜자꾸 동생계정으로 등록되서 쓰지를못해요 수정도 안되고 머 어떻게 하라는건지 로그아웃해바도 아이디는 내껀데 등록은 동생껄로 되있고 허,"['동생', '계정', '등록', '못해', '수정', '로그아웃', '아이디', '내껀데', '등록', '동생']"
2023년 2월 13일,본인확인하는 데 주민번호 다맞게 썼는데 인증이 안됨,1,2023년,본인확인하는 데 주민번호 다맞게 썼는데 인증이 안됨,"['본인', '주민', '번호', '인증']"
2020년 7월 16일,"페이 리워드 받기가 안됨니다. 앱 화면에선 어디있는지 모르겠고, 카카오톡 대화창에서 리워드 받기하면 무한로딩",1,2020년,페이 리워드 받기가 안됨니다 앱 화면에선 어디있는지 모르겠고 카카오톡 대화창에서 리워드 받기하면 무한로딩,"['워드', '화면', '화창', '워드', '기하', '무한', '로딩']"
2021년 3월 30일,모든이가 좋아요 행운이 깃들길빔니다,5,2021년,모든이가 좋아요 행운이 깃들길빔니다,"['모든', '행운']"
2021년 2월 23일,편리하고 좋아요,5,2021년,편리하고 좋아요,['편리']
2021년 3월 16일,써보니 편리하고 좋으네요~~,4,2021년,써보니 편리하고 좋으네요,['편리']
2022년 1월 12일,펀드하고 있었는데 이번에 투자 탭이 주식으로 바뀌면서 펀드를 어디서 확인해야하는지 모르겠습니다...,4,2022년,펀드하고 있었는데 이번에 투자 탭이 주식으로 바뀌면서 펀드를 어디서 확인해야하는지 모르겠습니다,"['펀드', '이번', '투자', '주식', '펀드']"
2022년 10월 15일,언제 복구 돼는건가요 안내문자나 그런것도 없고 황당그자체 이런거 법적문제 있는거 아닌가?,1,2022년,언제 복구 돼는건가요 안내문자나 그런것도 없고 황당그자체 이런거 법적문제 있는거 아닌가,"['언제', '복구', '안내', '문자', '황당', '법적', '문제']"
2021년 6월 7일,자꾸 로그인 하라고 나옴 불편해서 쓰기 싫어지네요,3,2021년,자꾸 로그인 하라고 나옴 불편해서 쓰기 싫어지네요,"['로그인', '불편', '쓰기', '지네']"
2023년 1월 31일,걸음수 측정이 잘 안됨,1,2023년,걸음수 측정이 잘 안됨,"['걸음', '측정']"
2019년 7월 8일,제계정인데 본인인증이 틀리다고 나와요 핸드폰 번호바꾼지도 꽤되엇는데 카톡은 연동되면서 번호이동은 연동안되는건가요? 다른사람 명의도아닌데 왜 안되는지 모르겠네요 고객센터전화해도 해결방법없다고 하기만하고 쓰지말라는 소리아닌가요?,1,2019년,제계정인데 본인인증이 틀리다고 나와요 핸드폰 번호바꾼지도 꽤되엇는데 카톡은 연동되면서 번호이동은 연동안되는건가요 다른사람 명의도아닌데 왜 안되는지 모르겠네요 고객센터전화해도 해결방법없다고 하기만하고 쓰지말라는 소리아닌가요,"['제계', '정인', '본인인증', '리다', '핸드폰', '번호', '연동', '번호', '이동', '연동', '다른사람', '명의', '도아', '닌데', '고객', '센터', '전화', '해결', '방법', '기만', '소리아']"
