날짜,리뷰,별점,month
2022년 12월 16일,폰을 새로 바꾸고 나서 앱을 설치했는데 흰 화면만 뜨고 작동이 되지 않아요 ㅠㅜㅠ 재 설치도 여러반 해보았지만 안되네요 버그 빨리 고쳐주시길 바라요,1,2022년
2023년 8월 3일,돈이 애지간히 없는가봄 광고땜에 느려지고 증권은 안드가짐,1,2023년
2020년 12월 7일,사용 하기는 다른 어플 보다는 토스가 1등 입니다 하지만 바라는 점이 있다면 1)토스 머니 충전 한도 5백 까지면 좋을듯 합니다(한도 계좌 풀어주는 씩으로?) 2)업데이트 수신이 쫌 느린듯 합니다,5,2020년
2023년 6월 15일,제가 학생이라서 급식뭐나오는지 매일보는데 금요일급식을 보려고하는데 월요일 급식부터이고 금요일건 안보이는 버그가생겼는데요. 급식 뭐나오는지 보는게 제인생 유일한낙인데 꼭 고쳐주세요.,4,2023년
2023년 2월 24일,받은 포인트를 왜 알림창에서 보여 주나요? 설정한 적 없는데 갑자기 뜨고 끄지도 못하고 끄는 방법도 없고 쓸모도 모르겠고 패치 노트에도 관련 내용이 없는데 왜 이런 일을 당해야 하나요?,1,2023년
2019년 4월 18일,비상금 모으기 에서 자동저축 금액 조절이 안돼는거 같습니다 조금씩만 모으기로 설정했는데 4400원이 빠져나가네요 원래는 1000원 정도 빠져나갔는데 어떻게 된거죠?,3,2019년
2019년 9월 29일,설치 후 삭제했는데 왜 문자에 송금 버튼이 남아 있으면서 계속 누르면 토스 설치 하라고 나오는건 어디에 악성코드 심어 놓은건가요? 이메일 보내도 답장이 없고 삭제했으면 안 떠야하는데 계좌번호만 있으면 송금 버튼이 계속 있고 삭제 하게 해결해주세요,1,2019년
2022년 7월 15일,미성년자도 편안하게 사용할수있어서 저를필두로 제 친구들도 많이 사용해요! 정말좋은토스 친구 초대혜땍 좀늘려주시면 더좋고 에이블리 이벤트도 많이만힝 부탁드려용ㅇ!!😃😃,5,2022년
2023년 6월 8일,지금 내 계좌정보를 불러오지를 못함 계속 토스쓰고 확인하는데 이런경우 처음입니다..,3,2023년
2020년 2월 9일,만보기를 이렇게 업데이트 해놓으실거면 애초에 만보기 지갑의 금액 만료기간을 없앤 상태에서 이렇게 하시지.. 아쉬운 업데이트네요.. 차라리 기존으로 바뀌었으면 하는 바램입니다.,1,2020년
2023년 10월 22일,이 앱을 사용 하지 마세요!!성격이 변화 됩니다!그것도 사람을 죽일수도 있는 악질적으로 변화가 됩니다.,1,2023년
2022년 1월 2일,점점 토스사용이 불안해지네요 오류도 자주나고 버그도 심하고 갑자기 또 계좌연결 끊어버리고 접속장애로 몇일 저금통 돈을 찾지못해서 연체될뻔한적도 있고 . .그래도 한마디 하자면 올해는 토스가 안전한 뱅크로 성장했으면 좋겠네요.,3,2022년
2022년 9월 5일,요 근래에 쓰는 금융 어플중 3개가있는데 1개로 줄을 정도로 이용이 편리하고 MZ세대만 아니라 어르신 분들에게도 사용이 편리한UI 게다가 한눈에 알아볼수있게 만들어진 계좌관리 나의 신용등등 실생활하며 필요한 금융편의기능이 3가지쓰면서 단언컨대 최고라 생각됩니다.,5,2022년
2022년 4월 24일,"자동이체 리스트 일자별로 나열이 안되고 무작위라서 보기가 불편합니다. 일자별로 나열되도록 기본값을 해둘 수 있게 되면 좋겠고, 아니면 리스트 순서를 개인이 하나하나 조정해서 수정할 수 있어도 좋겠습니다.",4,2022년
2020년 1월 30일,토스만보기 내가 걸은만큼 돈주더니 갑자기 업데이트 하고나서 리워드로 바뀌더니만 딸랑 10원주네요;;; 가뜩이나 매일 몇십원씩 받는데 그래도 찔끔찔끔 천원모아본다고 나름 열심히 바꾸고있었는데.. 만보 못걸으면 10원 받고 할바엔.. 그냥 만보기 기능으로나 쓰고 아예 저런기능 없애버리는게 나을듯;;,1,2020년
2020년 1월 31일,만보기 업데이트 한다고 해서 전에보다 더 좋을줄 알았는데 만보를 채워도 30원 밖에 안주고 친구랑 합쳐야지 100원을 주고 이게 뭐가 업데이트가 된거냐 그냥 전에처럼 자리가 걸음만큼 영상보면 주는걸로 하면되지 왜 굳이 바꿔서 이렇게 하는지 도무지 이해가 안되네 그냥 전에처럼으로 바꿔주세요,1,2020년
2022년 11월 19일,고생하십니다. 다름이 아니라 갤럭시워치 사용중인데 워치만 착용시에도 만보기 걸음수를 연동하는 방법이 있을까 해서 문의드립니다. 감사합니다.,5,2022년
2023년 9월 19일,송금이체 편하게.. 無수수료,4,2023년
2023년 2월 18일,"전체적인 사용자 편의성은 만족스러운데, 왜 친구와 함께 토스켜기에서는 바로 옆에 있는데도 안잡히나요?? 블투기능 권한 등은 전혀 이상없거든요..",3,2023년
2019년 2월 10일,타임라인에서 조회하는거 너무 불편합니다 업데이트 전에 계좌별로 조회했던게 훨씬 편했던거 같습니다 그리고 지출은 표시되는데 분명히 돈이 들어왔는데도 수입이 계속 0에서 늘어나지도않고 아래표시도 되지않습니다 왜 그런지 궁금하네요,3,2019년
2018년 10월 7일,계좌 이체할때 공인인증서 ars 보안카드 등의 귀찮은 절차를 안거치고 바로 할 수 있어서 너무 좋아요! 그리고 타행이체 할때 수수료가 깎이지 않는것도 좋아요,4,2018년
2020년 2월 29일,다른건 다 좋은데 계좌 업데이트가 너무 느리고 잘 안됩니다... 응답시간이 느려서 실패했다는 메세지도 자주 뜨구요.. 빠르게 조회를 할수있으면 좋을거 같습니다.,3,2020년
2020년 3월 11일,인터넷이 잘 되는데도 항상 로딩이 너무 너무 느려요 업데이트 해도 로딩이 너무 느려요...갤럭시 s10e 기종입니다...ㅜㅠ,1,2020년
2019년 7월 16일,정말 잘쓰고있는데요 상대방이 토스를 사용하지않으면 소용이없다는 리뷰를 보고 궁금해서 그런데 쇼핑몰이나 사이트에 주문을해서 입금하는 경우에도 해당되나요? 사이트 운영자도 토스를 사용해야 되는건가요? 최대한 빠른답변 부탁드려요,5,2019년
2018년 12월 8일,"계좌 등록하려고, 인증서를 연동시키려는데 만료일이 지나서 재발급 했거든요.. 그런데 재발급하고 인증서를 연동시키려는데 예전에 만료된 인증서만 나오네요ㅠㅠ",4,2018년
2023년 7월 3일,나머지는 다 좋은데 왜 50 만원이 한도인가요?? 이거 좀 고쳐주세요ㅠㅜ 100만원 이상이 한도 이면 좋겠네요 네ㅠ 이것만 빼면 다 좋아여,5,2023년
2019년 6월 12일,잘 사용 중입니다. 그런데 어느날 부터 송금이나 잔액확인시 지문으로 인증하던게 비밀번호로 바뀌었브라구요. 다시 지문으로 바꾸는 방법 알 수 있을까요? 설정 들어가도 안보이던데,5,2019년
2019년 3월 6일,꾸준히 잘 사용하고 있습니다 최근사용계좌가 개수 제한이 있어 후순위가 지워지니 자주사용하는 계좌 등록을 할 수있으면 좋을것같습니다,5,2019년
2022년 9월 28일,새로 바뀐 로고 다른 어플이랑 헷갈려서 상단바를 자꾸 내려보게 돼요; 상단바 아이콘을 바꿀 수 있게 해주시던지 하셨음 좋겠는데요 // 답변에 대한 답변입니다. 아니 상단바 아이콘 수정 기능 넣어달라고 말씀 드리는데 동문서답을 ㅋㅋㅋㅋ; 배짱장사 하시나요,1,2022년
2019년 10월 16일,"오늘 아침 업데이트 알림을 보고, 업데이트를 했는데, 이후부터 앱실행이 안되요. 앱 삭제후, 다시 다운받아 실행해도 계속 튕겨져 나와버리네요. 어쩌죠? ㅠㅜ",3,2019년
2022년 11월 7일,메뉴가 점점 많아져 찾기가 힘들어 집니다. 메뉴 검색 기능이 있었으면 좋겠네요,4,2022년
2019년 3월 3일,얼마인지 잔고도 모두 보이고 한눈에 여러 서비스를 사용할 수 있어서 좋아요. 다만 거래한 당사자를 검색해서 어떤 거래를 했는지 알 수 있는 서비스도 추가되면 더 좋겠어요^^,5,2019년
2022년 12월 6일,교통카드 충전 기능이 원래 막혀있었는데 갑자기 생겼길래 해봤는데 몇 번을 해봐도 카드인식이 안되네요. 아직 완벽하게 고쳐진 게 아닌가요?,5,2022년
2021년 1월 21일,조회했을 때 왜 한 번에 업뎃이 안 되나요? 입출금 하고 바로바로 내역이 업뎃 돼야 하는데... 새로고침을 10번은 해야 업뎃이 되는데...ㅜㅜ,3,2021년
2019년 5월 4일,예전처럼 토스 통장 여러개 만들어서 목표정하고 저축하기 생기면 좋겠네요... 이상하게 주 마다 빠지는걸로 바뀌구... 좀 별루,3,2019년
2021년 1월 21일,정말 좋은데 주식 관련 항목도 있었으면 좋겠습니다! 꼭 부탁드리고 싶은건.. 소비 달력 위젯이 나온다면 더 없이 좋을 것 같아요 꼭 부탁드려요 꼭꼭ㅜㅜ,5,2021년
2019년 12월 31일,제가 농협 계좌를 사용하면서 업데이트를 하고 나서 새로 아이디와 비밀번호를 입력을 하다가 비밀번호를 5번 틀렸는데 로그인 제한 상태가 되서 비밀번호를 한번 바꾸고 다시 시도했는데 안 돼네여,3,2019년
2019년 2월 28일,편하고 좋음. 접근이 너무 쉬워서 보안이 걱정되기는 함. 그래서 토스 계좌에는 얼마 안 넣음,4,2019년
2021년 12월 28일,업데이트하더니 쓰레기가 되었네요ㅡㅡ계좌고카드고 죄다 기관오류라면서 아무리 조회해도 연결안됩니다 매번 새로운 정책할때마다 선사고 후수습이던데 제대로 구동해보고 오픈해야하는거아닌가요? 이번 업뎃도 사용자만 불편하게 만든 업뎃이네요 나중에 계좌털리는건 아닌가몰라 이렇게 시스템이 문제가 많아서 믿고 쓸수있는지,1,2021년
2021년 11월 12일,"토스 통장 사용하기 편해서 주거래 통장으로 쓰려고 했는데, 신용카드나 보험 등 결제계좌로 쓰려고 변경신청 했는데 제휴된 곳이 넘 적네요. 메이저 카드사도 안된다고 하고...",4,2021년
2020년 2월 9일,바뀐 만보기가 불만스럽네요. 저 같은 경우엔 친구가 많지 않은데 다들 많이 걷지 못하면 하루 60원 채우기도 힘들어요. 그러면 30일이 지나면 없어지는데 그 기능을 없애주시고 1000원이상 채워지면 출금 될 수 있게 계속 돈이 쌓이는걸로 했음 좋겠어요.,1,2020년
2023년 9월 25일,주변에 토스켠 사람 찾기에서 친구맺음 하지 않아도 홍*동으로 떠서 모르는 무리가 홍땡동 토스켜라 그러는데요;;; 주변에 토스켠 사람찾기에 실명을 쓰는 이유가 있나요? 버스 정류장 근처에서 저러고 다녀서 ...,1,2023년
2022년 9월 4일,"잘 애용 중입니다. 그런데, 만보기 도전 인증 서비스 시작후, 알림 버튼만 클릭하면, 앱이 종료되며, 의견보내기도 안됩니다. 제거후, 재설치 반복 3회 째...",3,2022년
2022년 12월 11일,완전 좋아요 이 앱 강추에요! 특히 체육대회! 재밌어용 근데 모르고 버스충전을 실수로 5000원을 했는데.. 못 되돌리네요 되돌리는 방법은 없나요? 어찌됐든 이앱 짱이에용😽😻,5,2022년
2019년 10월 4일,카드를 연결하려 했지만 인증서가 자꾸 폐기되었다고 연결되지 않는다. 인증서 문제로 은행에 문의도 하고 새로운 공인인증서도 만들고 앱을 지웠다가 다시 깔기도 하였으나 여전히 작동되지 않는다,1,2019년
2019년 9월 13일,답이 없다 토스 최신 버전에 아무 문제 없는데 재설치 해도 송금실패 사유는 앱 업데이트가 필요하단다 ㅋㅋㅋ 4.32.3 최신 버전인데 업데이트가 대체 왜 필요하다는거?? 입금이 안돼서 참 불편 토스머니로도 계좌로도 안되네 ㄹㅇ,1,2019년
2022년 8월 16일,너무 좋아요 가볍고 간편함 개선점으로는 모으기통장들 순서바꾸기 기능이 있었으면 좋겠어요,5,2022년
2022년 9월 28일,토스.진짜 넘 잘쓰고있어요 그런데 증시에서 새로운 소식도 좀 도 디테일하게 나왔으면 좋겠어요 영상으로든 기사로든 넘 증권 기사가 적으니 다른데 들어가 보고 다시 토스 증권에 들어 와야 하는게 좀 불편 하네요 이런 점을 첨부하면 별이 다슷개 입니다~~(^~^),4,2022년
2020년 6월 20일,알림 안뜨게 설정해도 계속 옴. 지들이 뭐라고. 지들이 되게 중요하다 생각하나봄 귀찮아죽겠음. 계속 소액분산형 투자상품 출시 알람 오면 조만간 지울거 같음.,1,2020년
2021년 1월 15일,대체 이거 업데이트를 왜 한거임 토스머니로 주계좌 설정도 안되서 토스 쓰는 이유가 없네요 다른 사람이 이체하면 토스머니로 들어와야지 왜 엄한데로 가냐구요 토스 장점이 사라졌잖아요 이거 기획한사람은 먼생각으로 만든건지 답변은 무슨생각인지 토스머니로 변경가능하게 앱에서 기능을 만들어야지 그거 바꾸려면 전화를 해야지 토스가 텔레뱅킹임?,1,2021년
2023년 7월 11일,밤 10시에 일하시는 토스 po들 보세요. 새벽 2시에 디자인 의견 던지는 치과의사 보세요. 겁나게 유저 중심으로 일하시는 토스 디자이너들 보세요. 토스프라임 유저가 왜 광고를 봐야하나요? 토스 옵티머스 프라임 결제하면 광고제거되나요? 유료 구독을 하는데 광고넣는 회사가 있어요? 오 예외가있어요? 근데 그게 일반적인가요? 본인들 회사가 적자여서 자금수혈하는 형국이라지만 이건 말도 안되는 비즈니스 오리엔티드 결정 아니에요? 이건 UT 안하셨나요?,1,2023년
2021년 10월 8일,잘 사용하고있는데 며칠전부터 연결계좌 잔액이 정확하게 안나오고 초기화시켜도 동일하네요ㅠ 제거만그런건진 모르겠는데 오류라면 해결 좀 부탁드려요.,4,2021년
2019년 10월 8일,중국에서 사용은 불가능. 계정정지가 너무 빈번함. 서비스 이용이 재미있어서 유지해보려했으나~ 계정정지 푸는것도 지쳐서 저는 이만 토스 하차하렵니다~,1,2019년
2022년 12월 16일,출시일 바로 그날에 깔아 잘 사용하고 있어요. 편리하고 수수료 무료에 좋습니다. 고객센타 도 24시간 365일 운영을 하고있고 무엇보다 상담사 분들이 매우 친절하게 응대를 해주 었습니다. 나는 토스가 서비스를 그만 두는 그날까지 애용을 할것 입니다.,5,2022년
2019년 2월 22일,이체가 너무 간편하고 ‥알림 서비스까지 있어서 상대방도 바로 확인 가능하니 편리하네요~ 주변 사람들에게 적극 추천이요~~,5,2019년
2023년 6월 4일,앱 왜이렇게 버벅버벅대고 불안정한가요 갑자기 광고가 늘어나면서 앱이 오작동되네요 돈벌이는 알겠는데 앱안정화가 먼저아닌가요,1,2023년
2021년 3월 7일,혹시 해외에서는 사용 할수 없는 건가요? 해외에소 살고 있는데 어플이 좋아 보여서 사용 하려고 했는데 안되네요 한국 전번이 필요하다고 해서 .,4,2021년
2018년 9월 14일,토스 잘쓰고 있었는데 요즘 너무 엉망이네요 잔액조회도 업데이트도 안되고 카드조회도 하나도 안맞아요 카드 두개를 등록했는데 하나는 아에 인식조차 못해서 사용금액 측정을 못하네요,2,2018년
2019년 12월 3일,빠르고 신속하며 다양함으로 무장된 앱이라 사용하면서 매우 만족하면 경험하며 삶니다. 감사합니다.,5,2019년
2019년 1월 28일,토스계좌 채우기를 해도 채워지지가 않네요 평소에 잘 쓰던 앱인데 빠른 개선이 필요합니다 3일째 채우기가 안돼요,2,2019년
2023년 9월 19일,줄겁게 운동하고편함,5,2023년
2020년 1월 6일,"처음으로 통장을 만들고 토스 카페 안 쓴지 4년째에 토스를 다운 받아서 썼습니다. 횟수 제한이 있지만 수수료 없이 바로 송금할 수 있어 편리하고, 부가 기능도 이용해봐야 겠네요. 좋은 앱 만들어주셔서 감사합니다.",5,2020년
2022년 10월 6일,폰을 바꾸면서 새로운 폰에 토스를 로그인하려는데 정보가 맞지 않다고 안되다가 전 폰에서 지우면 괜찮나 싶어서 지우고 새폰으로 로그인 했는데 인증 최대횟수를 넘었다고 안된다고 하네요;; 새 폰으로 토스를 못하게 하면 토스를 쓰는 이유가 없네요 ;;,3,2022년
2021년 6월 1일,"뭐야 내가 쓴 리뷰어디감ㅡㅡ 주식을 하기에 너무 불편합니다. 주식잔고, 주식주문 메뉴 따로 만들어주셔야지 그냥 내려야만볼수있어서 빠른대응이어렵네요",1,2021년
2023년 10월 14일,교통카드 충전하는데 7천명을 기다리라고하네요,1,2023년
2020년 1월 29일,만보기 이번버전 너무별로임.. 전버전이 훨씬 좋음ㅠㅠ 지금버전쓸바엔..다른만보기어플써야될듯함...주변에좋다고 쓰라고말햇는데..바뀌어버리다니ㅠㅠ..다시돌려주세요 엉엉엉 친구없으면 만보기하지도못함.,1,2020년
2019년 9월 27일,이번 업데이트 너무 좋아진것 같습니다! 카드 및 통장 지출내역을 보기좋게끔 정리가 잘 되어져서 너무나 만족합니다. 이제 지출을 줄일 일만 남았네요^^,5,2019년
2023년 3월 22일,휴대폰 바꾸고 나서부터 계속 어플 실행하는데 오류가 심합니다 삼성 z플립4인데 기계문제는 아니라고 하더라구요ㅠ 토스 넘 좋아하는데 사용 제대로 못하고 있으니 방법 좀 찾아주세요^^,4,2023년
2021년 11월 12일,왜 실제통장 잔액이랑 틀릴까요?? 금액변동이 있는데도 계속 이전금액으로 표시되네요~ 클릭해서 들어가면 맞게 나오는데 첫페이지는 안맞아요~,4,2021년
2021년 8월 10일,"맘대로 푸시알림 좀 보내지 마세요. 백신예약, qr체크인, 무료송금 관심 없는데도 중요알림인 것처럼 알림설정도 못하게 해놓고 강제로 푸시알림 계속 보내면 삭제해야죠.",1,2021년
2023년 8월 7일,진짜 좋으니 한번만 깔아보세요 진심 최고!,5,2023년
2020년 9월 28일,사용하기 편리하고 자신의 재정상태도 쉽게 확인할수있어 좋아요 그런데 토스프라임 첫달 무료아닌가요?3900원이 빠져나갔다 들어왔다 다시 빠져나갔는데 이게 어떻게 된일인가요?,4,2020년
2019년 5월 10일,"우리은행 계좌 연결해서 잘 쓰고 있다가 비밀번호 변경해야한다면서 연결이 끊긴 후 비밀번호 변경 해도 계속 2회째 오류라고 안되네요^^ 틀린게 지금 몇십번이 넘어가는데 2회째라뇨 ㅋㅋ 제가 잘못 눌렀나 해서 우리은행 아이디 비밀번호를 3번을 넘게 바꿨습니다. 그때마다 2회째 오류라고 뜨는데 제가 도대체 뭘 더 어떻게 해야하죠? 제가 무슨 단기성 치매라도 왔나 싶어서 우리은행 사이트에서 로그인 해도 잘 되고.... 이건 얼른 개편해주셨음 하네요 아니면 다른 앱으로 갈아타라고 돌려 말하시는건지^^,,,,,, 토스 얼마나 편하게 썼는데 조금 허탈하네요",1,2019년
2021년 3월 13일,"평소 잘 쓰고 있습니다. 그런데 어제부터 갑자기 정보를 불러올 수 없다는 멘트와 파란색 재시도 버튼이 뜨며 조회가 안 돼서 굉장히 불편합니다. 삭제했다 깔려면 또 은행 하나하나 다시 동기화시키고 인증서 하고 이래야 할까봐 여기 남깁니다. 어떻게 해야하나요,",5,2021년
2021년 6월 1일,토스 만보기가 자동으로 작동되지않아 불편해요 예전엔 삼성헬스와 오차가 거의 없었는데 바뀐 이유를모르겠네요. 개선좀해주세요. 다른 금융서비스는 너무 좋은데 매일 운동하며 만보기 채우면서 걷다가 깜박할때 살짝아쉬움,5,2021년
2022년 9월 5일,다 좋은데 은행을 대체할 앱이면서 정작 세부 메뉴는 은행앱처럼 중구난방이네요 정리가 필요하고 검색 기능도 있어야 할 것 같습니다.,4,2022년
2023년 8월 21일,오늘자 업데이트 하지마세요 혜택탭 안되는항목 많아요,1,2023년
2023년 5월 13일,토스 비밀번호를 3번만 틀렸음에도 5번 틀렸다며 계정이 잠겼습니다. 풀려고해도 카카오뱅크 미니라서 못하네요,1,2023년
2022년 1월 7일,쓴내역이 한눈에볼수있고 보기좋게되어있어 이 앱을사용했었는데 업시킨후로 이게뭐지 황당했네요~ 예전앱으로 바뀌었으면좋겠어요^^별하나두 아까워요~,1,2022년
2022년 10월 10일,사이판 여행중이고 로밍과 지역 와이파이 사용중입니다 해외에서는 토스사용이 불가한가요? 지금 와이파이 끄고 로밍으로 하니 되네요 와이파이가 아닌 로밍사용하니까 잘 됩니다,5,2022년
2018년 12월 5일,토스 사용하는 유저입니다 송금도 삐르고 흠잡을곳이 없는데 어느순간 토스가 초기화면으로 돌아가서 다시 등록을 하게되는데 제가 휴대전화 사용할일도 별로 없디보니 휴대전화를 정지시켜 카드인증으로 하려하니 농협카드는 서비스 준비중이라는데 언제쯤 농협카드 인증이 가능한가요?,4,2018년
2021년 9월 16일,"제가 얼리어답터는 아닌 편이라 토스를 이제야 써봤는데 너무 신세계네요, 지금까지 써본 어떤 가계부 어플보다 똑똑하고 주식도 되고 유용하게 잘 사용하는 중입니다 그런데 보안문제는 약간 걱정이 되기도 하네요",5,2021년
2023년 4월 9일,다른거는 다 편리하고 좋은데 계속 저금통에 채우면 꺼낼때 인터넷연결문제로 안 꺼내지고 와이파이 빵빵하게 해도 안 꺼내져요 제 친구도 그런다 하네요ㅜ,3,2023년
2022년 4월 19일,만보기는 앱을 사용시만 가능합니다 주머니에 들어 있으면 전혀 인식안함 타 어플과 너무 차이남 (타 어플 3800보일때 토스는 210보 나옴) 조정해 주세요,1,2022년
2019년 2월 22일,토스 사용한지 몇년 된 것같은데 지금까지 아무 문제 없었어요~ 은행 계좌를 다 한번에 확인하고 송금도 복잡한 절차없이 간편하게 할 수 있어서 편해요.,5,2019년
2023년 7월 16일,앱 사용중에 폰이 먹통이 되는 심각한 문제는 언제 수정할건가요?,1,2023년
2021년 9월 8일,혹시 제 리뷰쓴거 지웠나요??? 다시한번 질문합니다 또지우면 토스 전화할게요. 토스증권 시간외거래 기능 키움이나 다른곳은 있는데 해외증권이나 시간외거래 기능은 언제 넣나요? 이거없으면 옮기려고요,1,2021년
2020년 3월 17일,다른건 문제가 거의 없는데 30만원 한도가 걸려있는 거랑 상품권 기능이 전혀 안되는게 문제입니다. 특히 상품권은 수량을 선택하려 하면 자동으로 꺼집니다.,3,2020년
2019년 5월 31일,토스카드도 잘 쓰고 있습니다 다만 온라인 결제시 bc카드로 선택하면 가능하다는 점을 최근에야 알았습니다 이점을 확실히 안내했으면 더 좋았을 것 같네요,4,2019년
2020년 12월 9일,다좋은데 토스머니를 홈화면에 자주쓰는계좌에서 삭제해버렸는데 다시 등록할수없어요....토스 자동저축계좌는 계좌편집에서 홈에 보일수있는데 토스머니는 불가능하네요 빨리 가능해지길 빕니다...,4,2020년
2022년 4월 14일,"편한 서비스는 좋은데 주간 제휴 상품 구매 후 상금 금액도 오류로 인해 안들어와서 직접 문의해서 받아야했고, 걷기 인식이 매우 안좋아요. 스마트폰 자체 지원은 하루 8000걸음 이상을 걸었는데 토스에선 1000걸음 밖에 인식이 안되요.",3,2022년
2019년 3월 12일,토스를 오랫동안 사용해왔지만 빈틈없는 앱입니다^^수수료로만 조금 많이빠져나갔지만 편안해요!!무료수수료조곰만더주시면감사하겟습니다!!,5,2019년
2023년 4월 24일,토스 잘 쓰고있어요. 점점 더 영역이 확대되더라고요. 다른 은행들이랑도 연결도 다 되고. 토스 가계부 만들어줘요. 그리고 가계부를 위젯으로도 해놓고 바로바로 쓸수있게 해줘요~~,4,2023년
2022년 1월 25일,한동안 잘 쓰고 있었는데 2022년도부터 사용내역이 뜨지않고 잔액이 맞지 않아서 제보해놨더니 이제는 아예 뜨지를 않네요. 계좌연결하려고 했더니 우체국은 이제 연결이 안되는지 은행 목록에 뜨지도 않고... 인증서로 연결하는 것도 공인인증서나 패스로 연결할 수 있으면 좋을텐데요.,2,2022년
2022년 9월 29일,업데이트 이후 앱 열때마다 인증하라고 해서 너무 불편해요. 어떤 대가리에서 나온건지.. 진짜 일을 쓸데없이 하네요. 포인트 5천점 되면 통장으로 받고 토스는 탈퇴해야겠어요,1,2022년
