날짜,리뷰,별점,month
2023년 10월 14일,대부분 잘 쓰고 있지만 교통카드 시스템 업데이트 이후로 대기가 생기고 시간이 길어져 불만이 많습니다. 처리 가능한 서버가 하나밖에 없는지 20분동안 5000명대에서 줄어들지를 않고 있어요. 버스를 타야하는데 대기때문에 결국 걸어서 왔네요. 이 정도면 교통카드는 차라리 따로 사서 쓰는게 나을 정도라고 생각까지 들고요. 가끔은 하얀 화면에서 다른 UI가 뜨지 않고는 멈춰있는 경우도 있습니다. 이 경우는 나갔다 들어오면 개선되기는 하지만 이럴때마다 나갔다 들어올 수도 없고요. 이런 점 개선 부탁드립니다.,3,2023년
2023년 9월 6일,동영상 광고 들어가고 여러 기능이 이후로 앱이 무거워짐. 버벅거리거나 로딩이 심함. 동영상 광고 들어가는거로 바뀐 이후로 쭉 생각했으나 동영상 광고는 정말 아닌 것 같음. 그리고 원래 토스앱이 깔끔하고 가벼워 사용하였는데 혜택도 줄고 어플에 별로 이용하지도 않는 기능들과 영상광고 같은것만 잔뜩 추가되면서 점점 이용이 불편해집니다... 제안점: 1. 뺄건 빼고 가볍게 갔으면 좋겠습니다. 2. 혜택을 위해 광고 시스템을 도입하는게 필수불가결한 상황인건 인지하고 있습니다. 다만 이미지형태의 광고를 기본으로 게시하고 동영상광고를 보면 추가혜택을 주는 방향으로 진행하는것도 고려해주시면 좋겠습니다. 정 안된다면 동영상 광고가 데이터 환경에서 자동재생만이라도 좀 안되게 해주세요.(3초뒤 멈춤 이런거 말하는거 아닙니다...),1,2023년
2023년 10월 17일,"핸드폰이 느려져 이상했는데, 디바이스케어에서 토스 리소스가 많아 폰이 느려져 토스앱을 삭제하라고 하네요.. 지난번 추석전 업데이트 이후 친구와함께 토스켜기에서 폰을 서로 포개도 블루투스가 잡히질않고 몇번 나갔다 들어와야 친구가 뜹니다. 그리고 음악을 듣다가 토스앱을 켜면, 광고 때문에 음악이 끊겨 짜증납니다. 광고 자동실행 보다는 사용자 의지에 의해 시청할수 있게 변경해 주세요. 만보기도 개선이 아니라 후퇴된 느낌 저만 그럴까요. 모두 그럴꺼예요. 돈이 없으면 아예 항목을 없애던가.. 항목에서 나은 방향으로 업데이트 한답시구.. 실망감만 오지게 주네요. 교통카드 충전 업데이트도 문제 있구. 참나~ 요즘 토스가 너무 무거워요.. 그동안 은행 관련업무를 아주 편리하게 사용하고 있었는데, 토스 리소스 때문에 삭제하는 일이 없도록 개선해 주세요.",4,2023년
2023년 10월 15일,"뒤로가기 ..터치 ..터치 하며 그대로 앱에서 나가는것이 아닌, ""나가시겠습니까? 확인 또는 뒤로가기 하시면 앱에서 나가기가 됩니다."" 란 부분의 시스템이 있으면 유용할 것 같습니다. 사실상 주위에 친한 여럿의 사람들도 이부분이 좀 개선이 있었으면 한다는 의견이 많습니다.(매우 많습니다.) 필요없는 앱에 접속한것이라면 그것을 계속 묻는게 짜증날 수 있겠으나..(생략)..아무튼 저 역시도 몇번이고 나가게 되었다가 다시 로그인하고...(주위사람도 뒤로가기 하다가 그냥 나가기가 되어서....어쿠/에이~/하~/..등등..)개선이 되면 귀사에도, 또는 불편해하는 개인들에게도 상당한 도움이 될 것이라 생각됩니다.>지극히 사견!!",5,2023년
2023년 10월 19일,"1시간에 10퍼센트 정도만 소모되던 배터리가, 토스만 사용하면 20~30퍼센트 소모됩니다. 백그라운드를 꺼도 마찬가지입니다. 알림이 많아서 그런건지, 실시간 작업이 많은건지, 심각하네요. 백그라운드 해제하고 재부팅 후 토스를 안열면 배터리가 정상적으로 소모됩니다. 저 뿐 아니고 여러 사람들이 이런 애로사항을 토로하네요. 절약 모드를 만들어 주시던지 대책을 세워주셔야 할거 같습니다.",3,2023년
2023년 10월 27일,토스 장점은 앱 자체의 완성도였는데 이젠 그 장점 마저도 시궁창이 됐네요. 느려지고 렉 걸리고 하루에도 몇번이나 프리징 됐다가 다시 켜지고 터치도 엉뚱한데 찍히질 않나 두번 세번 터치가 되질 않나 동영상 광고 이후로는 아주 난리가 났네요. 타은행앱 완성도나 무거움 중구난방 배치로 토스 앱이 최고라 생각했는데 그걸 스스로 폐기를 하시는게 참,1,2023년
2023년 10월 12일,"다른 리뷰처럼 점점 앱이 무거워짐. 걷기나 동영상 보고 포인트 모으는 재미라도 쏠쏠했는데 동영상은 정시 되자마자 끝났다고 뜨고, 포인트출금 수수료도 10프로 붙고, 파킹 이자도 내려가고요. 뭔가 재미없고 쪼잔한 어플이 되어가고 있음. 포인트 어플도 수없이 많고 이자 높은 인뱅도 많은데 초심 좀 유지하고 잘 운영했으면 하는 바램입니다.",1,2023년
2023년 9월 12일,"토스 잘 쓰고 있는데, 다른 앱에서 토스페이를 쓰려고 하는데, 토스프라임이 계속 같이 뜨더라고요. 결국 잘못 버튼을 눌러서 토스프라임을 결제하게 되고, 바로 해지했습니다. 토스 프라임 결제하기 전에 충분한 설명과 중간 단계를 조금 더 늘려주었으면 합니다. 이 부분이 다음 업데이트에 반영되면 좋을 듯해서 별점은 낮게 주었습니다.",1,2023년
2023년 10월 27일,"아무리 생각해도 업데이트가 포인트 덜 주려는 업데이트로밖엔 안 보입니다. 받는 입장에서 왈가왈부할 자격 없다는 걸 알지만 주려면 처음부터 끝까지 일관되게 주든지.. 사용 기간이 길어질 수록 어떻게든 포인트를 안 주려고 하는 게 영 좋게 보이진 않아서요. 운세에서 항상 무난하다고만 나오는 것도, 만보기 목표 걸음 수는 1400걸음으로 늘었는데 포인트는 10이 아닌 9, 8로 나오는 것도요. 기분 탓일지도 모르겠다만 너무 정도가 심해서 리뷰 남깁니다.",1,2023년
2023년 10월 24일,동영상 광고 땜에 진입 시간이 늘어나서 짜증남. 만보기 기능에 쓸데없이 아이템이 들어가서 귀찮게 터치하는 횟수만 늘어남. 어차피 포인트를 줄일 거면 그냥 줄이지 뭐하는 짓인지 모르겠다. 예전에 100원 주다가 40원으로 줄었을 때도 뭐 그럴때 됐지하는 심정으로 불만을 표하진 않았는데 이번엔 실망임,1,2023년
2023년 8월 19일,어제부터 토스 앱 엄청 느려지고 터치해도 한 참 뒤에 작동하고. 오류나서 꺼지기 반복하네요. 가족이랑 같이 산책 겸 만보기 위치 선정해서 해당위치가서 찍고 확인버튼 까지 눌렀는데 당시에는 찍어서 20포인트 받기 되었는데 집에 와보면 안찍은 걸로 되어있고. 이 오류도 며칠 전부터 계속 그렇고요. 제 폰만 그런게 아니라 가족들 폰에서도 동일 현상. 무엇보다 토스 앱만 터치 잘 안먹히고 엄청 느려졌어요. 빠른 개선 부탁드립니다.,1,2023년
2023년 8월 17일,"사람 많은 곳에서 실행하면 폰이 멈추고 5분 정도 아무것도 터치 안되다가 스스로 재부팅합니다. 오전 출근길 8시20분경 군자역에서 친구와함께토스켜기를 하는데, 지속적으로 반복되는데 개선이 안되네요. 이 증상 발생한 후 액정 나가서 교체받았습니다. 토스 앱 때문인지는 알 수 없으나. 교체 후에도 멈춤 재부팅 현상 반복되고 있습니다. 너무 열받습니다. 갤럭시 노트20 울트라입니다.",1,2023년
2023년 10월 11일,친구와 토스켜고 포인트받기 개선요청 1. 주변 토스 사용자가 친구 요청시 상대측 아이콘(내 단말에 보여지는)에 말풍선으로 친구요청 표시. 서로 터치후 친구가 된 경우라면 7p추가 지급. 2. 50회 안에 친구만 별도로 20회 카운트하여 10p지급.(누가 10원하고 3원하고 고르라고 하면 누구나 10원을 선택할건데 3원은 내눈앞에 바로 보이고 10원은 언제줄지 모름. 3원 대신 10원을 받으려고 한시간 두시간... 기다리기 지쳐서 3원이라도 받음. 그런데 3원 받자마자 어디선가 10짜리가 짠하고 나타나더니 메롱하면서 1원을 퉤 뱉고 도망감. 당신같으면 열이 받겠소? 안받겠소?) 3. 주변 토스앱을 켜지 않아서 흐릿하게 보여지는 경우 아얘 안보이게 하거나 친구로 등록된 사용자만 보이도록 요청. 4. 팝업스토어와 보너스 친구 아이콘은 화면 상단 위로 위치 변경. 그 자리에 주변 사용자가 더 많이 표시되도록. 그리고 주변 사용자 아이콘도 크기를 줄여서 7~8명정도 이상 보여지도록.,1,2023년
2023년 10월 27일,"확실히 토스 방문 미션이 없어지다보니 사람들이 토스어플을 잘사용을 안하는거 같다 그 사실을 알려주는것이 토스 함께 키고 포인트 받기 이다 . 토스 함께 키는 사람들이 없다보니 여기서 포인트 적립이 어렵다 . 토스 만보기를 다시 실행해서 토스를 잘 이용하는 사람이 많아 활성화되면,좋겠고 토스 만보 포인트가 너무,적다 .. 라이브도 어이가 없는게 3포인트 적립 예정 아이콘이 뜨더니 그거대로 시간잡고 8초만에 포인트 적립이 종료되어 못받게 하고 보너스를 주지만 1원을 주니 주는것만도 못하다 .. 토스 어플관계자들이 사용자에게 포인트를 안주려는게 많이 보인다.. 포인트 만보는 다른 어플처럼 최소 100원 이어야 하는데 말이다.. 토스가 언제부터 이렇게 구두쇠모드로 온건지 알수가 없다 불편하다 이제 삭제합니다",1,2023년
2023년 10월 24일,청소요정 뭡니까. 지 멋대로 계좌 정리해버렸는데. 이런 기능은 갑자기 실행시킬 게 아니라 따로 항목을 만들어서 정리할 수 있게 하든 되돌리는 버튼을 잘 보이는 곳에 배치하든 해야 하지 않을까요. 어떻게 되돌리는지 모르겠는데 좀 되돌리게 해주세요. 하나하나 다시 표시하기 귀찮습니다. 이거 리뷰 할 시간에 드가서 직접 하는 게 맞을 수도 있지만 이 기능이 존재하는 한 또 벌어질 것 같으니 기존에 짜놓은 거 무너뜨리고서 다시 제가 처음부터 하게 하지 마시고 한 번에 되돌려주세요. 부탁입니다. 편의를 위해 추가한 기능같은데 오히려 불편함이 가중되니 여러모로 개선이 필요해 보입니다.,1,2023년
2023년 10월 15일,다른 혜택은 잘 사용하고 있지만 요즘들어 토스 교통카드가 이상합니다. 갑자기 생기지도 않던 대기가 생기고 250명이라는 대기 인원이 지나가고 제 차례가 와도 오류라면서 충전도 안되고 점검도 너무 장기간해서 이럴빠엔 그냥 티머니 교통카드나 정기권을 사는게 낫겠네요. 토스는 이런현상좀 빠르게 고쳐주세요.,3,2023년
2023년 10월 13일,안녕하세요 어제 게임을 다운 받았는데 생각보다 너무 괜찮고 좋았어요 근데 조금 부족한 부분을 구지 골르자면 제가 아이돌을 잘 모르고 유튜버에 좋아하는 분이 계시는데 보니까 다 아이돌이나 2D 또 스포츠 이 3개 밖에 덕질을 못한다는게 너무 아쉽더라구요.. 그래도 첨 써봐서 그런지 돈 모은거 보는것도 조금 뿌듯하고 꽤 괜찮았어요! 그래도 나중에라도 유튜버 중에서 선택지를 줬으면 하는 마음으로 5점 주고 갑니다,5,2023년
2023년 10월 23일,"이번 만보기 업데이트가 너무 아쉽네요. 도시 외각 지역 사람들을 배려해서 이번 업데이트를 했다는데, 왜 방문 미션 장소를 늘리지 않고 없앴는지는 이해가 안되네요.덕분에 걸으면서 얻는 소소한 재미가 사라졌네요. 그리고 지도기능은 없어지고 받을 수 있는 금액이 줄어들고 랜덤으로 바뀌고 아이템은 얻기도 힘든데 효과도 그닥이라 오히려 손해보는 느낌이라 이번 업데이트 가 사전 공지가 있었지만 사실상 대부분 안보기 때문에 몰랐어서 이번 업데이트를 아쉬워하는 지인이 꽤나 많더라고요. 전 기능을 오랫동안 썼다보니 적응이 안돼서 더 불편해 진거 같네요.",2,2023년
2023년 10월 25일,"토스만보기 바뀌더니 만보 걸어니 포인트 기존 140원에서41원..망함. 말 많으니 2만보에서 만보로 줄였지만 받는 포인트는 50원 수준. 이게 무슨 개선이야...포인트 삭감이지. 토스 친구도 포인트 줄이고, 갈수록 섭섭. 아이템이면 억수로 좋아야 하는데 차리리 포인트가 더 나음. 아이템 싫다. 포인트로 줘 !!! 산삼20개 모아야 하루 거리30%증가. 포인트로 받으면 200원은 나올건데..산삼20개면 10~20원 추가. 토스포인트로 소수점 주식 살 수 있으면 좋겠다. 모니모나 신한알파는 그렇게 하는것 같던데, 최선두주자 토스가 안하니 답답.",1,2023년
2023년 10월 26일,토스 증권 변경후 불편합니다. 새롭게 바뀐 표로 자세히 보기 누르면 핸폰화면안에 현재가 다음으로 등락금액까지만 보여 불편합니다. 등락률이 먼저보이지 않아 화면을 옆으로 옮기면 화면 왼쪽에 주식이름이 아닌 로고가 보여 너무 불편합니다.그전까진 잘 이용했는데 ....,1,2023년
2023년 10월 23일,"토스가 여러가지 혜택도 주고 결국은 예산 소진 되서 이렇게 바뀐거 같은데, 저 같은 미성년자는 계좌로 돈을 채우지도 못해서 편의점에서 직접 채워야하는데 수수료 100원.. 차라리 이런 혜택이나 유지해주시지 왠 이상한 것들만 추가되네요 100원도 처음엔 별거 아니더라도 쓰면 쓸수록 큰 돈 될텐데, 괜히 아깝고 그러네요 토스 이용하던 이유가 무엇보다 수수료가 무료라서 더 애용했는데... 계좌에 남은 돈까지만 쓰고 다른 걸로 갈아탈 것 같습니다",2,2023년
2023년 10월 24일,혜택칸 광고가 너무 커서 아래 화면이 잘려 나옵니다 버그인건지 일부러 혜택 줄이려고 이렇게 한 건지 궁금하네요 토스 카톡이나 상담원에 문의하라는데 이미 시도해봤지만 영문을 모르겠다는 ai식 반응뿐입니다 그 어디에도 문제가 나온 사진을 첨부할 수가 없는데 이 부분은 어떻게 해결을 해야 하나요?,1,2023년
2023년 10월 8일,저만 그런진 잘 모르겠지만 다들 비슷비슷하게 문제가 있으신것 같아서 원래 리부 잘 안다는데 올려봅니다. 전엔 잘만 되던 토스가 어제부터 잘 안되네요. 혜택이랑 홈에 들어가면 하얀 화면만 뜨고 전혀 아무것도 뜨질 않습니다. 그리고 토스 지웠다 깔았는데 로딩 하는데도 하얀 화면이 뜨고 아예 안되네요. 진짜 손절 각,1,2023년
2023년 8월 16일,"이보세요 고객센터 몇번이나 건의하고 글남겼는데 전달하겠단 말뿐... 아직도 고쳐지지도 않고... 1.메인화면에서 잘못해서 인지하지못하고, 뒤로가기 버튼을 누르면 토스앱이 바로 종료되는데요... 잘못눌러도 팜업창으로 정말 종료하시겠습니까? 예, 아니오로 선택해서 종료될수 있게 해주셨으면해요... 화면 인지못하고 잘못눌러 바로 나가버리니 다시 앱켜서 비번 다시쳐야하고 앱이 너무 불편하네요... 2. 토스 알림이 많이 오는데 알림 검색기능이 없어서 알림 하나하나 찾기가 불편하네요...알림을 검색해서 찾을수 있게 알림 검색기능이 추가되었으면 해요",4,2023년
2023년 10월 3일,"일단 토스는 너무나도 좋은 앱 입니다만.. 14세미만 사용자는 일부 서비스를 이용하지 못합니다 계좌연결,만보기 등등... 그리고 추가되면 좋을거 갔은 기능은 PAY같이 카드를 등록하여 핸드폰으로 바코드 인식없이 단말기에 (카드넣는곳)대면 자동으로 결제되는 시스템을 추가해주시면 좋겠습니다 (삼성PAY처럼요) 긴글 읽어 주셔서 감사합니다",5,2023년
2023년 9월 6일,23년 9월부터 휴대폰에 발열 및 렉 발생이 심해짐. 재부팅 헌상도 발생. 발열과 배터리 소모 심해짐.서비스센터 가니 보드 고장 진단 받음. 오늘 디바이스케어에서 비정상적인 오류를 보내는 토스 앱울 초절전상태로 바꾸라는 알림이 옴. 혹시나 해서 바꿨음. 상황이 많이 개선됨. 발열은 없어지고 렉도 많이 줄어듬 하지만 보드에 물리적 손상으로 인해서 간혈적으로 끊김 같은 렉 현상은 상처로 남았고 보드 교체나 새폰으로 교체 밖에 답이 없는 상태. 원인은 토스앱으로 강한 합리적 의심이감. 토스앱을 초절전 상태로 해놓으니 재부팅 렉이 줄고 발열 없어짐. 히지만 그때동안 휴대폰 메인보드에 입힌 타격으로 휴대폰은 예전 같은 성능이 나오질 않음. 체감상 반토막 성능이 되버림. 발열이 생길거 같은 어플은 킬 생각도 못함. 보드 교체비 41만원인데 ...내폰에서는 토스 사용도 못하고 있음. 토스가 열리지않음. 그외 어플은 잘열림. 무슨 어플을 무겁게 만들어어서 메인보드를 태울 정도임?,5,2023년
2023년 9월 5일,"그.. 버벅이고 함께 토스 키고 포인트 받기 중 오류에 여러 오류들 많은 것도 그렇고, 그 라이브쇼핑 포인트 지급 방식 롤백 하면 안 되나요? 알림 떠서 들어가면 3원 포인트 받기 끝났다고 하는데, 이것 때문에 방송 1분전부터 대기 타고는 있는데 이것 때문에 대기 타고 있기는 좀 그런 것 같고.. 또 대기 타고 있었는데 방송이 여러개면 어떤건 받을 수 있고 또 어떤건 못 받는 경우도 있습니다. 다른 몇몇분들도 이 방식에 불만이 있으신 것 같은데 롤백 가능한가요?",3,2023년
2023년 8월 3일,"도대체 라이브방송 알람은 왜 맨날 10분 15분씩 늦게 오는거죠? 가뜩이나 이번에 시간대 별로 알림 묶어서 푸시하도록 바뀌었는데, 알림이 늦게 오니까 들어가고 나면 이미 3원받기는 다 끝나있잖아요. 이럴거면 알림받기를 뭐하러하나요? 그리고 방송시간대 별로 알림을 묶을거면 알림켜기도 시간대 별로 한번에 누를 수 있으면 좋을 거 같습니다. 9시에 방송 10개 하면 알림켜기는 10개를 일일이 다 누르고앉았고, 알림은 한번만 오고.. 그마저도 늦게오고.. 개선해주세요.",1,2023년
2023년 8월 24일,"토스 잘 쓰고 있습니다. 다만 토스 기능 건의사항이 있는데요. 저는 토스의 소비 카테고리 항목을 열심히 관리해서 소비를 조절하곤 합니다. 하지만 따로 더치페이를 한 상태에서 온전히 제가 낸 금액으로 소비액을 편집하고 싶은데, 그러한 기능이 없어서 아쉽습니다. 기존에 '더치페이하기 버튼'이 있긴하지만 사실 이 기능을 통해 더치페이를 한 적은 없고 대부분은 그냥 계좌번호를 통해 알아서 계좌이체를 하는 식이었습니다. 소비금액을 사용자가 별도로 편집할 수 있는 기능이 있으면 좋겠습니다. 직접 금액을 수정하거나, 인원수를 적으면 알아서 1/n 이 되는 기능도 있으면 좋겠습니다.",5,2023년
2023년 9월 22일,"업테이트도 잘 되지 않고, 기본적인 포인트 누적도 잘 작동하지 않고 있어요. 이체시 채우기할 때도 엉터리 금액이 표시되고 있다. 담당자는 무엇하고 있는지 알고 싶다. 더구나 책임자는 모든 기능을 체크할 의무가 있지 않을까요. 정말 실망스럽다. 속히 모든 기능을 점검하여 재기능이 되도록 해주세요!!",1,2023년
2023년 10월 28일,"어제부터 포인트 적립(만보기,행운복권 등등) 관련한 것들 전부 작동이 안돼요 아예 안 들어가져요 혹시 몰라서 앱 삭제 후 다시 재설치를 했는데도 똑같네요.. ->해결되었어요! 감사합니다",4,2023년
2023년 10월 21일,만보기?왜 위치사용해야하는지? 이해안됨 일일히 끕니다 만보기 적립받은뒤에는여 이전버전엔! 걸음수 적립에는 위치 필요없던데 좀 불편해졋어요 차다리 위치사용없이 광고보고 적립은 어떨지 생각좀 해주세요 위치 오래킴 배터리 빨리답니다 안그래도 앱이 많이무거워진거같던데 사실인거 같네요 들어오자마자 상단 광고뜨 면서 속도가 더디는거확인 노력좀 해보소,3,2023년
2023년 10월 12일,"이것 저것 하나 둘 씩 너프 하더니 이젠 하다 하다 만보기 기능, 포인트 마저 너프 되었네, 기존 만보기의 네비 맵 관련한 api 라이센스 부담되고 하루 140포인트 주는 것도 부담스러워 네비 맵기능 삭제하고 포인트 헤택도 대폭 축소한다고 솔직하게 말하지.. 이걸 개선이라고 얘기하냐..ㅎㅎㅎ 웃기지도 않군요. 너프된 토스 만보기로 1만걸음 걸으니 포인트 10,10,10,9로 총39포인트 받음, 경우에 따라서 만보 당 1,1,1,1로 4포인트 받을지도..",1,2023년
2023년 9월 7일,항상 잘 사용하고 있습니다. 제가 얼마전부터 위젯을 사용했는데 잔액확인을 들어가면 아무것도 눌리지 않고 뒤로가기 누르면 흰색페이지만 뜨는 오류가 있더라구요. 위젯 삭제하고 다시 해봐도 똑같습니다. 그러고 한번 더 들어가면 지문인식하고 정상작동을 하는데 오류고쳐주시면 좋겠습니당!,5,2023년
2023년 9월 17일,"솔직히 제가 불편함을 느낀곤 딱히 없었습니다. 근데 왜 별이 4개냐면 제가 중2가 돼면서 다양한 기능들이 열리고 간편 결재란 기능도 최근에 알 게되었습니다. 근데 호환 가능 거래처가 편의점에선 cu밖에 안되더군요. 리브넥스트는 간편결재가 여러 곳(세븐일레븐, gs25, 씨유, 이마트24, 롯데마트, 이마트, 제로페이가맹점)들이 가능한데 비해 편의점에서는 씨유밖에 호환이 안되는 토스를 보고 살짝 불편하다는 느낌이 들었습니다. 그리고 삼성패이나 애플패이처럼 폰을 올리는것 만으로는 아마 안될거 같긴한데 그점도 불편했습니다. 근데 솔직히 nfc결재까지는 바라지않고 편의점중 세븐과 gs는 가능 했으면 좋겠다는 바람이네요.",4,2023년
2023년 9월 24일,"편리하고 이것저것 좋은 기능들 덕에 토스 잘 쓰고 있어요! 근데 포인트 출금하려고 토스뱅크를 클릭해서 계좌번호를 입력했더니 가상계좌로는 본인 계좌가 맞는지 확인 할 수 없다는 문자가 반복해서 뜨는데, 어떻게 해결하는지 몰라 계속 안절부절 중이네요. 클릭란에 토스뱅크가 있고 본인 계좌가 확실한데 왜 안돼는 건지 모르겠어서..ㅋ큐ㅠㅜㅠㅠ",4,2023년
2023년 9월 21일,토스에서 여러가지 혜택을 주어 잘 이용하고 있습니다. 한가지 아쉬운 점이 있어 건의 드립니다. 토스 혜택 중에 라이브쇼핑을 보면 상금이 지급되는데 상금 지급시간이 짧아 조금만 늦게 들어가도 바로 상금지급이 중단됩니다. 라이브쇼핑 알람기능을 설정하면 알람을 보내주는데 정시에 오는 것이 아니라 정시에서 1분이나 2분 후에 알람이 옵니다. 알람을 받고 라이브 쇼핑에 들어가면 이미 상금지급이 종료되는 경우가 많습니다. 많은 분들이 참여하여 준비된 상금이 금방 소진되는 것은 이해하는데 이미 상황이 끝난 후에 알람을 받는 것은 문제가 있어 보입니다. 알람을 1분 전이나 아니면 최소한 정시에는 보내줘야 알람으로서의 의미가 있는 것 같습니다. 이에 대한 개선을 건의 드립니다.,4,2023년
2023년 8월 7일,프라임 가입자인데요. 프라임 사용자는 개인적으로 광고가 없으면 좋겠는데요. 새로운 기능과 혜택으로 최소한 동영상 광고나 팝업을 설정에서 안볼수있는 기능은 없을까요? 가끔은 도움이 될수도 있겠지만 돈내면서 광고까지 보기에는... 화면이 좀 깔끔했으면 좋겠어요,5,2023년
2023년 10월 2일,앱 잘 쓰고 있는데요. 한두 달 전부터 소비 내역에서 '내가 요청한 더치페이'를 길게 누르고 '내역 숨기기' 해도 숨겨지지가 않아요. 다른 소비 내역은 계속 잘 숨겨지는데요. 고쳐지겠거니 했는데 아직도 안 고쳐졌네요. 아울러 앱 내 고객센터에서 이런 간단한 버그 신고에 대한 접근성이 추가되면 좋겠어요.,5,2023년
