날짜,리뷰,별점,month
2023년 9월 15일,초5인데 로그인하려고하는데 너무 복잡해요 가족관계 증명서가 필요하다고 하지를않나 뭐가 뭔지 이해를 못하겠어요 로그인을 편리하게 할수있도록 바꿔주세요..ㅠ😭,1,2023년
2023년 9월 19일,"각 계좌별, 카드별 거래내역 연동이 잘 안되네요....ㅠㅠㅠ",1,2023년
2023년 9월 13일,교통카두 점검을 4일동안 하는게 맞나요? 점검 끝나도 계속 오류나서 매일 지각하네요,1,2023년
2023년 8월 14일,좋은앱이에요!!근데 방금 에이블리에서 뭘 샀는데 포인트가 안들어오네요ㅠ,4,2023년
2023년 8월 4일,이거 연락처 쪽이 렉이 걸렸는지 다사라져버렸는데 원래 이런거라고 하기엔 초반에는 이러지 않았거든요 그리고 연락처 이름을 써봐도 안뜨더군요 이러면 송금이 굉장히 불편한데 말이죠,3,2023년
2023년 7월 31일,교통카드 결제도 후불결제처럼 미리 낼수 있는 기능이 있으면 좋겠습니다,5,2023년
2023년 7월 19일,라이브 알림도 인오고 뜨지도 않아요 할때마다 재부팅하거나 업뎃해도 동일해서 짜증나네요 ㅠㅠ,1,2023년
2023년 10월 22일,배가불렀군요ㅎ 업뎃될때마다 슬슬망할조짐이ㅋㅋ,1,2023년
2023년 8월 24일,광고 생긴 후로 램 무지막지하게 퍼먹음 게임도 아닌데 램을 뭐이리 먹는지,1,2023년
2023년 7월 4일,앱안에 퀴즈 정답 똑바로좀합시다 몇푼안되지만 맞춰보겠다고 입력했는데 오답? 힌트에 있는거 보고 썼는데 오답이라고? 그딴 이벤트 그냥 버려 애초에 아닌거면 하질말자는 뜻이다 이렇게 불만을 들을빠에야,1,2023년
2023년 8월 23일,"사용하다가 토스앱을 삭제했는데 스마트폰을 열거나 사용중에 수시로, 심지어 전화 통화 중에도 플레이스토어가 열리며 토스앱을 재설치하라고 함. 지긋지긋하네요. 왜 이렇게 만들었을까요? 악성코드처럼 만들었군요.",1,2023년
2023년 8월 25일,저장공간도 괜찮고 와이파이도 괜찮은데 업데이트가 안 됨. 2번 이상 시도 해 뵈도 안 됨. 고쳐주시길 바랍니다. 캐시 삭제도 해 보고 리뷰를 단 거였습니다. 지금은 해결 됬습니다.,3,2023년
2023년 7월 23일,잘쓰고 있었는ㄴ데 몇일전부터 로딩이 안되더니 지금은 지웠다 깔아도 앱이 안들어가집니다..,2,2023년
2023년 7월 29일,아니 최근업데이트되고 주식이랑왜이렇게 로딩이 길어졌어요? 아예로딩이안되네 하..뭘건드린거야 주말에,1,2023년
2023년 5월 24일,토스 주식앱도 다른 주식앱들처럼 차트보면서 도히에 매도 매수 할수있으면 좋겠습니다... 상당히 불편,3,2023년
2023년 7월 23일,업뎃 내용에 최적화니 성능개선이니 적혀있길래 오랜만에 업데이트 했더니 역시나 광고만 늘어남 ㅋㅋ,1,2023년
2023년 10월 22일,토스 점점 실망스럽습니다 전설의 산삼 만나기도 힘들고 포인트 받는 재미로 만보달성을 하는데 타어플보다 포인트혜택이 점점 줄어드네요 그냥 10원 포인트를 주시지 전설의 산삼을 왜 주시나요? 20개씩이나 모아야하고 그냥 당일만 적용되는것을 왜하시는지 의문이고 실망스럽네요,1,2023년
2023년 5월 14일,좋은 앱인데 업데이트 하실때 쓸모없는건 빼고 업데이트 하세요 저장공간이 아프다네여.,3,2023년
2023년 10월 27일,홈화면 ui 다시 돌려줘요 요정 얘 뭔데요 더 보기 힘들어짐,2,2023년
2023년 10월 9일,잘 쓰고 있긴 한데 버스카드 충전이 잘 안되고 와이파이가 없으면 충전이 안됩니다 이거 진짜 너무 불편하고 집 와파는 충전이 잘되는데 버스나 카페 이런곳에 와이파이가 있어도 몇십분은 기다려야 충전이 됩니다 제발 좀 고쳐주세요,3,2023년
2023년 6월 11일,토스증권 부분에서 1일 1주 3달 1년 5년으로 표기가 되어있는 것을 1년과 5년 사이의 차트가 조금 애매하게 나와 있어서 중간에 3년을 같이 표기 하는 것은 어떨지 문의 드려 봅니다. 잘 쓰고 있습니다. ^-^;;,4,2023년
2023년 7월 23일,"포인트 모으려고 터치 하기만하면 튕겨지고, 앱이 닫겨버리면서 계속 비번 넣고 무한반복",2,2023년
2023년 9월 19일,업뎃도 안되는데 팝업만 계속 뜨는구나,1,2023년
2023년 9월 15일,좋은데...너무 버벅거립니다 버퍼링이 이렇게 심해서야 점점 왜 이러는거에요 쓰기는 편한데 토스증권 버퍼링좀 살려주세요,5,2023년
2023년 6월 28일,오늘 17시 전후로 토스증권 호가창 UI바꾼거 누구아이디어입니까? 2계급 특진시켜주십쇼!! 미쳐따 제일 자주보는 화면 둘을 합쳐주니 너무 편하잖아! 아쥬 칭찬해 아쥬,5,2023년
2023년 7월 10일,안녕하세요. 토스를 사용하고있는 한 유저입니다. 그런데 제가 다른 기기에 토스를 깔아 연동하려고 하니 안돼더라고요. 곧 스마트폰을 바꿀건데 토스 가상계좌에 있는 돈은 어떡하죠? ㅜ.ㅜ 로그인은 못하나요?,5,2023년
2023년 7월 24일,안녕하세요! 제가 한국포스증권을 일요일날에 가입을 했는데 자산 추가하려 등록하려고 하는데 한국포스증권 회원이 아니라고 뜨더라구요! 신속하게 부탁드립니다!,1,2023년
2023년 6월 4일,만성 적자인건 알고 있었지만 그렇다고 영상광고는 최악이네요. 토스 대체제 찾아 떠날 때가 된 듯,1,2023년
2023년 8월 4일,라이브있어서 그나마 토스에서 돈 모아지는건데 슬슬 오케이 캐시백의 길을 따라가시는것 같네요?? 됐어요 안합니다 그동안 감사했습니다,1,2023년
2023년 7월 5일,다 너무 편하고 좋은데 근처 사용 알림떠서 들어갔더니 가끔 안들어가져서 좀 아쉬워요 그것만 해결하면 다 좋아요,4,2023년
2023년 5월 26일,토스포인트 출금할때 왜 인증서가 필요한지 모르겠네요.포인트 출금시 인증서없이 출금가능했으면 합니다.,1,2023년
2023년 5월 22일,사실 칭구소개로 알게되었는데요.4번정도 토스가 편하다는애기듣고 이용하게 되었네요 ㅡ굿입니다!!!,5,2023년
2023년 6월 2일,동영상 광고 기준이 뭐죠. 최신버전인데 한쪽은 있고 한쪽은 없고...ㅡㅡ,2,2023년
2023년 7월 14일,"지난 달에 토스 우주 하면서 다양한 캐릭터 갖고 싶어서 (곰돌이 캐치나 똘똘이 캐치, 마녀 캐치.. 등등) 토스 캐릭터 뽑기 시작했는데 ㅠㅠㅠ 기본으로 주는 캐릭터는 랜덤으로는 안나오네요 ㅠㅠㅠ 추가로 풀어주거나 45개 모은 사람용으로 스페셜 캐릭터 뽑기 있으면 좋을것 같아요 ㅜㅜ",4,2023년
2023년 7월 9일,도대체 나이스 점검은 언제까지 하는겁니까? 지금 몇주가 지났는데도 계속 하고있어서 급식을 못보네요... 이럴거면 아예 기능을 없애고 말지 뭐하러 있습니까,3,2023년
2023년 8월 2일,토스오류 너무많이 남 ㅡㅡ 주식시작 이앱으로시작한거 너무후회,1,2023년
2023년 6월 28일,12세 사용자 입니다. 카드를 재 발급 하고 나니 갑작이 교통카드 충천이 앱 에서 안 되기 시작했습니다. 분명 처음에 발급된 카드는 앱 으로 교통카드 충천이 가능했는데 왜 그런 건가요?,3,2023년
2023년 7월 25일,2~3일 전부터 토스 앱에서 혜택 버튼을 누르면 글씨가 쪼매내지는데 어떻게 고치나요 다른 칸은 안그러는데..,5,2023년
2023년 9월 7일,토스가 갑자기 로그인하라고하고 갑자기안되니불편하네요 짜증나서 못하겟네요,1,2023년
2023년 5월 6일,도움을 주시라고 별점 낮게 표현했어요. 앱을 누르면 튕겨서 접속 불가입니다. 혹시나 버전을 살펴도 최신인데 방법은요? 알려주세요,2,2023년
2023년 8월 27일,업데이트 절대 하지 마세요 포인트 2배 3배 주던 것이 사라집니다,1,2023년
2023년 6월 28일,금융 어플에서 광고영상이 강제로 재생되는게 상당히 불쾌하네요.. 업데이트 이전 버전으로 돌리는거 불가능할까요?,1,2023년
2023년 9월 19일,주식창이 엉망이에요. 늦는건 고사하고 챠트도 안뜨고.. 믿다가 눈뜨고 코베이겠네,3,2023년
2023년 7월 25일,혜택 메뉴들어가는거 까지는 되는데 그다음 뭘클릭해도 화면이 안나와요 왜이런거죠 업데이트도 했는데,3,2023년
2023년 8월 21일,수시로 업데이트로 오류도 더 늘어남ㅡㅡ^ 킹왕짱받음ㅡㅡㅡㅡ^,1,2023년
2023년 9월 2일,주민등록 번호로 보호자 인증을 하는게 이해가 안됍니다. 아무리 많은 사람이 이용해도 뒷자리를 쓰라는건 좀 아니지 않나요??,1,2023년
2023년 10월 21일,좋긴한데 처음에 비밀번호를 치고있을때 비밀번호가 안보임,4,2023년
2023년 8월 21일,- 평가 (0.3점) 최악의 경험. 로그인 조차 제대로 되지 않음. ( 10번 켜면 한번 로그인 될까말까임. ) 지금껏 써온 금용앱중 가장 사용중 앱 종료현상이 자주 일어남. - 사용환경 기종 : S21 버전 : Android 13 ( One UI 5 사용중 ),1,2023년
2023년 8월 19일,버그가 너무많음. 토스가 응답하지 않음 이라고 나옴,1,2023년
2023년 6월 3일,"업데이트하고, 행운복권의 3가지 중 한가지 고르는 거에서 터치가 안되요",2,2023년
2023년 10월 17일,점점 포인트 받는게 너무 많이 줄여들어 실망스럽습니다.. 광고보기도 여러개 있을경우 금방 끝나버리고.. 열심히 걸어서 만보 걷기도. 지정장소에서 받는것도 없애고..친구만나 포인트 받는것도 줄고.. 앞으로 더 안좋아 질꺼 같아요..,1,2023년
2023년 7월 20일,업데이트하고 농협은 연동도 잘 안되네 ㅋㅋㅋ 느리기만하면 그러려니하겠는데 해지표시가 뜨네ㅋㅋㅋㅋㅋㅋㅋ,1,2023년
2023년 9월 19일,속도가 다른 금융앱에 비해 빠른것 같네요,4,2023년
2023년 9월 28일,"아니 왜 토스 통장이 있는데 이번 추석 복주머니때 받은 2800원, 저는 통장을 개설할수 없다하고 돈도 안들어오죠? (수정 : 아니 그러면 어차피 제 통장이 안될 걸 아시면서도 그냥 계속 진행하다가 돈을 통장에 넣을때서야 못만든다고 하는거잖아요.. 그럴꺼면 그냥 애초에 나이제한 되는 분들은 참여를 못하게 막으셨어야지요..)",1,2023년
2023년 8월 23일,라방 무슨 시작하고 2분만에 끝이네요ㅋㅋㅋㅋㅋ이럴거면 서비스 왜 하는지,1,2023년
2023년 10월 25일,"토스 어플 설치하자마자 국제발신으로 카드발급됐다고 스팸문자오는데 여태껏 이런 연락 받은적 한번도 없는데 가입하자마자 개인정보가 유출된건가요 모든카드사, 은행등 신용을 관리하는 어플인데 신뢰도가 확떨어지네요",1,2023년
2021년 10월 8일,예전부터 잘쓰던 어플인데 이번에 업데이트 하면서 소비부분이 아예 사라지고 계좌 아래부분에 생겼더라구요 그러면서 수입이랑 소비를 따로따로 봐야하는데 그게 불편하더라구요.. 미성년자는 주식이나 해택 카테고리를 잘 사용하지 않아서... 송금은 다른어플에서도 할수 있지만 소비내역 보는게 편해서 토스 자주 이용했는데 그게 사라져서 아쉽네요ㅜ,5,2021년
2021년 10월 31일,아무 생각없이 만보기 실행했다 기절초풍 하는 줄... Data 빨아 처드시는 쓰레기어플 필요햔 곳에 쓰지도 못하고 Data 충전하느라 돈만 날리게 하는 최악의 만보기!!! Data제한 있는분들은 절대사용금지!!! 토스는 전반적으로 쓸데없는 Data를 과도하게 사용하는 어플임 설치삭제하고 기존 사용했던 은행어플로 다시 복귀합니다,1,2021년
2022년 12월 25일,고정지출칸에 정기결제가 아닌걸 삭제하면 정기결제가 맞는거랑 같이 2개가 동시에 지워져서.. 다시 추가하면 똑같이 2개가 같이 생기네요.. 너무 스트레스 받습니다..ㅠㅠ.. 어떻게든 가릴려고 하면 다른 내역이 또 올라와서 삭제하면 또 2개가 같이 사라집니다..,4,2022년
2019년 4월 25일,"몇주전쯤부터 데이터 사용량이 터무니없이 많아졌습니다. 예전에 도돌키보드도 이런적이 있었는데, 토스가 수백메가씩 데이터를 사용했다고 나옵니다. 빠른 조치가 필요해 보입니다.",2,2019년
2021년 9월 9일,처음 사용해보는 뱅킹 앱입니다. 다른앱도 깔아서 들어갔는데 다른 앱은 처음 들어가면 뭐가 너무 많았는데 토스앱은 딱심플해서 필요한것만 볼수있고 중요알림같은것도 줘서 헷갈리지 않고 편하게 쓸수있네요. 딴앱깔자마자 지웠는데 토스는 편하게 사용하고있어요.,5,2021년
2023년 1월 22일,안녕하세요 토스 엄청 잘 쓰고 있습니다 토스뱅크도 사용 중이고요 근데 한 번도 그런적이 없는데 토스를 들어가면 강제로 바로바로 꺼져요 제가 지금 어플 이용을 못하고 있는 중입니다 어떻게 해야하나요? 휴대폰 문제는 아닌 것 같아요 저장 공간 여유있고 기종이 오래된 것도 아닙니다,5,2023년
2023년 5월 5일,모의주식을 실행시 로드가 지연되고 문자랑 화면이 계속 깨지네요,1,2023년
2023년 6월 28일,좋았는데 갑자기 카드를 새로 발급 받고 나서부터 교통카드가 이용이 안됩니다 전에 있던 카드에는 됬었는데 왜그런지 알려주실수있나요,3,2023년
2023년 7월 1일,편하고 너무 좋은데 지금 메인화면에 통장 잔액이 바로바로 안뜨는게 너무 불편해요 설정 방법없을까요?,4,2023년
2023년 4월 4일,"아이폰과 갤럭시 둘다 갖고있고 토스도 아주 잘쓰고 있는 유저인데요 갤럭시 버전 만보기도 아이폰용 토스처럼 만들수는 없나요? 상단 노티에 토스 아이콘 떠있는게 여간 거슬릴수가 없네요 아이폰은 만보기 켜도 아이콘이 강제적으로 떠있다거나 그러지않고 만보기 기능을 쓸수있는데 갤럭시는 상단 노티에 무조건 띄워놔야 만보기를 쓸수있는게 너무 거슬립니다 요점은 ""거슬리면 만보기 알림을 꺼라"" 가 답이 아니라 안드로이드 버전도 상단에 토스 아이콘을 강제적으로 안 박고도 만보기 측정 할수있게 개선이 필요하다는 겁니다 긴글 읽어주셔서 고맙습니다",5,2023년
2019년 12월 15일,잘 사용하고 있습니다. 다만 불평한 점이 있는데 토스 저축계좌에 적극적으로 모으기 적당히 모으기 조금 모으기인가 있는데 정확한 액수로 저축하는 방식을 쓰고 싶습니다.,5,2019년
2022년 5월 7일,주식앱으로 쓰기엔 UI가 상당히 불편하네요. 내가 거래중인 주식상황이나 예약중인 주식 받을돈 이런거 찾아가기가 아주 헷갈리고 어렵게 되어있습니다. 메뉴를 좀 찾아보기쉽고 체계적으로 만들어 줘요.,3,2022년
2019년 6월 6일,토스 실행할때마다 [서버 응답을 받지 못했습니다 네트워크 상황을 확인해주세요. 문제가 지속되면 잠시후 시도해주세요.]뜨면서 계속 꺼지는데 삭제후 재설치해도 그렇고 데이터 와이파이 다 켜도 이럽니다.. 폰 기종은 V40 이에요,3,2019년
2023년 9월 6일,토스 피드보고 포인트받기 관련 건의 하나 합니다. 전국적으로 말고 gps기반으로 특정지역에서만 피드 보게 할 수 있으면 좋겠습니다 가게 광고 같은거 올리기 좋을 듯 싶어요. 전국적으로 광고하기는 좀 그러하니.,3,2023년
2023년 6월 30일,아니 지금 버스가 급한데 교통카드 충전을 눌렀는데 계속 검은화면만 뜨잖아요 진짜 도랏어여?진짜 중요한건데 고소합니다ㅎ,1,2023년
2022년 3월 14일,토스 정말 잘 쓰고 있습니다 특히 다른 은행 앱에서는 어려운 부분을 쓰기 쉽게 잘 만든 것 같아요 다만 한가지 건의드릴 사항이 있습니다 토스뱅크 모으기에서 모으기들을 꾹 누르고 드래그를 하면 순서가 바뀌는기능이나 순서 편집이 되면 좋겠습니다 감사합니다,5,2022년
2023년 6월 23일,토스 잘 이용하고있는데 업데이트 하고나서는 계정이 없어진거 같이 계좌번호도 없어지고 이제는 성인만 쓸수있게 한건지 좀 알려주세요...,2,2023년
2020년 1월 1일,"1. 앱 위변조 위험성 감지 가 뭔가요. 12.31일엔 없었는데 1.1일에 사용하는데 ""앱 위변조 위험성 감지""라고 나오면서 앱이 닫혀요??? 2. (루.커.블 그런게 뭔지 몰라요! 토스 팀과 카톡으로 친절히 안내 받았네요. 좀전에 재 설치하니 되네요.) 휴일에도 쉬지 않고 노고가 많으시네요.)",1,2020년
2020년 8월 29일,"급하게 송금할일이 발생해 설치해 사용했는데 너무 좋았읍나다. 그런데 사용도중에 해킹에 문제가 발생되지 않을까 걱정이 되어서요, 그리고 거래은행에서 문지가 왔는데 신청가관에서 주기적 또는 일회성으로 출금을 할수 있다는 문자 메세지가 왔읍니다. 무슨뜻인지 이해가 안되서요. 좋은 답변 기다리겠읍니다",4,2020년
2022년 1월 3일,초창기부터 너무 유용하게 잘사용하고 있습니다. 제 모든 자산을 한눈에 관리할수 있어 너무좋았습니다. 그전에 아쉬웠던건 사업자카드가 등록이 안되서 지출정리할때 아쉬웠는데 업데이트 이후로 사업자 통장까지 등록이 안되네요. 한번에 관리할수있어 좋았는데 지금은 사업자 통장 카드 따로 관리해야 되서 좀 아쉽습니다,5,2022년
2023년 7월 11일,사용을 잘 하고 있었는데 좀 안 하다가 비밀번호를 까먹었는데 그래서 계정이 잠겼어요 근데 신용계좌? 같은거나 또는 신분증이 있었야한다는데 저는 신용계좌도 없고 신분증도 없었어 문의를 할려고 하는데 그런것도 없네요 이글 보신다면 좀 도와주세요,3,2023년
2021년 5월 15일,주식거래가 급할때 접속시 토스홈(로딩)에서 주식 클릭하고(로딩) ..하 안그래도 느리고 불편했는데 잠금화면까지 생겼네요.... 첫 접속화면을 토스계좌 메인이거나 주식으로만 설정할수 있게해주세요 아님 토스주식 앱을 따로 ㅠㅠ 업댓이 너무 잦아 느려서 손해보는일이 많아요 느리다고 고객센터 문의하니 업뎃을 안해서라는데 그렇다고 업뎃을 매번 한다고 버벅거림이 없는것도 아니규요 급할땐 환장합니다 초보에게 유용하고 접근성이 쉬운점은 있으나 초보주린이가 계속 어린이도 아니고요 고수멤버 유도를 위해서라도 앱의 편리성이 극대화 될 필요는 있어보입니다 매수매도 간단 주문이라던가(상한가까지 틱 거래) 시세차트를 유저가 봉이나 지금처럼 선으로 조정할수 있는정도의 여유는 주시면 감사하겠습니다 토스로 시작한 사람은 봉차트 볼줄도 모르면 안되잖아요 ㅜㅠ,3,2021년
2023년 10월 22일,포인트 주는것도 점점 줄이드만 이젠 밧데리도 순삭이네,2,2023년
2018년 11월 7일,"토스는 과거에 상대방에게 송금하면 계좌만 입력하여서 수령받는 방법이어서 간편하다는 기억을 가지고 있었습니다. 그런데 최근에 송금받으려하니 앱설치, 인증, 계좌등록, 각종 개인정보 접근허용등 번거롭게 만드네요. 거기까지는 이해하는데 상대방이 내 계좌에 토스통해서 보냈는데 당신들이 뭔데 토스 가상계좌로 이체시켜 놓나요? 그걸 또 내 계좌로 옮겨야하고 진짜 짜증나고 불쾌합니다. 받자마자 삭제입니다.",1,2018년
2023년 10월 13일,"만보기가 바뀌었는데, 혜택이 너무 줄고 재미도 없고 뭔가 속는 기분이라 회사가 너무 기만적이라는 생각이 들어요. 설명대로라면 산간지역에 혜택을 추가하면 되지, 왜 전부에게서 혜택과 재미를 줄이나요? 이젠 그만 퍼주기(언제퍼주긴했나요?ㅠ)를 줄이고 챙길 때라고 판단했다는 걸로밖에 안보여요. 앱 직관성도 많이 부족하고, 광고만 많아요ㅠㅠ 24시간문의라고해놓고 챗봇대화밖에 안되는데다 직접질문을 적을수도 없고, 몇개의 충분하지않은 대답만 제시햬 희롱당하는 기분은 덤. 토스. 정말 왜이러나요ㅠㅠ",1,2023년
2021년 11월 30일,"해외주식때문에 토스증권으로 계좌 개설했음 하지만? TQQQ, QLD, XLY등 여러 미국etf를 거래할 수가 없음 종목검색자체가 안됨. 주식을 못산다니 이만한 단점이 있을까? 여러 리포트나 정보를 쉽게 볼 수 있는 건 장점이나 당연히 될 거라 생각한 게 안되서 단점이 모든 장점을 씹어먹음. 환전 수수료만 날림. 종목검색이 안되는 건 지 아직 거래안되는 건 지 몰라도 빠른 해결이 필요할듯함",2,2021년
2021년 11월 23일,처음엔 혁신적이고 심플해서좋았는데.. 결국 다른앱들처럼 쓰잘데기없는 기능넣어서 점점 번잡해지고 무거워지고.. 주식에 뉴스나 커뮤니티 같은건 사용자가 숨길수있게 커스텀마이징 기능을 넣어줬으면.. 로딩시에 저런것들때문에 느려지고 주식하다가 피치못하게 꼴불견스러운 의견들을 보게되면 저도모르게 눈살이찌푸려지네요.. 필요도없는데 왜 그런걸 한페이지에넣어서 불필요한로딩 + 되도않는 뇌피셜 갖다붙이면서 잼민이들 수익자랑하는걸 봐야하는건지 ㅠㅠ,1,2021년
2022년 6월 28일,추세선 긋기 기능을 추가해주실수있나요? 증권사 mts기능이 80%이상은 있어야한다고 생각합니다 미국주식은 이름이 달라서 검색이 안되서 고생하는경우도 많습니다 주식 차트가 불편해서 다른앱을 들락달락 하면서 매매하는데요 토스 하나로 다 끝낼수있게 부지런히 업그레이드해주시면 좋겠습니다,4,2022년
2021년 5월 9일,"사실 별한개 주는것도 너무 아깝네요. 유튜브에서 숨은 보험금 찾기 광고보고, 앱을 다운받아서 실행해 봤습니다. 개인정보 실컷 입력시키고...숨은 보험금을 찾았다길래..잔뜩 기대하고 기다렸는데...'현재 서비스이용이 불가합니다. 잠시후 다시 이용해주세요'라는 메세지만 반복적으로 뜨네요. 오기가 생겨서 아침부터 몇번을 시도해 봤는지 모르겠습니다. 이거 거의 허위광고 수준 아닌가요?",1,2021년
2023년 6월 29일,다른 뱅킹앱들에 비해 앱 자체 용량이 너무 커요. 개선되면 좋겠네요.,3,2023년
2023년 9월 17일,"지속되는 토스 교통카드 충전기능 점검 때문에 먼 길을 걸어다녀야 하는 일도 생기고 요즘 정말 별로라서 토스 교통카드는 하차하고 다른 교통카드로 따로 사야할 지경이구요 계속 시스템들이 하나씩 맛이 가서 일을 하는 건지 안 하는 건지 모르겠네요 ㅋㅋㅋ 진짜 그리고 계속 어딘가 광고를 붙이시고 수수료를 붙이시는데 애초에 토스를 광고할 때 ""수수료 0원"" 이걸 내세운 게 아니였나요? 저도 이번에 현금으로 충전할 때 봐야하겠지만 버스카드 충전할 때마저 수수료가 든다는 사람이 있으니 말 다 했네요 ㅋㅋㅋ",1,2023년
2023년 8월 15일,"송금자명이 어떻게 하면 뜨게 하는 건지 모르겠어요 예를 들어서 네이버 인증을 하려고 1원 입금 후 송금자명을 입력하라고 하는데, 토스 송금내역이 팝업으로 뜨지도 않고 앱 들어가서 봐도 송금자 네이버**** 이렇게 떠요..^^ 저 **** 부분이 안보여요. 송금자명을 어떻게 다 보게 설정할 수 있나요? 예전에는 바로 보이고 팝업으로 송금 알림도 왔는데 왜 안 오는 지 모르겠어요.",3,2023년
2022년 6월 29일,"최근 총자산 분석 보여주는 화면이 개선되어 지난달과 비교가 가능해졌네요. 일전에 의견보내기를 통해 유사한 제안 드린 바 있는데, 물론 제 의견만을 보고 반영한 건 아니겠지만 이렇게 개선돼가는 모습이 보기 좋습니다. 앞으로도 원활한 소통으로 점점 발전하는 앱이 됐으면 합니다.",4,2022년
2023년 6월 2일,솔직한 평가로는 은행 전부를 하나로 묶어놔서 보기도 좋고 이쪽 저쪽 클릭만하면 바로 되니 편함,5,2023년
2022년 4월 8일,저금(모으기) 기능 매우 잘 사용하고 있습니다! 종종 용도에 따라 추가/삭제하곤 합니다. 그런데 순서변경 기능에 추가되면 보다 편히 정리할 수 있을 것 같아요! 다음 업데이트에서 기대해봐도 될까요~? 감사합니다!,5,2022년
