날짜,리뷰,별점,month
2022년 1월 5일,왜 내역확인이 안되죠? 업데이트 후 토스 인증서까지 다 발행받았는데 은행 클릭해 들어가면 어떤 계좌를 연결할까 물어보고 다시 은행 클릭하면 이미ㅜ모든 계좌가 연결돼있다고 뜨고. 모든 은행의 입출금 내역을 편하게 보고싶은건데 그게 안되니 토스를 쓰는 이유가 없네요,1,2022년
2023년 8월 23일,토스를 사용하면서 불편한점은 없지만 연락처로 보네면 돈이 안들어옵니다 6천원도 안들어와서 어의가없네요,1,2023년
2019년 9월 8일,"타 어플과 비교시 일단 내 계좌가 여러개 쭈르륵 뜨는게 매우 간편(이게 가장 큰 장점), 보내는 사람 계좌도 쉽게 찾을 수 있어 간편 다만 수수료가 500원씩 붙지만 10번 이후부터니 지능적으로만 쓰면 좋음",4,2019년
2023년 1월 21일,복잡하기만 하고 뭐 하나 직관적이지가 않아서 메뉴찾기가 매우 불편하다. 메뉴검색이라든가 뭐가 있어야지..,2,2023년
2018년 11월 12일,해외거주자는 앱을 사용할 수 없군요. 무조건 통화를 해야 인증이 가능하니...출국여부 체크하고 신용카드번호와 비밀번호 등으로 인증가능하면 좋을텐데 한국에 무조건 들어가야 사용가능하군요. 아쉽네요ㅠㅜ,3,2018년
2020년 4월 25일,친구와 함께 만보기를 쌓을려하는데 안되서 찾아보니 안드로이드 9 버전 이상이면 된다고 해서 확인해보니 안드로이드 9버전 이상이어서 권한에 문제가 있는지 확인해보니 모든 권한을 부여하였는데도 불구하고 만보기가 실행되지 않습니다. 갤럭시 A40 (2017년형) 입니다. 확인해주세요ㅠ,5,2020년
2023년 6월 9일,갑자기 광고 뜨는거 진짜 귀찬네 데이타도 문제지만 귀찮고 걸리적거린다구요,2,2023년
2019년 11월 29일,카드연결을 새로다시해도 최근애 발급받은 카드(토스국민카드)는 연결이 계속안되고 기존에 쓰던 국민카드와 체크카드만되는데 뭐가문제인지모르겠네요..최신버전으로 업뎃해도 개선이안되네여..그외에는 참 유용하게 쓰이는데말이죠,3,2019년
2020년 5월 20일,참 편하게 이용하던 앱이고 토스카드까지 발급받아서 잘 이용했는데 최근 앱 자체가 너무 느려진것같습니다. 잔액 조회나 입출금내역 조회하는데 옛날에는 5초가 채 걸리지 않았다면 요즘은 3분 가까이 소요되는 점이 굉장히 아쉽습니다 ㅠㅠ,3,2020년
2023년 9월 1일,몇년 전 재미 있게 했었는데 다시 시작 해 보려구요.,5,2023년
2020년 5월 22일,계좌 연결도 안되고 연결해도 계속 잔액이 조회도 안되고 잔액 업로드도 안되고 정말 못 사용하겠네요... 이런 리뷰는 처음인데 정말 사용하지 싫습니다... 답답하네요 인증하느라 1시간 이상 걸렸는데 마지막에 인증도 안되고 미치겠습니다.,1,2020년
2023년 10월 26일,만보기에 아이템 기능을 왜넣는건가요? 광고에 포인트 수수료에.. 은행앱이 맞긴 맞는건가요? 왜 기존 은행 써야되는건지.. 이제 명확해질려고 하네요.,1,2023년
2023년 5월 8일,다른건 너무 좋고 공짜로 이체하는게 많이 없어서 아쉬워요.. 핸드폰이 오래되서 그런지는 잘 모르겠는데 본인인증 하고 다음 화면이 안떠요ㅠ 해결 방안좀 알려주세요. 앱을 지우고 다시 깔아도 안되요ㅠ,5,2023년
2023년 6월 20일,시작할수도 없고 부모님에게 인증을 해도 끝에 류 유 성으로 시작하는경우 별도.. 이렇게 적혀있는 것을 보고 확인했는데도 가입이 되지 않습니다 벌써 31분째동안 하고있는데 고객센터를 들어갈수도 없어서 기분도 안좋고 시간만 날렸네요 왜 인증을 다 했는데도 안되는건가요??,1,2023년
2023년 9월 15일,갑자기 잘 쓰다가 지문인식이 안먹혀서 튕겼는데 이거부터가 문제지만 더 혼란스러운건 로그인이 안돼는게 정말 별로입니다. 정보를 맞게 썼는데 안돼서 하루를 기다리고 곰곰히 생각하고 써봐도 안돼네요 그 계정안에 돈이 들어있는데 뭐 꺼내지도못하고 해결 방법도 없어서 더 혼란스럽네요. 이건 정말 고쳐줬으면 합니다.,2,2023년
2019년 9월 16일,이때껏 잘 쓰다가 갑자기 본인확인을 해야한다기에 입력되있지 않은 정보를 입력하려 들어갔습니다. 주소입력이 되어있지않아 주소를 검색했는데 나오지 않고 1대1 문의로 톡은 연결조차 안되고 전화역시 삐삐 거리더니 끊기기 일수입니다. 지금 돈을 옮겨야하는데 돈 묶이고 어떻게 할 수가 없습니다. 이런식으로 하면 곤란합니다. 빨리 해결해주세요.,1,2019년
2020년 11월 8일,계좌연결 할 때 은행 홈페이지 비밀번호를 제대로 입력했는데도 다음 단계로 넘어가지 않고 계속 그 단계에 머물러 있습니다. 그래서 비밀번호를 변경하면 비밀번호 재설정이 필요하다고 뜹니다.뭐가 문제인 지 아시나요? 카드연결을 할 때도 가입단계에서 1시간을 기다려도 계속 로딩중입니다.,2,2020년
2023년 2월 24일,"상단바에 뜨는 총 받은 포인트 말이에요, 이미 만보기도 상단바에 띄워야해서 불편한데 두줄이나 토스가 뜨니 불편합니다. 그냥 원래대로 상시알림으로 주변에 토스이용자가 있을때 띄워주고 알람을 지울 수 있었으면 좋겠습니다.",4,2023년
2019년 12월 15일,원래 토스 잘 쓰고있다가 휴대폰 바꾸고 새로 깔았더니 계좌 연동할때 왠 아이디와 비밀번호를 입력하라고 뜸... 기존에 사용할때는 통장이랑 쉽게 연동되었으나 다시 하려고 하니 은행사 웹 회원가입하라그러고... 많이 실망스러움... 간편해서 좋았는데 절대 간편하지 않음...,1,2019년
2022년 1월 16일,도대체 왜 계좌를 계속 연결하라고 뜨는거에요??? 이건 무슨 인내심테스트 업데이트도 아니고ㅜ자꾸 연결이 끊기는건가요? 아니면 하루에 한번씩 연결해서 쓰게끔 바꾼건가요? 정상적인 업데이트 맞나요?,1,2022년
2019년 11월 28일,중국에서 유학 중 사용하는데 들어가면 계속 비활성화....정작 중요한 이체를 못하는 상황까지...중국에서는 언제 정상적으로 사용될까요...아이폰쓰는 친구들은 토스 비활성화가 안되는데 갤럭시쓰는 저는 유독 비활성화가 많이 되네요ㅠ,2,2019년
2023년 6월 22일,"모으기에 별명을 좀 길게적을수 있게 수정해주는게 좀 어려운일인가요?ㅜㅜ 모으기 기능으로 통장쪼개기 대신사용중인데, 10글자 별명은 너무적습니다ㅜㅜ 좀길게 적을수있게 고려부탁드립니다",3,2023년
2022년 9월 7일,홈 화면에서는 통장이나 증권에 접속하기 위해서 보안 인증이 필요하듯 주식탭에 접속할 때도 보안인증을 할 수 있는 설정이 있으면 좋겠습니다 그리고 주식거래를 하기 위해서 보안 인증을 해제하거나 매번 인증을 하도록 되어있는데 처음 1회만 인증을 하는 설정도 있었으면 좋겠습니다,4,2022년
2022년 4월 21일,토스 잘 사용 하고 있었는데 어제부터 혜택 기능에 포인트 받기가 안되고 계속 화면이 뱅글뱅글도는것만 나오고 진행이 안되네요. 왜 그런거죠? 포인트를 못받고 있는데 오류인가요? 언제 개선되나요?,1,2022년
2020년 1월 29일,만보 달성 금액이 점점 줄어드네요...기존 사용하던 만보 어플보다 혜택이 좋아서 사용했는데 이용자수가 많아져서 그런거겠죠... 같이 걷기 미션할 사람이 없어서 기존걸로 다시 사용해야할듯해요 아쉽네요~,1,2020년
2022년 1월 11일,토스만보기 오류로 리뷰 썼었는데요 대충 원인은 알 것 같아요 폰을 껐다 켜면 그런 것 같아요 근데 폰을 껐다 켰다고 토스 것만 이상하다고 그러면 그건 또 더 이상해요 다른 삼성헬스나 다른 만보기 시스템은 서로 걸음수가 차이가 나도 얼마 차이 안나거든요 근데 토스만 5분의 1토막이에요.. 매일 되는지 안되는지 확인하는 것도 귀찮네요 ㅠ,5,2022년
2021년 1월 8일,평소에 유용하게 잘쓰고있습니다. 좋은 서비스 항상 감사드립니다. 여쭈어 보고싶은게 있는데 주식 계좌 잔액확인을 하려할때 해당 어플에서 사용하는 아이디로 로그인을 하라하는데 간편로그인(지문)을 사용하면 아이디가 없어서 지문으로도 로그인 할 수 있도록 연동 해주시면 감사하겠습니다.,5,2021년
2020년 2월 2일,"다좋아요 근데 자동저축되는 돈,날짜를 본인이 정할 수 있으면 좋겠요. 만보기도 전에가 더 좋았는데 바뀌고 나서 복잡해지고, 받을수 있는 돈이 한정적이네요...",4,2020년
2021년 9월 23일,"카드 계좌 내역 클릭했을때, 내역이 날짜별 내림차순으로 잘 정렬되어있었고 모든기간 사용내용을 볼수있었습니다. 그런데 오늘 들어가보니까 이번달 14~22일 내역만 나오고 똑같은 내용이 반복되어서 나오네요. 그 전 날짜 기록은 아예 안나와요. 버그인가요",2,2021년
2019년 2월 24일,무료로 계좌이체를 쉽게할수 있어 좋네요. 이외 여러가지 p2p 투자나 적금같은경우도 합리적인 수준에서 노출되고 제공되는거 같아 만족합니다.,5,2019년
2019년 7월 6일,"안녕하세요 토스 이용하고 있는데, 왜 갑자기 말도 안되게 제 돈이 이상한 곳으로 빠져 나가는 건가요? 자동이체도 시킨적이 없었는데 토스프라임이 뭔가요? 거기로 빠져 나간거 같더라고요. 갑자기 함부로 이체를 하는 앱인가 보죠 이 앱은? 무서워서 이용하기가 꺼렵네요;;",1,2019년
2021년 10월 17일,잘 쓰고 있는데 예전에는 달력 들어가면 +얼마 -얼마해서 실제 사용금을 볼 수 있었는데 지금은 그 기능이 사라져서 아쉬워요 ㅠ 그래도 잘 사용 중입니다!,4,2021년
2022년 3월 26일,참 좋은 앱 같습니다. 그런데 개선되었으면 하는 점 1가지 말씀드립니다. 오픈 뱅킹으로 송금 시 은행 계좌는 송금액 입력 화면에서 출금 가능액 확인이 가능한데 증권 계좌는 획인이 안됩니다. 송금액 입력 화면 이전의 화면에서 출금 가능액 확인이 가능하지만 송금액 입력 화면에서도 확인 가능토록 개선되었으면 좋겠습니다.,5,2022년
2023년 4월 11일,잘사용 하고 있다가 요몇일사이 앱이 열리질 않습니다 삭제하고 다시 깔았는데도 열리지 않아 스토어에서 들어가고 있습니다 불편합니다. 무슨 문제일까요..버그 라고 뜬적이 있었는데..,3,2023년
2023년 4월 11일,하천걷기하는데 위치포인트를 설치하여 방문 포인트 받기 가능토록하였으면 합니다. 좁은도로. 잦은 횡단보도건너기 등 위험요소가 많음. 한가한 위치로 이동 체크할수 있도록 부탁드립니다,3,2023년
2019년 6월 17일,토스앱 정말 잘쓰고있습니다 감사합니다 근데 비상금 모으기라는 기능이있는데 이기능이 비상금으로 쓸려고 모으는건데 눈에 자꾸 보여서 불편합니다 이 기능을 숨겨서 안보이게 할수없을까요 현재 남은 잔액에 포함시키는것도 불편하고여 보기 이런기능 만들어 주시면 진짜 감사하겠습니다,5,2019년
2022년 1월 27일,"무지 좋아요! 처음에 나왔을 때부터 사용중인데, 요즘은 카드나 통장내역을 보면 사용한 시간이 늦게 떠서 그게 불편한 것 빼고는 다 좋아요. 특히 토스프라임이랑 토스뱅크 너무너무 좋은 것 같아요! :)",4,2022년
2021년 11월 12일,"내 계좌관리>자동이체 순서정렬기능 보완 요청 토스계좌를 카드, 전화, 가스등 각종 납부금의 결제계좌로 지정할 수 없어 어쩔 수 없이 지정결제계좌에 결제 당일 토스계좌로부터 자동이체하는 기능을 사용하여 해결하고 있습니다. 그러다 보니 1회성 이체를 포함하여 자동이체되는 건수가 점차 늘어나게 되었는데 현재는 등록한 순서대로 내역을 화면에 표시해 주고 있어 불편합니다. 이들 내역을 일자별 또는 사용자지정 순서대로 정렬할 수 있는 기능이 있었으면 좋겠습니다.",4,2021년
2019년 8월 25일,토스를 가계부처럼사용하고싶은데 더치페이한 돈의 겨우 타임라인에서 수정할수 있는 기능이 있었으면 좋겠습니다. 더치페이를 하는 경우가 많아 실제 카드 사용금액보다 소비가 높게 나오는 경우가 많은것 같습니다,5,2019년
2021년 8월 31일,"많은 기능이 새로 들어오면서 보기도 좋아졌고 개선되었는데, 예전에 있던 카드보기 순서 편집기능이 없어져서 불편합니다. 예금은 그대로 살아있는데.. 사용금액 순으로 나열되다 보니 매달, 매주, 매일 카드 보이는 순서가 바뀔듯 하네요. 이 기능을 되살려 주세요.",4,2021년
2020년 4월 21일,실시간으로 내역을 확인할 수가 없네요 로딩이 예전보다 훨씬 느려진것 같아요. 심하면 하루 지나고 업데이트 될때가 있고 혹은 계좌 비밀번호를 쳐야 업로드 될때가 있어요. 로딩 때문에 잔액이 제대로 확인 되지않아 심장 철렁한적이 너무 많네요,3,2020년
2021년 10월 22일,미션하려고 하면 가끔씩 광고추적제한기능 해제 또는 최신버전 업데이트하라는데 광고추적제한기능이 어딨는지 모르겠네요 설정에는 마케팅수신동의 선택밖에 없던데.. 어딨나요??,3,2021년
2022년 5월 8일,토스에서 수수료 없이 사용할수 있어 넘 조아용~~ 한가지 아쉬운점은 내통장에 내용입력이 안된다는점....ㅠ 받는분은 되는데.. 내가 돈 사용내역을 입력할수 있었음 좋겠어요~~~,4,2022년
2020년 5월 2일,업데이트 하고나서 토스만보기 쓰려면 토스를 눌러서 켜야되는 불편함이 있네요... 원래 알아서 상태표시줄에 고정이 돼있었는데 갑자기 왜 이렇게 됐는지... 넘 불편해요 걷다가 확인하면 토스 만보기 꺼져있어서 안올라가고...,2,2020년
2021년 12월 16일,정말잘쓰고있습니다 계좌 연결 오류와 실시간? 동기화가 부족한것같네요 또한 연결이 이상하게되는것도있고 이부분이 아쉽습니다 토스도 소수점투자가 잘되었으면 합니다,4,2021년
2019년 2월 25일,토스야 말로 스마트폰 어플이란게 무엇인지 제대로 알게해주는 어플인듯합니다 너무 편하고 편하고 편해요 비슷한것들 많이 생겼지만 여전히 토스는 정말 편하네요,5,2019년
2022년 8월 4일,토스의 만보기 기능이 영 좋지 않네요. 갑자기 됐다가 안됐다가 그러더니만 이제는 기기에서 측정할 수 없다는 메세지와 함께 만보기 측정이 안됩니다. 다 좋은데 이 중요한 만보기 기능만 너무 좋지 않아....,1,2022년
2019년 3월 12일,좋은점이 여러가지라 다 쓸 수가 없네요. 간편한 송금은 기본이고 최근에 추가된 타임라인 기능이 아주 맘에 듭니다,5,2019년
2023년 7월 18일,토스카드도 예쁘고 만 7세 까지 토스 부모님 동의만 하면 토스가 바로 가입되서 너무 편하고 좋더라구요!,5,2023년
2022년 7월 25일,편의점에서 토스머니 충전하는기능 생긴거 진짜 너무 좋아요 진짜 완전 짱!! 근데 카카오 mini도 쓰는 사람으로서.. mini도 한눈에 같이 볼수있으면 좋을텐데 안된다하드라구욤..ㅜㅜ 너무 아쉽네요,5,2022년
2020년 3월 15일,정말 다 좋은데 요즘갑자기 토스 화면이 깨지고 오류나고 소비지원금이나 이벤트를 들어가면 화면이 하얘지고 그러는데 빨리 고쳐 주실 수 없나요 너무 불편해서,3,2020년
2021년 10월 18일,잘쓰고있었는데 앱 재설치 이후에 다시 로그인하려고 비밀번호를 입력하면 잠시만 기다려주세요 창이 뜨고 안넘어가요ㅠㅜ 폰 기종은 갤럭시 s21 울트라고 저만 이런 현상이 생기는건지 모르겠네요ㅠ 여러번 지우고 깔아보기도 하고 며칠 기다렸는데도 계속 로그인이 안돼요ㅠㅠ 어떻게 해결할 수 있을까요..,5,2021년
2019년 3월 16일,몇년째 유용하게 쓰고있는데 이번에 지문인식이 잘안돼서 비번창으로 넘어갔는데 비밀번호도 까먹어서 재설정했거든요? 근데 그후로는 지문인증이 안돼요. 지문으로인증 체크해도 바로 체크해제되구요 이유가뭔가요 비번치기 귀찮아죽겠는데.,3,2019년
2018년 9월 30일,토스 정말 편해서 잘 사용중입니다. 근데 UI 바뀌고 계좌순서변경하고 싶어서 찾아도 안보이네요. 계좌순서변경법좀 알려주세요,5,2018년
2021년 11월 24일,"다른 어플들은 다 잘만 되는데,, 아니, 토스 어플 나온지가 언젠데, 아직도 통신이 불안정한거요 ~~~!!! 개 왕짜증!! 이젠 어플 자체가 안 켜지네,,ㅎ 중요한 매수 매도 할려할때마다 다 놓치게 만드네,, 한 두번도 아니고,,''",1,2021년
2019년 10월 17일,업데이트이후 만보기기능과 알림이 제대로 작동하질않네요. 타 앱에선 거의 4천걸음걸었는데 토스는 0걸음입니다.,2,2019년
2019년 2월 25일,신속 정확 쉽게 송금하고 사용이 편리해 아주 좋은 앱입니다. 토스라는 앱이 있는줄 몰랐는데 아들이 사용하기 편한 앱이 있다고 해서 깔았든데 깔때는 좀 힘들었지만 아주 좋습니다..,5,2019년
2022년 1월 11일,업데이트가 안떠서 다른 사례가 있나 리뷰 검색해보니 캐시삭제 하면 뜬다해서 했는데 업뎃 안뜨네요.. 카톡처럼 기기와 최신버전이 호환이 안되는것 같은데... 이러면 쓸 이유가 없죠,3,2022년
2023년 2월 7일,"건의사항: 토스 뱅크 모으기에서 모으기끼리 서로서로 금액 이동이 가능했으면 좋겠어요. 매번 꺼내고 다시 다른 모으기에 넣고, 다른 모으기도 반복하고 하다 보니 조금 번거로워요.",4,2023년
2022년 6월 29일,저는 사용한지 얼마 안됐는대 만보걷기가 위치에서 설정하고 걸으면 그위치에 제대로 방향이 안들어가네요 제가 잘 위치를 못 맞혀서 그런가 지급이 안되는 부분이 좀 아쉽네요,4,2022년
2022년 10월 28일,토스증권은 따로 분리하시는게 어떤가요? 예전에 비해 점점 앱이 무거워지고 버벅거립니다. 특히 증권에 들어가면 앱이 느려지고 버벅거림이 상당합니다. 깊이 논의 바랍니다.,4,2022년
2022년 7월 5일,사용하는데 많이 불편하지 않치만 주변둘러보기 기능이 조금 불편하네요 그위치에 가도 일보다보면 잊어버려 받기 못누르면 지나쳐 버리는 불편함 주변에 왔을때 알림기능이 있음 좋겠네요 아님 자동 적립이라던지 그거땜에 별하나 뺏어요,4,2022년
2023년 7월 3일,업데이트 하지마세요.동영상 광고만 늘어나요 데이타 잡아먹는..예전꺼 쓰고싶네요.,3,2023년
2023년 9월 23일,교통카트를 충전할ㅈ라고해도 안돼고 돈이 얼마 나와있는 지도 늦게 놔와요,1,2023년
2018년 11월 29일,앱 잘 사용하고 있습니다! 그런데 이번 업데이트에서 글꼴은 왜 강제시킨건가요...? 시스템 글꼴을 사용하는걸로 다시 바뀌었으면 좋겠습니다. 그리고 하나랑 신한 토스계좌도 별칭 설정 가능하도록 해주세요 ㅠㅠ,3,2018년
2021년 5월 19일,안드로이드 버전 낮다고 주식 서비스 이용도 못하는 건 무슨 경우인지 모르겠네요. 폰 만드는 놈들은 버전 업데이트 제한 걸어놓고 앱은 일정 버전 이상만 지원하는 거 냄새가 참 구립니다,1,2021년
2023년 10월 3일,이름 바꾸려면 인증하라고 하는데 했거든요? 하고나서 이름 바꾸려니까 더시 인증을 하래요,2,2023년
2023년 5월 8일,토스 어플 작용이 제대로 안되네요. 서버 응답 받지 못했다는 팝업만 뜹니다..,1,2023년
2019년 3월 2일,보유계좌 등록해서 사용중인데 계좌이체 시 정말 편리하네요. 다른사람의 계좌를 구지 몰라도 된다는게 엄청난 편리성을 주네요,5,2019년
2023년 3월 12일,친구와 함께 토스 켜기할 때 블루투스가 켜져있는데도 블루투스 권한을 허용해야 한다는 팝업이 계속 뜨고 허용이 안 됩니다.,3,2023년
2019년 1월 15일,카드 등록을 하려하는데 문자인증으로 진행을 했거든요 그런데 아이디가 없다고 만들라네요? 입력하고 만들어지기만을 기다린게 1시간이 넘도록 안되요...그 뒤로도 5번 넘게 시도해봤으나 안됩니다....기종은 s8입니다,1,2019년
2023년 1월 13일,토스 계속 잘 쓰고 있습니다. 그런데 이번 5.94.1 업데이트 후 토스만보기에 필요한 신체활동 권한을 주니 토스 앱이 실행도 안되고 계속 충돌이 일어나네요... 해결 부탁드립니다,5,2023년
2023년 7월 6일,"너무 이용이 편하고 돈을 보내는 것, 보내주는 것이 너무 편합니다.",5,2023년
2023년 7월 1일,그래서 교통카드 충전기능 언제 되는데 ㅆ련들아 알림 오기를 얼마나 기다리는건지 모르겠네,1,2023년
2022년 10월 14일,토스 혁신의 아이콘입니다. 앱도 정말 보기편하고 이해하기쉽게 만들어놔서 노고를 엿볼수있네요. 카카오뱅크쓰다가 토스 하루이자와 편한 앱환경때문에 토스로 갈아탔어요. 그리고 광고나 알람뜨는것도 다 저한테 도움되는것들이라 좋아요. 토스 최고입니다~♡,5,2022년
2020년 2월 3일,"루팅도 안되어있고 뭐 비슷한것도 안되어있는 잘 쓰던 폰인데 갑자기 루팅했다고 밴 먹고 바쁜와중에 한참 시간걸려서 비대면 본인인증 시켜서 풀게하네요. 지금 장난합니까? 보안 운운할거면 루팅확인이라도 똑바로 하던지, 루팅인지 아닌지 확인 제대로 못할거면 밴 푸는거라도 빠릿하게 하던지, 바쁜 와중 덕분에 더 급해졌네요. 감사합니다^^ 잘 쓰던 어플인데 그냥 은행어플 쓰겠습니다.",1,2020년
2023년 6월 11일,업데이트 무엇이 업데이트 되는지 좀 알려주세요 계속 똑 같은 업데이트 소개글만 떠요.,3,2023년
2021년 12월 16일,아이콘눌러두 실행안될때가 있음... 마음은 급해 죽겠는데 어플이 안켜져서 답답했음... 상담원한테 문의하고나서 지우래서 지웠고 캐시도 삭제했는데 계속또 실행안되고 튕김여,1,2021년
2019년 2월 24일,토스를 통해 환전신청시 9시 이후에는 돈을 찾을 수 없게 해놨네요. 신청 취소를 할 수 있게 해놔야 하는거 아닌가요? 귀국 후에 환환전을 하라니요. 정말 어처구니 없네요. 환전 하실때 시간 정확히 확인하시고 해야할듯요. 취소가 안되는 환전 어플임.,1,2019년
2019년 7월 11일,잘 사용하고 있었는데 앱 실행 안되고 사용중지돼서 고객센터 전화했는데 상담원분이 전화도 바로 받으시고 친절하게 알려주셔서 앱 재설치해서 잘 사용하고 있어요,4,2019년
2022년 1월 8일,이번 업데이트로 인해서 신분증촬영을 다시 했습니다. 계좌내역을 보려면 해당카드를 눌러야는데 누르면 연동한계좌를 선택하라 나오고 동의다하고 계속하기누르면 이미 연결되었다고나오고 이것만 계속 뜨니까 답답하네요ㅡㅡ,2,2022년
2023년 7월 9일,UI 너무 깔끔하구요 뱅킹앱치고 이렇게 편리한 것도 없고 아주 좋슺니다,5,2023년
2021년 7월 18일,"다 좋은데 걷기 미션에서 그 장소에 갔는데도 지급이 안 되는 경우도 있고, 몇 년 전에 없어진 매장이 미션 장소로 뜨기도 해요. 아예 다른 위치에 있는 곳이 뜨기도 하고요. 뺘른 업데이트 부탁드립니다.",5,2021년
2019년 8월 26일,알림설정이 제대로 동작 안합니다. 토스 행운퀴즈 꺼 놨는데 왜 자꾸 상단 노티에 뜨나요? 현재 행운퀴즈 알림 꺼져있고 만보계 기능 알림만 켠 상태입니다.,3,2019년
2023년 6월 6일,친구와 함께 토스켜기한때 전구표시도 안들어오고 사람들도 잘 안들어옵니다,1,2023년
2019년 10월 16일,"계좌, 카드 지출내역을 한번에 확인할 수 있어서 좋았는데요. 수요일 송금지원금 알림이 계속 오는데 알림 꺼지지가 않아서 불편하네요. 모든 알림 해제했는데도 계속 알림이 오네요. 일단 당분간 삭제해 놓으려구요.",3,2019년
